"Display Order","Product Details","ASIN","URL","Image URL","Brand","Price  ₹","Sales","Variation Sales Strength (1 - 10)","Recent Purchases","Revenue","Title Char. Count","BSR","Seller Country/Region","Fees  ₹","Active Sellers","Ratings","Review Count","Images","Review velocity","Buy Box","Category","Size Tier","Fulfillment","Dimensions","Weight","ABA Most Clicked","Creation Date","Sponsored","Best Seller","Seller Age (mo)","Seller"
1.,"Billebon Premium Neck Pillow for Travelling Airplane Travel Pillow Comfortable Head Rest Neck Holder Pillow (Grey)","B082F88NKP","https://www.amazon.in/dp/B082F88NKP?psc=1","https://m.media-amazon.com/images/I/81fBDyL6+KL._SX679_.jpg","Billebon",201,"N/A",0,"3,000","N/A",114,7,"N/A","N/A",2,3.9,"15,292","N/A","N/A","RetailEZ Pvt Ltd","Bags, Wallets and Luggage","N/A","FBA","N/A","N/A","N/A","N/A",,"No","N/A","RetailEZ Pvt Ltd"
2.,"Trajectory Travel Neck Pillow for Travelling and Sleeping in Airplane Flight, Cab, Car, Train, Bus for Men and Women Grey (As seen on Shark Tank)","B0FPDLT1CC","https://www.amazon.in/dp/B0FPDLT1CC?psc=1","https://m.media-amazon.com/images/I/51g5CjQBYCL._SX425_.jpg","Trajectory",201,"N/A",0,"1,000","N/A",145,19,"N/A","N/A",1,3.9,"14,534","N/A","N/A","RetailEZ Pvt Ltd","Bags, Wallets and Luggage","N/A","FBA","N/A","N/A","N/A","N/A",,"No","N/A","RetailEZ Pvt Ltd"
3.,"Amazon Basics Memory Foam Travel Neck Pillow with Eye Mask & Ear Plugs Combo|Ultra Soft Velvet Fabric|Ergonomically Designed for Ultimate Comfort for Air, Car, Train, Bus Travel- Black, Standard Size","B0C7BM18PB","https://www.amazon.in/dp/B0C7BM18PB?psc=1","https://m.media-amazon.com/images/I/71gqZE6HL+L._SX450_.jpg","amazon basics",359,"N/A",0,800,"N/A",199,29,"N/A","N/A",1,4.1,"10,681","N/A","N/A","ETrade Online","Bags, Wallets and Luggage","N/A","FBA","N/A","N/A","N/A","N/A",,"No","N/A","ETrade Online"
4.,"Frido Travel Neck Pillow, 100% Hi-Per Foam, Lightweight Neck Support Pillow, Neck Pillow for Flight Travel, Memory Foam, Adjustable Velcro Straps, Free Travel Pouch (Core Black)","B0DMKCT2C5","https://www.amazon.in/dp/B0DMKCT2C5?psc=1","https://m.media-amazon.com/images/I/61ktHYSbSIL._SX466_.jpg","Frido","1,498","N/A",0,700,"N/A",177,42,"N/A","N/A",2,4.1,914,"N/A","N/A","ETrade Online","Bags, Wallets and Luggage","N/A","FBA","N/A","N/A","N/A","N/A",,"No","N/A","ETrade Online"
5.,"Billebon Gel Infused Memory Foam Neck Pillow, Travel Pillow with Adjustable Velcro Straps, Neck Pillow for Travelling & Flight Travel, Ergonomic Support for Comfort & Pain Relief(Grey Combo)","B0FJ69MJ5Y","https://www.amazon.in/dp/B0FJ69MJ5Y?psc=1","https://m.media-amazon.com/images/I/71w8XDSAWsL._SY355_.jpg","Billebon",699,"N/A",0,500,"N/A",190,51,"N/A","N/A",1,4.2,123,"N/A","N/A","RetailEZ Pvt Ltd","Bags, Wallets and Luggage","N/A","FBA","N/A","N/A","N/A","N/A",,"No","N/A","RetailEZ Pvt Ltd"
6.,"Trajectory Travel Neck Pillow for Travelling and Sleeping in Airplane Flight, Cab, Car, Train, Bus for Men and Women Blue (As seen on Shark Tank)","B0FPDLDY86","https://www.amazon.in/dp/B0FPDLDY86?psc=1","https://m.media-amazon.com/images/I/51x1gS6JeuL._SX425_.jpg","Trajectory",298,"N/A",0,"1,000","N/A",145,55,"N/A","N/A",1,3.8,"4,294","N/A","N/A","RetailEZ Pvt Ltd","Bags, Wallets and Luggage","N/A","FBA","N/A","N/A","N/A","N/A",,"No","N/A","RetailEZ Pvt Ltd"
7.,"Polyester Comfort Ultralight Inflatable By Pressing Air Pillow - Compact, Ergonomic Pillow For Neck Head Lumbar Support For Travel, Camping, Home, Office.(Multicolor)","B0F2HZPRZ6","https://www.amazon.in/dp/B0F2HZPRZ6?psc=1","https://m.media-amazon.com/images/I/31OQQKcvEDL._SX679_.jpg","Brienstripe",379,"N/A",0,700,"N/A",166,176,"N/A","N/A",1,4.3,271,"N/A","N/A","Brienstripe","Bags, Wallets and Luggage","N/A","FBA","N/A","N/A","N/A","N/A",,"No","N/A","Brienstripe"
8.,"FLYNGO Memory Foam Neck Pillow for Travel Neck Support Pillow with Rest Eye Mask, Noise Isolating Ear Plugs Portable Combo (Black, pack of 1)","B0BQC5VYV8","https://www.amazon.in/dp/B0BQC5VYV8?psc=1","https://m.media-amazon.com/images/I/81h0-2f8dCL._SY450_.jpg","FLYNGO",499,"N/A",0,700,"N/A",141,197,"N/A","N/A",1,4.1,737,"N/A","N/A","SHREE Retails","Bags, Wallets and Luggage","N/A","FBA","N/A","N/A","N/A","N/A",,"No","N/A","SHREE Retails"
9.,"ADOFYS Neck Pillow for Travelling Memory Foam, Comfortable & Supportive, Pain Relief Sleeping Travel Neck Pillow, Airplane Pillow for Sleeping in Flight, Car, Office and Home","B081RQZ1FG","https://www.amazon.in/dp/B081RQZ1FG?psc=1","https://m.media-amazon.com/images/I/51Xanhl3m4L._SX425_.jpg","ADOFYS",652,"N/A",0,300,"N/A",174,223,"N/A","N/A",1,4,"3,333","N/A","N/A","Adofys India-(Customer Happiness Is Top Priority)","Bags, Wallets and Luggage","N/A","FBA","N/A","N/A","N/A","N/A",,"No","N/A","Adofys India-(Customer Happiness Is Top Priority)"
10.,"Billebon Premium Fiber Filled Neck Pillow, Aeroplane Travel Pillow Neck Adjustable 360 Degree Support Headrest Neck Support Comfortable Pillow with Eye Mask","B0CF1PXZK5","https://www.amazon.in/dp/B0CF1PXZK5?psc=1","https://m.media-amazon.com/images/I/617nFkso7OL._SY355_.jpg","Billebon",257,"N/A",0,"N/A","N/A",156,247,"N/A","N/A",3,3.8,950,"N/A","N/A","RetailEZ Pvt Ltd","Bags, Wallets and Luggage","N/A","FBA","N/A","N/A","N/A","N/A",,"No","N/A","RetailEZ Pvt Ltd"
11.,"Duckback Foam Brown Travel Pillow, Standard, ( Pack Of 1 )","B01IF15BDG","https://www.amazon.in/dp/B01IF15BDG?psc=1","https://m.media-amazon.com/images/I/51NM9GFCZ7L._SY879_.jpg","Duckback",240,"N/A",0,700,"N/A",58,259,"N/A","N/A",1,4,"1,623","N/A","N/A","Hindustan Industries","Bags, Wallets and Luggage","N/A","FBA","N/A","N/A","N/A","N/A",,"No","N/A","Hindustan Industries"
12.,"Dr.Ortho Orthopaedic Car Neck Rest Cushion Pillows, Memory Foam Car Seat Head Rest Pillow for Neck and Cervical, Support Relieves Pain & Muscle, Ultrasoft Pillow for Comfortable Car Rides","B0D2DKGWJH","https://www.amazon.in/dp/B0D2DKGWJH?psc=1","https://m.media-amazon.com/images/I/51SC2PWbu0L._SX679_.jpg","Dr.Ortho",680,"N/A",0,300,"N/A",187,335,"N/A","N/A",1,4.2,234,"N/A","N/A","Deerghayurveda","Bags, Wallets and Luggage","N/A","FBA","N/A","N/A","N/A","N/A",,"No","N/A","Deerghayurveda"
13.,"Car Seat Headrest Neck Rest Cushion | Car Neck Rest Pillow for Neck & Cervical Support Memory Foam Neck Pillow with Washable Cover Ergonomic Neck Pain Relief for Driver Front & Back Office Chair","B0DCW6589Y","https://www.amazon.in/dp/B0DCW6589Y?psc=1","https://m.media-amazon.com/images/I/6148KzBxk5L._SX679_.jpg","AGFP",375,"N/A",0,400,"N/A",194,352,"N/A","N/A",1,4,287,"N/A","N/A","AGFP® Store","Bags, Wallets and Luggage","N/A","FBA","N/A","N/A","N/A","N/A",,"No","N/A","AGFP® Store"
14.,"ALN® Premium Velvet Travel Neck Pillow for Travelling and Sleeping in Airplane Flight, Cab, Car, Train, Bus for Men and Women Head Rest Neck Holder Pillow for Pain Relief","B0G1HHLLLL","https://www.amazon.in/dp/B0G1HHLLLL?psc=1","https://m.media-amazon.com/images/I/71Znq4i330L._SX355_.jpg","ALN",229,"N/A",0,400,"N/A",170,423,"N/A","N/A",1,4.8,21,"N/A","N/A","ALN TRADERS","Bags, Wallets and Luggage","N/A","FBA","N/A","N/A","N/A","N/A",,"No","N/A","ALN TRADERS"
15.,"MeeTo Rubberized Cotton Small Squared Travel Flocked Fabric Air Pillow, Compact, Comfortable and Inflatable, Used for Neck & Lumbar Support, Camping and Hiking, Blue Color - Pack of 2","B0BNFXW5SL","https://www.amazon.in/dp/B0BNFXW5SL?psc=1","https://m.media-amazon.com/images/I/61DT2H5s3JL._SX450_.jpg","MeeTo",179,"N/A",0,400,"N/A",183,429,"N/A","N/A",2,3.5,345,"N/A","N/A","MAKING POSSIBLE","Bags, Wallets and Luggage","N/A","FBA","N/A","N/A","N/A","N/A",,"No","N/A","MAKING POSSIBLE"
16.,"Velvet Air Pillow Cushion Sleeping Bag Backpacking Pillow Soft Comfortable Air Inflatable Travel Pillow Tourist Pillow (Blue) (Pack of 2)","B07R58HC4R","https://www.amazon.in/dp/B07R58HC4R?psc=1","https://m.media-amazon.com/images/I/51ksLur2WKL._SX679_.jpg","Liznoriz",289,"N/A",0,300,"N/A",137,478,"N/A","N/A",2,3.7,"3,303","N/A","N/A","Liznoriz","Bags, Wallets and Luggage","N/A","FBA","N/A","N/A","N/A","N/A",,"No","N/A","Liznoriz"
17.,"Travel Neck Pillow - 100% Memory Foam Neck Support Pillow for Flight Travel, Adjustable Velcro Straps, Includes Eye Mask & Noise Isolating Ear Plugs with Free Travel Pouch | Velvet Black","B0FW5FB1T8","https://www.amazon.in/dp/B0FW5FB1T8?psc=1","https://m.media-amazon.com/images/I/31SGkS6FbcL._SX425_.jpg","kossto",498,"N/A",0,200,"N/A",186,486,"N/A","N/A",1,4,44,"N/A","N/A","ETrade Online","Bags, Wallets and Luggage","N/A","FBA","N/A","N/A","N/A","N/A",,"No","N/A","ETrade Online"
18.,"Trajectory Travel Neck Pillow Memory Foam for Sleeping in Airplane Flight, Cab, Car, Train, Bus for Men and Women Black (As seen on Shark Tank)","B0FWKSKMRY","https://www.amazon.in/dp/B0FWKSKMRY?psc=1","https://m.media-amazon.com/images/I/41Jc+76s23L._SY355_.jpg","Trajectory",499,"N/A",0,100,"N/A",143,531,"N/A","N/A",1,4,139,"N/A","N/A","RetailEZ Pvt Ltd","Bags, Wallets and Luggage","N/A","FBA","N/A","N/A","N/A","N/A",,"No","N/A","RetailEZ Pvt Ltd"
19.,"MOKOBARA The Travel Pillow Pure Memory Foam Neck Pillow, Comfortable and Breathable Cover, Machine Washable, Airplane Travel Kit (Seize The Gray)","B0BVZPR2KW","https://www.amazon.in/dp/B0BVZPR2KW?psc=1","https://m.media-amazon.com/images/I/71E7cJ4ZfdL._SY450_.jpg","MOKOBARA","1,799","N/A",0,300,"N/A",145,532,"N/A","N/A",2,4.2,"1,240","N/A","N/A","MOKOBARA LIFESTYLE PRIVATE LIMITED","Bags, Wallets and Luggage","N/A","FBA","N/A","N/A","N/A","N/A",,"No","N/A","MOKOBARA LIFESTYLE PRIVATE LIMITED"
20.,"Dr.Ortho Orthopaedic 360 Travel Neck Rest, Neck Pillow for Travel, Travel Pillow for Neck & Head Support, Travel Neck Pillow for Car, Flights","B0DNZG8F52","https://www.amazon.in/dp/B0DNZG8F52?psc=1","https://m.media-amazon.com/images/I/41VvSdk3QxL._SX679_.jpg","Dr.Ortho",649,"N/A",0,300,"N/A",141,534,"N/A","N/A",1,4.1,84,"N/A","N/A","Deerghayurveda","Bags, Wallets and Luggage","N/A","FBA","N/A","N/A","N/A","N/A",,"No","N/A","Deerghayurveda"
21.,"Car Neck Pillow, Neck Pain Relief for Long Drive Car Seat Back Head Rest Memory Foam Pillow for Driving with Adjustable Strap, and Breathable Removable Cover (Brown)(1pcs)","B0DC57HVBL","https://www.amazon.in/dp/B0DC57HVBL?psc=1","https://m.media-amazon.com/images/I/31UwtAZLe7L._SX466_.jpg","CRENTILA",399,"N/A",0,100,"N/A",171,559,"N/A","N/A",1,3.9,429,"N/A","N/A","CRENTILA","Bags, Wallets and Luggage","N/A","FBA","N/A","N/A","N/A","N/A",,"No","N/A","CRENTILA"
22.,"Billebon Memory Foam Neck Pillow with Cooling Gel, Snake Shape Travel Pillow with Snap Button, Neck Rest for Travelling & Flight Travel, Ergonomic Support for Comfort & Pain Relief (Black)","B0DYXWPSSR","https://www.amazon.in/dp/B0DYXWPSSR?psc=1","https://m.media-amazon.com/images/I/71i4pnGpFkL._SX522_.jpg","Billebon",219,"N/A",0,400,"N/A",188,611,"N/A","N/A",1,4,135,"N/A","N/A","RetailEZ Pvt Ltd","Bags, Wallets and Luggage","N/A","FBA","N/A","N/A","N/A","N/A",,"No","N/A","RetailEZ Pvt Ltd"
23.,"ProQ Neck Pillow for Travelling – Comfortable Memory Foam Cushion, Ergonomic U-Shape Support, Portable Flight Accessory, Compact Lightweight Design, Washable Cover Included, Black","B08TT94M97","https://www.amazon.in/dp/B08TT94M97?psc=1","https://m.media-amazon.com/images/I/71MRlqscjgL._SY450_.jpg","ProQ",649,"N/A",0,100,"N/A",179,673,"N/A","N/A",1,4,"2,233","N/A","N/A","Elektromart","Bags, Wallets and Luggage","N/A","FBA","N/A","N/A","N/A","N/A",,"No","N/A","Elektromart"
24.,"Boldfit Neck Pillow for Travelling, Memory Foam U-Shape Travel Pillow with Adjustable Strap & Washable Cover, Ergonomic Neck Support Pillow for Flight, Car, Office & Home Use, Lightweight & Comfortable","B0DVYPR16S","https://www.amazon.in/dp/B0DVYPR16S?psc=1","https://m.media-amazon.com/images/I/7162iEOGmAL._SY450_.jpg","Boldfit",699,"N/A",0,50,"N/A",201,857,"N/A","N/A",1,4.6,122,"N/A","N/A","RetailEZ Pvt Ltd","Bags, Wallets and Luggage","N/A","FBA","N/A","N/A","N/A","N/A",,"No","N/A","RetailEZ Pvt Ltd"
25.,"The Sleep Company Travel Neck Pillow | PU Latex | Neck Support| Perfect For Flights, Car, Train and Bus Journeys | Dual Height Design | Compact Zippered Case | Light Weight | Adjustable Velcro | Black","B0GFLCQ51R","https://www.amazon.in/dp/B0GFLCQ51R?psc=1","https://m.media-amazon.com/images/I/51USygTbV1L._SX522_.jpg","The Sleep Company","1,499","N/A",0,50,"N/A",200,974,"N/A","N/A",1,4.7,20,"N/A","N/A","The Sleep Company","Bags, Wallets and Luggage","N/A","FBA","N/A","N/A","N/A","N/A",,"No","N/A","The Sleep Company"
26.,"Lifelong Neck Pillow for Travelling | Memory Foam Neck Rest for Sleeping in Airplane & Car | Soft & Comfortable Neck Support | Adjustable Velcro Straps & Travel Pouch | Ideal for Office & Home (Grey)","B0FWCPXN3Y","https://www.amazon.in/dp/B0FWCPXN3Y?psc=1","https://m.media-amazon.com/images/I/71NYokwwkuL._SX466_.jpg","Lifelong",799,"N/A",0,40,"N/A",199,985,"N/A","N/A",1,5,10,"N/A","N/A","ETrade Online","Bags, Wallets and Luggage","N/A","FBA","N/A","N/A","N/A","N/A",,"No","N/A","ETrade Online"
27.,"Inflatable Foot Rest Pillow with Innovative Pump Nozzle – Portable Travel Leg Support for Kids & Adults, Airplane Bed for Toddlers, Office, Car, Camping – No Mouth Blow (Blue)","B0BC8QL5VV","https://www.amazon.in/dp/B0BC8QL5VV?psc=1","https://m.media-amazon.com/images/I/61bq2dpqB0L._SX425_.jpg","The AutoStory","1,595","N/A",0,50,"N/A",175,"1,068","N/A","N/A",1,4.2,41,"N/A","N/A","The AutoStory","Bags, Wallets and Luggage","N/A","FBA","N/A","N/A","N/A","N/A",,"No","N/A","The AutoStory"
28.,"Duckback Polyester Travel Pillow(Green_Purple Pillow), Standard","B073CNGBZC","https://www.amazon.in/dp/B073CNGBZC?psc=1","https://m.media-amazon.com/images/I/816jCNCLJEL._SY879_.jpg","Duckback",232,"N/A",0,200,"N/A",63,"1,076","N/A","N/A",1,4,"2,096","N/A","N/A","Hindustan Industries","Bags, Wallets and Luggage","N/A","FBA","N/A","N/A","N/A","N/A",,"No","N/A","Hindustan Industries"
29.,"Travel Neck Pillow | Premium Memory Foam Neck Pillow for Flight Travel, Car Sleeping | Adjustable Head Rest, Neck Rest Travelling Pillow for Sleeping Head Support","B0F3TW7T49","https://www.amazon.in/dp/B0F3TW7T49?psc=1","https://m.media-amazon.com/images/I/71wl+U0qU3L._SX679_.jpg","CareFoam",788.98,"N/A",0,50,"N/A",162,"1,113","N/A","N/A",1,4.2,248,"N/A","N/A","ETrade Online","Bags, Wallets and Luggage","N/A","FBA","N/A","N/A","N/A","N/A",,"No","N/A","ETrade Online"
30.,"(Pack of 2 Car Neck Rest Pillow Memory Foam Neck Pillow for Car, Car Seat Head Rest Cushion for Neck & Cervical Support - Relieves Neck Pain (Medium, Black) (2 PCS)","B0F9FQCXP6","https://www.amazon.in/dp/B0F9FQCXP6?psc=1","https://m.media-amazon.com/images/I/71VtCg4JvSL._SX425_.jpg","Gipibox",799,"N/A",0,300,"N/A",164,"1,147","N/A","N/A",2,3.6,7,"N/A","N/A","SHYAM ENTERPRISE......","Bags, Wallets and Luggage","N/A","FBA","N/A","N/A","N/A","N/A",,"No","N/A","SHYAM ENTERPRISE......"
31.,"Lifelong Neck Rest Pillow for Travelling | Memory Foam Pillow for Sleeping in Airplane & Car | Soft & Comfortable Neck Support with Eye Mask, Ear Plugs & Travel Pouch |Ideal for Office & Home (Black)","B0FWCQSCTD","https://www.amazon.in/dp/B0FWCQSCTD?psc=1","https://m.media-amazon.com/images/I/617+5sXcJcL._SX466_.jpg","Lifelong",749,"N/A",0,50,"N/A",199,"1,242","N/A","N/A",1,5,10,"N/A","N/A","ETrade Online","Bags, Wallets and Luggage","N/A","FBA","N/A","N/A","N/A","N/A",,"No","N/A","ETrade Online"
32.,"Inflatable Air Travel Pillow Long Travel Footstool Seat Foot Rest Pillow Foldable for Flight Home Office Footstool Self-inflatable Air for Adult Kids","B0BJVP7TYV","https://www.amazon.in/dp/B0BJVP7TYV?psc=1","https://m.media-amazon.com/images/I/51ac3LqPNnL._SX425_.jpg","HANNEA","1,133","N/A",0,100,"N/A",149,"1,369","N/A","N/A",1,3.9,210,"N/A","N/A","WeBanga","Bags, Wallets and Luggage","N/A","FBA","N/A","N/A","N/A","N/A",,"No","N/A","WeBanga"
33.,"Memory Foam Travel Pillow for Neck Pain Relief, Includes Eye Mask & Noise Isolating Ear Plugs, Portable Combo for Men & Women, Ideal for Long Flights & Road Trips | Velvet Black","B0FWC36DYF","https://www.amazon.in/dp/B0FWC36DYF?psc=1","https://m.media-amazon.com/images/I/61ofGiiubhL._SX569_.jpg","kossto",499,"N/A",0,100,"N/A",177,"1,383","N/A","N/A",1,4.7,20,"N/A","N/A","ETrade Online","Bags, Wallets and Luggage","N/A","FBA","N/A","N/A","N/A","N/A",,"No","N/A","ETrade Online"
34.,"Billebon Neck Pillow for Travel – Cool-Gel Infused Memory Foam Support, U-Shape Ergonomic Design, Portable for Flight Journeys, Lightweight Compact Build, Soft Washable Cover (Black)","B0DTTNPF59","https://www.amazon.in/dp/B0DTTNPF59?psc=1","https://m.media-amazon.com/images/I/71Xyf4VxmKL._SX522_.jpg","Billebon",499,"N/A",0,20,"N/A",182,"1,396","N/A","N/A",2,4,216,"N/A","N/A","RetailEZ Pvt Ltd","Bags, Wallets and Luggage","N/A","FBA","N/A","N/A","N/A","N/A",,"No","N/A","RetailEZ Pvt Ltd"
35.,"Billebon Extra Soft Memory Foam Luxury Travel Neck Support Rest Pillow with Soft Washable & Removable Cover, Multipurpose Comfortable Travel Pillow for Airplane (Navy Blue Raised with Eye Mask)","B0CBRXY4BW","https://www.amazon.in/dp/B0CBRXY4BW?psc=1","https://m.media-amazon.com/images/I/61dwn6o0UBL._SY450_.jpg","Billebon",549,"N/A",0,50,"N/A",193,"1,492","N/A","N/A",2,4,453,"N/A","N/A","SMR.","Bags, Wallets and Luggage","N/A","FBA","N/A","N/A","N/A","N/A",,"No","N/A","SMR."
36.,"CARIZO Ergonomic Car Headrest Pillow - Pack of 2 - Travel in Comfort with Adjustable Support - Ideal for Long Drives! (Black)","B0C17LN8QV","https://www.amazon.in/dp/B0C17LN8QV?psc=1","https://m.media-amazon.com/images/I/61qn3C-ugGL._SX679_.jpg","CARIZO","1,699","N/A",0,40,"N/A",125,"1,559","N/A","N/A",1,4.1,155,"N/A","N/A","CYNOR INDIA","Bags, Wallets and Luggage","N/A","FBA","N/A","N/A","N/A","N/A",,"No","N/A","CYNOR INDIA"
37.,"Shivam cart Pack of 2 PCs Brown Color Cotton Air Pillow with air Pump. Travel Pillow for Train, Flight and Bus.(Brown Color)","B0BH91C2LJ","https://www.amazon.in/dp/B0BH91C2LJ?psc=1","https://m.media-amazon.com/images/I/61UtQMs7EiL._SY879_.jpg","Generic",479,"N/A",0,50,"N/A",124,"1,562","N/A","N/A",1,4.1,155,"N/A","N/A","SHIVAM CART.","Bags, Wallets and Luggage","N/A","FBA","N/A","N/A","N/A","N/A",,"No","N/A","SHIVAM CART."
38.,"HURRYSHOPPY Travel Pillow for Train Sleeping Air Inflammable Velvet Neck Air Pillow for Soft Comfort Camping Tourist Pillow Ultralight Portable Backpacking Family Tour (1)","B0C3HZM4WS","https://www.amazon.in/dp/B0C3HZM4WS?psc=1","https://m.media-amazon.com/images/I/6110Ic2WezL._SY450_.jpg","HURRYSHOPPY",159,"N/A",0,100,"N/A",171,"1,597","N/A","N/A",1,3.4,37,"N/A","N/A","HURRYSHOPPY","Bags, Wallets and Luggage","N/A","FBA","N/A","N/A","N/A","N/A",,"No","N/A","HURRYSHOPPY"
39.,"Velvet Air Inflatable Travel Pillow (Blue) (Pack of 2) - Soft, Comfortable, Portable, Ideal for Travel, Camping, Hiking, Beach Vacation","B0DC4KT9R1","https://www.amazon.in/dp/B0DC4KT9R1?psc=1","https://m.media-amazon.com/images/I/71TrGx2IJBL._SX679_.jpg","BAREPEPE",259,"N/A",0,100,"N/A",135,"1,623","N/A","N/A",1,3.4,75,"N/A","N/A","BAREPEPE®","Bags, Wallets and Luggage","N/A","FBA","N/A","N/A","N/A","N/A",,"No","N/A","BAREPEPE®"
40.,"Travel Neck Pillow, Premium Memory Foam Travel Pillow for Flights, Ergonomic Neck Support Cushion, Lightweight & Washable Cover, Compact Carry Pouch (Grey)","B0GKNXP38N","https://www.amazon.in/dp/B0GKNXP38N?psc=1","https://m.media-amazon.com/images/I/71qWlacF32L._SY450_.jpg","SHAAFLY","1,299","N/A",0,"N/A","N/A",155,"1,667","N/A","N/A",1,5,2,"N/A","N/A","JMSS Enterprises","Bags, Wallets and Luggage","N/A","FBA","N/A","N/A","N/A","N/A",,"No","N/A","JMSS Enterprises"
41.,"Duckback Cotton Rubberised Air Travel Pillow (Khakhi), One size","B01MZZ1L8N","https://www.amazon.in/dp/B01MZZ1L8N?psc=1","https://m.media-amazon.com/images/I/51NM9GFCZ7L._SY879_.jpg","Duckback",285,"N/A",0,100,"N/A",63,"1,693","N/A","N/A",2,4,"4,155","N/A","N/A","3GSAFETECH","Bags, Wallets and Luggage","N/A","FBA","N/A","N/A","N/A","N/A",,"No","N/A","3GSAFETECH"
42.,"Memory Foam Car Neck Rest Pillow Seat Cushion Headrest Ergonomic Neck Support Help Relieve Neck Pain for Driver Front Back Seat, Office Chair, Fit Most Vehicles (Black Pack of 1)","B0BGMNBSVT","https://www.amazon.in/dp/B0BGMNBSVT?psc=1","https://m.media-amazon.com/images/I/51TiQI1IMxL._SX679_.jpg","N2K2 ENTERPRISE",469,"N/A",0,50,"N/A",178,"1,777","N/A","N/A",2,4,913,"N/A","N/A","Nijek Store","Bags, Wallets and Luggage","N/A","FBA","N/A","N/A","N/A","N/A",,"No","N/A","Nijek Store"
43.,"Neck Pillow for Travelling - Gel Memory Foam Travel Pillow with Adjustable Straps, Washable Cover for Airplane, Car, Train - Ultimate Comfort & Support for Neck Pain Relief Smokey Velvet Grey","B0FYHJ3831","https://www.amazon.in/dp/B0FYHJ3831?psc=1","https://m.media-amazon.com/images/I/71cVOQ+jGNL._SY355_.jpg","ORTHICO",998,"N/A",0,"N/A","N/A",191,"1,872","N/A","N/A",1,4.2,32,"N/A","N/A","ORTHICO","Bags, Wallets and Luggage","N/A","FBA","N/A","N/A","N/A","N/A",,"No","N/A","ORTHICO"
44.,"Inflatable Travel Foot Rest Pillow – 3-Layer Adjustable Height Leg Rest for Airplane, Car, Office & Toddler Flight Bed – Soft Flocked PVC, Portable with Pump & Dust Bag (Grey)","B0B4W2RC8J","https://www.amazon.in/dp/B0B4W2RC8J?psc=1","https://m.media-amazon.com/images/I/61pkn47DSPL._SY450_.jpg","The AutoStory","1,395","N/A",0,20,"N/A",175,"1,885","N/A","N/A",1,4,52,"N/A","N/A","The AutoStory","Bags, Wallets and Luggage","N/A","FBA","N/A","N/A","N/A","N/A",,"No","N/A","The AutoStory"
45.,"PALAY® Inflatable Travel Pillow, Inflatable Neck Air Pillow for Sleeping, Support Head, Chin, Neck and Lumbar, Avoid Neck & Shoulder Pain, Comfortable for Airplane, Car, Polyvinyl Chloride, Grey","B0B5RGZ291","https://www.amazon.in/dp/B0B5RGZ291?psc=1","https://m.media-amazon.com/images/I/51RJczboE3L._SX466_.jpg","PALAY",999,"N/A",0,50,"N/A",194,"1,893","N/A","N/A",1,3.9,85,"N/A","N/A","WeBanga","Bags, Wallets and Luggage","N/A","FBA","N/A","N/A","N/A","N/A",,"No","N/A","WeBanga"
46.,"SLOVIC Neck Pillow for Travelling | Premium Memory Foam Pillow for Flight, Car, Bus, Train | 360° Neck Support with Soft Fabric | Travel Accessories | Includes Carrying Bag","B0FF4ZDRYP","https://www.amazon.in/dp/B0FF4ZDRYP?psc=1","https://m.media-amazon.com/images/I/61BAUP6UVTL._SY450_.jpg","SLOVIC",499,"N/A",0,100,"N/A",172,"1,941","N/A","N/A",1,4.2,36,"N/A","N/A","PHBrands","Bags, Wallets and Luggage","N/A","FBA","N/A","N/A","N/A","N/A",,"No","N/A","PHBrands"
47.,"upsimples Car Seat Headrest Neck Rest Cushion, Car Neck Pillow Durable 100% Pure Memory Foam Neck Pillow With Breathable Removable Cover, Comfortable Ergonomic & Neck Pain Relief(Pack Of 2, Black)","B0CR5S3221","https://www.amazon.in/dp/B0CR5S3221?psc=1","https://m.media-amazon.com/images/I/41U50wP2OHL._SX466_.jpg","upsimples",749,"N/A",0,40,"N/A",196,"1,981","N/A","N/A",2,3.8,287,"N/A","N/A","upsimples","Bags, Wallets and Luggage","N/A","FBA","N/A","N/A","N/A","N/A",,"No","N/A","upsimples"
48.,"Velvet Soft car Neck Pillow for Travel, Travel Micro Fiber Rest Pillow/Cushion Set of Pillows Compatible with All Cars - Pack of 2 Pieces (Black)","B0F99XLX17","https://www.amazon.in/dp/B0F99XLX17?psc=1","https://m.media-amazon.com/images/I/51jLbQbboPL._SX569_.jpg","AUTOUNIKO",399,"N/A",0,100,"N/A",145,"2,008","N/A","N/A",1,4.7,32,"N/A","N/A","AUTOUNIKO","Bags, Wallets and Luggage","N/A","FBA","N/A","N/A","N/A","N/A",,"No","N/A","AUTOUNIKO"
49.,"Car Neck Pillow, Neck Pain Relief for Long Drive Car Seat Back Head Rest Memory Foam for Driving with Adjustable Strap, and Breathable Removable Cover (Pillow) (Brown)","B0CVV3RPP1","https://www.amazon.in/dp/B0CVV3RPP1?psc=1","https://m.media-amazon.com/images/I/4193VtuJIvL._SY450_.jpg","CRENTILA",399,"N/A",0,50,"N/A",167,"2,075","N/A","N/A",1,3.8,358,"N/A","N/A","CRENTILA","Bags, Wallets and Luggage","N/A","FBA","N/A","N/A","N/A","N/A",,"No","N/A","CRENTILA"
50.,"FUR JADEN Memory Foam Luxury Travel Neck Support Rest Pillow Eye Mask, Noise Isolating Ear Plugs Portable Combo (Black)","B09KNPF1Z6","https://www.amazon.in/dp/B09KNPF1Z6?psc=1","https://m.media-amazon.com/images/I/81BeUxDqhyL._SX425_.jpg","FUR JADEN","N/A","N/A",0,"N/A","N/A",119,"2,153","N/A","N/A",1,4.2,"1,354","N/A","N/A",,"Bags, Wallets and Luggage","N/A","N/A","N/A","N/A","N/A","N/A",,"No","N/A",
51.,"Sleepsia Memory Foam Travel Pillow for Neck Support – Soft Washable Cover | Compact Neck Pillow for Airplane, Car & Home Use | Ergonomic Support for Sleeping & Long Travel","B0CYT6587X","https://www.amazon.in/dp/B0CYT6587X?psc=1","https://m.media-amazon.com/images/I/71mhokLrtXL._SY450_.jpg","Sleepsia",698,"N/A",0,50,"N/A",171,"2,211","N/A","N/A",2,3.9,160,"N/A","N/A","ETrade Online","Bags, Wallets and Luggage","N/A","FBA","N/A","N/A","N/A","N/A",,"No","N/A","ETrade Online"
52.,"Duckback Solid Air Pillow Pack of 1 (Beige)","B073CNWLGN","https://www.amazon.in/dp/B073CNWLGN?psc=1","https://m.media-amazon.com/images/I/61klRqUI5vL._SX425_.jpg","Duckback",135,"N/A",0,20,"N/A",43,"2,285","N/A","N/A",2,3.7,145,"N/A","N/A","SUMANGALAM RETAILERS PVT LTD","Bags, Wallets and Luggage","N/A","FBA","N/A","N/A","N/A","N/A",,"No","N/A","SUMANGALAM RETAILERS PVT LTD"
53.,"Air Inflatable Velvet Travel Neck Pillow for Backpacking, Family Tour, Children and Babies, Blue (2)","B0FK59TR3P","https://www.amazon.in/dp/B0FK59TR3P?psc=1","https://m.media-amazon.com/images/I/51Hmkz8x5YL._SX466_.jpg","Flipzy",199,"N/A",0,10,"N/A",100,"2,302","N/A","N/A",3,4,25,"N/A","N/A","DWARIKADHISH FASHION","Bags, Wallets and Luggage","N/A","FBA","N/A","N/A","N/A","N/A",,"No","N/A","DWARIKADHISH FASHION"
54.,"Travel Neck Pillow, Ergonomic Memory Foam Travel Pillow for Flights, Train & Car with Washable Velvet Fabric & Free Travel Pouch Included - Ideal Neck Support for Men & Women (Midnight Blue)","B0GHRNN9ZR","https://www.amazon.in/dp/B0GHRNN9ZR?psc=1","https://m.media-amazon.com/images/I/71K3himo33L._SX569_.jpg","huglect",949,"N/A",0,"N/A","N/A",190,"2,315","N/A","N/A",1,4.6,10,"N/A","N/A","huglect store","Bags, Wallets and Luggage","N/A","FBA","N/A","N/A","N/A","N/A",,"No","N/A","huglect store"
