"Display Order","Product Details","ASIN","URL","Image URL","Brand","Price  ₹","Sales","Variation Sales Strength (1 - 10)","Recent Purchases","Revenue","Title Char. Count","BSR","Seller Country/Region","Fees  ₹","Active Sellers","Ratings","Review Count","Images","Review velocity","Buy Box","Category","Size Tier","Fulfillment","Dimensions","Weight","ABA Most Clicked","Creation Date","Sponsored","Best Seller","Seller Age (mo)","Seller"
51.,"Green Soul Elevate Height Adjustable Engineered Wood Table with Monitor Riser | Integrated Organisation | Advance Memory Preset | 3 Year Warranty | Installation Provided (AntiqueWood, 1400 x 600 Top)","B0D66XCLCS","https://www.amazon.in/dp/B0D66XCLCS?psc=1","https://m.media-amazon.com/images/I/61zT2r3TVdL._SY355_.jpg","Green Soul","19,989",280,0,100,"5,598,792.02",199,"11,177","N/A","3,386.35",2,4.7,621,8,28,"RetailEZ Pvt Ltd","Home & Kitchen","Heavy and Bulky","FBA","90.00 x 14.00 x 85.00 cm",29,"N/A","Nov 26, 2021",,"No",52,"RetailEZ Pvt Ltd"
52.,"Green Soul Kyoto Foldable Study Table with Space-Saving Design, Expansive Tabletop, Storage Shelves, IS-3087 Engineered Wood, Ideal for Study, Bedroom, or Home Office, White & Oak, 3 Year Warranty","B0FB9D258L","https://www.amazon.in/dp/B0FB9D258L?psc=1","https://m.media-amazon.com/images/I/81YdtXtq8JL._SY355_.jpg","Green Soul","6,780",364,0,200,"2,341,604.9",196,"11,529","N/A","2,244.23",1,4.7,156,9,59,"RetailEZ Pvt Ltd","Home & Kitchen","Heavy and Bulky","FBA","79.00 x 15.00 x 50.00 cm",44,"N/A","Jun 18, 2023",,"No",33,"RetailEZ Pvt Ltd"
53.,"Green Soul Imperium Neo Smart Height Adjustable Table for Office Work | Sit Stand Desk with Integrated Charging | Advance Memory Preset | 3 Year Warranty | (Antique Wood, 1000 x 600 Top)","B0GFWXNMZ8","https://www.amazon.in/dp/B0GFWXNMZ8?psc=1","https://m.media-amazon.com/images/I/61JhNbwyY8L._SY355_.jpg","Green Soul","12,989",225,0,50,"2,913,479.64",186,"10,977","N/A","2,969.23",2,4.6,649,6,125,"RetailEZ Pvt Ltd","Home & Kitchen","Standard Size","FBA","15.50 x 75.50 x 55.00 cm",18.5,"N/A","Jan 9, 2026",,"No",2,"RetailEZ Pvt Ltd"
54.,"Purple Furniture Modern Computer Desk with Storage Shelf, Home Office Table (80 x 40 x 75 cm, DIY Assembly, Wood Finish) (Wenge)","B0GCXDDJQK","https://www.amazon.in/dp/B0GCXDDJQK?psc=1","https://m.media-amazon.com/images/I/613fH0v4FWL._SY355_.jpg","Purple Furniture","1,587",176,0,40,"280,049.18",128,"12,233","N/A",831.65,1,5,2,7,1,"Purple Furniture","Home & Kitchen","Standard Size","MFN","15.00 x 85.00 x 45.00 cm",12,"N/A","Dec 27, 2025",,"No",3,"Purple Furniture"
55.,"Torche Wood & Metal Finish Study Table |Computer Table, Study Table for Adults/Students| Home Office Writing Study Desk| Office Table Ideal for Work from Home (Exotic Teak)","B0G359XTD2","https://www.amazon.in/dp/B0G359XTD2?psc=1","https://m.media-amazon.com/images/I/61Y3RgHWmDL._SY355_.jpg","Torche","3,598",170,0,50,"576,720.27",172,"12,685","N/A","N/A",1,4.6,258,4,10,"Craftcenter","Home & Kitchen","Standard Size","FBA","10.00 x 111.60 x 64.00 cm",16,"N/A","Nov 20, 2025",,"No",4,"Craftcenter"
56.,"Enigmatic Woodworks Wall Mounted Folding Study Table | Space Saving Foldable Laptop Desk for Home & Office | Engineered Wood Wall Mount Table (Walnut, 40 * 60 cm)","B0GKP477J7","https://www.amazon.in/dp/B0GKP477J7?psc=1","https://m.media-amazon.com/images/I/71WAkbMDW9L._SY355_.jpg","Enigmatic Woodworks",949,138,0,30,"143,384.9",162,"12,791","N/A",523.44,1,5,4,6,3,"Enigmatic Woodworks","Home & Kitchen","Standard Size","FBA","6.00 x 90.00 x 43.00 cm",4.3,"N/A","Jan 30, 2026",,"No",2,"Enigmatic Woodworks"
57.,"Kuber Industries 32x16 Inch MDF Wooden Wall Mount Table Foldable for Study Room and Office | Round Corner Wall Mounted Dining Table and Desk for Work | White","B0FPFNY6YD","https://www.amazon.in/dp/B0FPFNY6YD?psc=1","https://m.media-amazon.com/images/I/71dkRcHy6YL._SY355_.jpg","Kuber Industries","1,598",153,0,100,"117,198.96",157,"12,999","N/A",750.54,2,4.3,166,8,16,"ETrade Online","Home & Kitchen","Standard Size","FBA","87.00 x 7.00 x 43.00 cm",5.99,"N/A","Sep 2, 2025",,"No",6,"ETrade Online"
58.,"Green Soul Arrakis Study Table with Book Shelf & Cabinet, IS-3087 Engineered Wood, Sturdy Built, Computer/Writing Desk for Home, Adults & Students, White & Walnut, 3 Year Warranty","B0D22NVMWN","https://www.amazon.in/dp/B0D22NVMWN?psc=1","https://m.media-amazon.com/images/I/71nfrDGMvsL._SY355_.jpg","Green Soul","6,789",103,0,20,"654,049.84",179,"13,517","N/A","2,189.25",2,4.3,722,9,541,"RetailEZ Pvt Ltd","Home & Kitchen","Heavy and Bulky","FBA","124.00 x 9.00 x 66.00 cm",40,"N/A","Dec 14, 2022",,"No",39,"RetailEZ Pvt Ltd"
59.,"Spyder Craft Genesis Engineering Wood Modern Office Desk Study Table Computer Table for Office Work from Home Kids Study Room Workstation Color -Black (Black)","B0FX136QZX","https://www.amazon.in/dp/B0FX136QZX?psc=1","https://m.media-amazon.com/images/I/71RsbEZf2WL._SY355_.jpg","SPYDER CRAFT","1,699",400,0,50,"753,543.56",158,"13,596","N/A","N/A",1,3.6,148,9,31,"RetailEZ Pvt Ltd","Home & Kitchen","Standard Size","FBA","20.00 x 35.00 x 15.00 cm",10,"N/A","Oct 19, 2025",,"No",5,"RetailEZ Pvt Ltd"
60.,"mistri Yerose Office Table For Home/Writing Desk For Office/Folding Table For School/Folding Study Table/Work From Home Multipurpose Table (Black) Wood, 15 Cm, 10 Centimeters","B0CGF4WRVW","https://www.amazon.in/dp/B0CGF4WRVW?psc=1","https://m.media-amazon.com/images/I/61NhURN1AgL._SY355_.jpg","Mistri",359,191,0,50,"68,693.48",174,"15,330","N/A",273.64,1,4.1,"2,856",10,29,"INITE IMPEX","Home & Kitchen","Standard Size","FBA","62.20 x 5.40 x 40.80 cm",2.64,"N/A","Aug 23, 2023",,"No",31,"INITE IMPEX"
61.,"LIDBOX Multi-Purpose Laptop Table, Study Table| Bed Table| Adjustable Height, Portable for Office, Work Form Home | DIY Table, Easy to Assemble, Engineered (ADJ Black)","B0G1K3Q4SP","https://www.amazon.in/dp/B0G1K3Q4SP?psc=1","https://m.media-amazon.com/images/I/61yZ7R8dUgL._SY355_.jpg","LID BOX","N/A",921,0,"N/A","827,046.57",167,"16,009","N/A","N/A",1,3.6,23,6,14,,"Home & Kitchen","N/A","MFN","N/A","N/A","N/A","Aug 3, 2025",,"No",7,
62.,"FURLAY Sleek Office Desk and Study Table | 1 Year Warranty | Century Engineered Wood Desk for Adults & Students (White) | DIY (Easy to Assemble)","B0DG2JL4LS","https://www.amazon.in/dp/B0DG2JL4LS?psc=1","https://m.media-amazon.com/images/I/61jKiWuRYJL._SY355_.jpg","FURLAY","2,399",162,0,50,"409,402.24",144,"16,553","N/A",936.74,1,4.4,216,5,4,"Plypixel Designs Pvt Ltd","Home & Kitchen","Standard Size","FBA","7.00 x 100.00 x 55.00 cm",10,"N/A","Sep 4, 2024",,"No",18,"Plypixel Designs Pvt Ltd"
63.,"Trailbrix Foldable Wooden Mini Laptop Table for Bed, Study Table with Drawer, Tablet/Mobile Holder for Kids & Adults (US-WOOD COTED)","B0GLP52BDY","https://www.amazon.in/dp/B0GLP52BDY?psc=1","https://m.media-amazon.com/images/I/615Boqkm5kL._SX342_.jpg","Trailbrix",199,105,0,"N/A","20,901.58",132,"17,080","N/A",151.04,1,5,7,5,"N/A","inkery","Home & Kitchen","Standard Size","FBA","5.00 x 20.00 x 12.00 cm",0.5,"N/A","Feb 5, 2026",,"No",1,"inkery"
64.,"Laptop Table/Foldable, Adjustable and Portable Heavy Duty Wooden/Writing Desk for Office/Home/School On Office, Home (Black Hight)","B0GD6G664C","https://www.amazon.in/dp/B0GD6G664C?psc=1","https://m.media-amazon.com/images/I/71G6+7DIieL._SY355_.jpg","4Mura",899,185,0,50,"162,885.7",130,"17,111","N/A","N/A",1,4.3,19,1,4,"Intex Mart®","Home & Kitchen","N/A","FBA","N/A","N/A","N/A","Aug 3, 2025",,"No",7,"Intex Mart®"
65.,"Faburaa Tablista Foldable Study Table, Portable Office Desk for Home & Work, Space Saving Laptop Table 30 x 18 Inch, Engineered Wood, White Marble","B0BHHLZP1K","https://www.amazon.in/dp/B0BHHLZP1K?psc=1","https://m.media-amazon.com/images/I/419YlQRoq+L._SY355_.jpg","Faburaa","3,099",111,0,10,"352,577.56",146,"17,501","N/A",914.21,1,3.8,381,9,4,"Bizbee technologies","Home & Kitchen","Standard Size","FBA","10.00 x 60.00 x 50.00 cm",5,"N/A","Jan 24, 2022",,"No",50,"Bizbee technologies"
66.,"Engineered Wood Multipurpose Foldable Office Table For Home/Office Desk (Beige Color, 90X60X76 Cms), Laminated","B0BRZYDBT9","https://www.amazon.in/dp/B0BRZYDBT9?psc=1","https://m.media-amazon.com/images/I/41pLIPTIioL._SX355_.jpg","Generic","N/A",120,0,"N/A","197,750.06",110,"17,582","N/A","N/A",1,4,225,5,2,,"Home & Kitchen","Standard Size","FBA","96.00 x 10.00 x 65.40 cm",9.32,"N/A","Nov 23, 2020",,"No",64,
67.,"Wakefit Study Table | 1 Yr Warranty | Study Table with Book Shelf, Computer Table for Home Pc, Office Table for Home, Free Installation from Brand, Modern Wobble-Free & Durable Design (Nayena - CW)","B0B3RQNR3C","https://www.amazon.in/dp/B0B3RQNR3C?psc=1","https://m.media-amazon.com/images/I/61hRcBhHsiL._SY355_.jpg","Wakefit","3,657",109,0,"N/A","583,049.55",197,"17,618","N/A","14,431.21",1,4.4,"8,520",6,"N/A",,"Home & Kitchen","Heavy and Bulky","MFN","177.80 x 261.62 x 101.60 cm",31.75,"N/A","Jun 10, 2022",,"No",45,
68.,"Torche Wood Wall Mounted Table 24X31 Inches| Powder Coated Wall Mounted Folding Round Corner Study Table| Wall Mount Table With Drawer | Foldable Wall Laptop Desk For Home And Office Computer, White","B0CYXVSFMT","https://www.amazon.in/dp/B0CYXVSFMT?psc=1","https://m.media-amazon.com/images/I/613kKogTEsL._SY355_.jpg","Torche","2,798",152,0,30,"342,798.95",198,"18,328","N/A","N/A",1,4.6,310,5,6,"Craftcenter","Home & Kitchen","Standard Size","FBA","7.62 x 68.58 x 86.36 cm",7.62,"N/A","Mar 24, 2024",,"No",24,"Craftcenter"
69.,"Study Table Bed Table/Laptop Table/Foldable and Portable Wooden/Writing Desk for Home(US-Black)","B0FPLX5RSV","https://www.amazon.in/dp/B0FPLX5RSV?psc=1","https://m.media-amazon.com/images/I/71uYd-39SBL._SY355_.jpg","Hitanjal",369,294,0,10,"99,548.55",95,"18,348","N/A","N/A",1,4.6,112,6,0,"INITE IMPEX","Home & Kitchen","N/A","FBA","N/A","N/A","N/A","Sep 3, 2025",,"No",6,"INITE IMPEX"
70.,"Callas Home Work Desk Study Table | Computer Table for Home | Office Table | Desktop and Laptop Table | Office Desk (ST-10-Black)","B0F918DPYG","https://www.amazon.in/dp/B0F918DPYG?psc=1","https://m.media-amazon.com/images/I/611uCLbWDzL._SY355_.jpg","Callas","2,129",191,0,50,"530,267.29",129,"18,455","N/A","N/A",1,3.9,222,7,5,"RetailEZ Pvt Ltd","Home & Kitchen","Standard Size","FBA","99.60 x 11.60 x 68.80 cm",12.12,"N/A","Nov 20, 2024",,"No",16,"RetailEZ Pvt Ltd"
71.,"Study Table Bed Table Premium Laptop Table/Foldable and Portable Wooden/Writing Desk for Office/Home/School (Wood COTED)","B0FL7R3NFK","https://www.amazon.in/dp/B0FL7R3NFK?psc=1","https://m.media-amazon.com/images/I/61KGgJIBQmL._SY355_.jpg","RIVATR",199,180,0,50,"36,458.6",120,"18,557","N/A",286.74,1,3.9,133,6,18,"inkery","Home & Kitchen","Standard Size","FBA","4.00 x 22.00 x 25.00 cm",2.95,"N/A","Sep 22, 2022",,"No",42,"inkery"
72.,"DeckUp Giona Engineered Wood Study Table and Office Desk (Walnut, Matte Finish)","B07H3BGW1N","https://www.amazon.in/dp/B07H3BGW1N?psc=1","https://m.media-amazon.com/images/I/81IR6WKKTLL._SY355_.jpg","DeckUp","4,299",118,0,10,"529,863.33",79,"18,787","N/A","N/A",2,4.4,"6,289",9,11,"DeckUp","Home & Kitchen","Heavy and Bulky","FBA","10.00 x 124.00 x 62.00 cm",29,"N/A","Sep 3, 2018",,"No",90,"DeckUp"
73.,"ROSE® Arrow Multipurpose Foldable | Portable Study Table | Computer Desk | Foldable for Office Work | Laptop Desk | 2/4 Seater Dining Table for Home and Office (Mocha Brown, 2 X 4 ft)","B0F9YZ21LJ","https://www.amazon.in/dp/B0F9YZ21LJ?psc=1","https://m.media-amazon.com/images/I/71V3mAsZcTL._SY355_.jpg","ROSE","3,965",119,0,"N/A","480,739",183,"19,009","N/A","1,179.74",1,4.8,63,5,4,"Rose Designer Chairs","Home & Kitchen","Standard Size","MFN","109.00 x 86.00 x 2.50 cm",8,"N/A","Jan 4, 2021",,"No",62,"Rose Designer Chairs"
74.,"Alloy Steel Eco - Electronic Height Adjustable Desk | 80Kg Weight Capacity | New Touch Controller with 3 Presets | 5-Year Warranty| E1 Grade Low VOC 25mm Table Top (White, 48 * 24 inches)","B0DD49BRML","https://www.amazon.in/dp/B0DD49BRML?psc=1","https://m.media-amazon.com/images/I/71r4KoGxTJL._SY355_.jpg","Intellidesk","17,090",64,0,"N/A","1,216,947.54",187,"19,172","N/A","N/A",1,4.6,100,7,4,"Intellidesk","Home & Kitchen","N/A","MFN","N/A","N/A","N/A","Aug 14, 2024",,"No",19,"Intellidesk"
75.,"Klaxon L Shaped Study Table for Students and Adults/Computer Table for Home-Office/Gaming Table/Computer Desk for Corner - Wood & Metal (Classic-Forest Dark & Black, DIY Installation)","B0CLH88899","https://www.amazon.in/dp/B0CLH88899?psc=1","https://m.media-amazon.com/images/I/71362bH-3CL._SY355_.jpg","Klaxon","7,499",179,0,40,"1,222,629.92",183,"17,353","N/A","N/A",1,4,272,9,26,"KLAXON","Home & Kitchen","N/A","FBA","N/A","N/A","N/A","Oct 20, 2023",,"No",29,"KLAXON"
76.,"DECOWORLD || Foldable Study Table || Desk with Wooden Top and Metal Legs with in-Built Pen Holder||Premium Computer, Laptop and Study Table for Students and Adults","B0C1QJQCCB","https://www.amazon.in/dp/B0C1QJQCCB?psc=1","https://m.media-amazon.com/images/I/51fJwosWNsL._SY355_.jpg","DECOWORLD","2,899",161,0,100,"465,431.37",163,"20,001","N/A","1,058.86",1,4.3,392,9,5,"Aakaar Iron Creations Pvt Ltd","Home & Kitchen","Standard Size","FBA","88.01 x 9.03 x 88.01 cm",10.08,"N/A","Apr 7, 2023",,"No",35,"Aakaar Iron Creations Pvt Ltd"
77.,"Livzing Height Adjustable Lapdesks with Locking Wheels-Wooden Multi-Purpose Laptop Table-Desktop Table for Office, Home with Angle Adjustable Keyboard Tray- Movable Computer Desk-Black","B0F43Q7ZJX","https://www.amazon.in/dp/B0F43Q7ZJX?psc=1","https://m.media-amazon.com/images/I/61szC6gQ2XL._SY355_.jpg","Livzing","3,998",162,0,50,"650,906.04",184,"13,486","N/A","1,053.36",1,3.6,76,9,6,"Livzing","Home & Kitchen","Standard Size","FBA","66.00 x 14.00 x 17.50 cm",0.3,"N/A","Apr 8, 2025",,"No",11,"Livzing"
78.,"Green Soul Rise Manual Height Adjustable Table | 25mm Thick One Piece Table Top | 80 KG Load Capacity|Engineered for All Heights (3 Stage Design) | 3 Year Warranty|Installation Provided (Antique Wood)","B0FBWVMJJ4","https://www.amazon.in/dp/B0FBWVMJJ4?psc=1","https://m.media-amazon.com/images/I/61y5W9kyb8L._SY355_.jpg","Green Soul","13,989",89,0,20,"1,258,415.61",200,"20,553","N/A","3,477.81",2,4.7,128,8,20,"RetailEZ Pvt Ltd","Home & Kitchen","Heavy and Bulky","FBA","132.00 x 18.00 x 70.00 cm",38,"N/A","Dec 14, 2022",,"No",39,"RetailEZ Pvt Ltd"
79.,"Studio Kook Nora Folding Table (Study Table, Multipurpose Desk with Wheels, Engineered Wood, Matte Finish) (Junglewood)","B0DXQ2P429","https://www.amazon.in/dp/B0DXQ2P429?psc=1","https://m.media-amazon.com/images/I/91vQ2yzNilL._SY355_.jpg","Studio Kook","6,668",182,0,50,"1,224,419.18",119,"12,512","N/A","2,124.64",1,4.4,294,8,"N/A","Studio Kook","Home & Kitchen","Standard Size","MFN","34.00 x 84.00 x 65.00 cm",20,"N/A","Feb 19, 2025",,"No",13,"Studio Kook"
80.,"MY ARMOR Wall Mount Table Foldable | Wooden Folding Wall Study Table with Drawer | Space Saving Laptop Desk for Home & Office | Wall Mounted Foldable Table | Walnut Dark | 24 x 16 Inches","B0FD74FS5J","https://www.amazon.in/dp/B0FD74FS5J?psc=1","https://m.media-amazon.com/images/I/71xVR7jILyL._SY355_.jpg","MY ARMOR","1,549",151,0,20,"264,836.11",186,"18,912","N/A",697.17,2,4.2,42,6,4,"ETrade Online","Home & Kitchen","Standard Size","FBA","67.30 x 6.70 x 45.29 cm",4.82,"N/A","Jun 14, 2025",,"No",9,"ETrade Online"
81.,"Wood Wall Mounted Foldable Study Table | Folding Round Corner Wall Mount Desk | Wall Table Foldable (Walnut), (18""-40"" Inch)","B0D373RVGB","https://www.amazon.in/dp/B0D373RVGB?psc=1","https://m.media-amazon.com/images/I/71nrM3gNpBL._SY355_.jpg","WUDCAFE","2,299",127,0,50,"272,167.32",124,"21,836","N/A",831.61,1,4.5,62,5,3,"WUDCAFE","Home & Kitchen","Standard Size","FBA","6.00 x 69.00 x 50.00 cm",6,"N/A","May 3, 2024",,"No",22,"WUDCAFE"
82.,"SPYDER CRAFT Multipurpose Desk for Office, Study with Book Storage Engineered Wood Multipurpose Table (Free Standing, Finish Color -Irish Pink, DIY(Do-It-Yourself))","B0GL881VNL","https://www.amazon.in/dp/B0GL881VNL?psc=1","https://m.media-amazon.com/images/I/71Qf2OLubZL._SY355_.jpg","SPYDER CRAFT","5,499",82,0,20,"369,383.01",164,"21,584","N/A","1,547.15",1,4.6,8,9,2,"Avenue Venture","Home & Kitchen","Standard Size","FBA","25.00 x 45.00 x 35.00 cm",12,"N/A","Feb 3, 2026",,"No",1,"Avenue Venture"
83.,"DeckUp Apollo Engineered Wood Study & Computer Table and Office Desk (Walnut, Matte Finish)","B09Y31XWVH","https://www.amazon.in/dp/B09Y31XWVH?psc=1","https://m.media-amazon.com/images/I/717SBeOEdbL._SX355_.jpg","DeckUp","2,799",97,0,20,"276,017.35",91,"22,109","N/A","1,132.55",2,4.1,"2,545",8,12,"DeckUp","Home & Kitchen","Standard Size","MFN","8.50 x 110.00 x 45.00 cm",18,"N/A","Feb 28, 2022",,"No",49,"DeckUp"
84.,"InnoFur Meleti Folding Study Desk (Large)|Foldable Office Table|Adjustable Laptop Cum Computer Table Big (Brown, Large)","B08HKJ61RN","https://www.amazon.in/dp/B08HKJ61RN?psc=1","https://m.media-amazon.com/images/I/61P2-MefYzL._SY355_.jpg","InnoFur","5,299",81,0,10,"398,697.39",119,"22,965","N/A","1,475.41",1,4.3,"1,763",9,2,"InnoFur","Home & Kitchen","Heavy and Bulky","FBA","110.00 x 4.00 x 100.00 cm",14,"N/A","Mar 18, 2018",,"No",96,"InnoFur"
85.,"SILBERTHAL Office Table for Home/Writing Desk for Office/Folding Table for School/Folding Study Table/Work from Home-Multipurpose Table (DORAMON)","B0DQLKM44T","https://www.amazon.in/dp/B0DQLKM44T?psc=1","https://m.media-amazon.com/images/I/61AaFkbAgHL._SY355_.jpg","SILBERTHAL",219,514,0,20,"88,318.88",145,"23,691","N/A","N/A",1,3.7,"2,247",9,27,"inkery","Home & Kitchen","Standard Size","FBA","5.00 x 20.00 x 12.00 cm",0.5,"N/A","Dec 23, 2024",,"No",15,"inkery"
86.,"Klaxon L Shaped Study Table for Students and Adults/Computer Table for Home-Office/Gaming Table/Computer Desk for Corner - Wood & Metal (Christo-Forest Dark & Black, DIY Installation)","B0CLHD3HRC","https://www.amazon.in/dp/B0CLHD3HRC?psc=1","https://m.media-amazon.com/images/I/91LAqtaE7WL._SY355_.jpg","Klaxon","10,999",173,0,20,"1,457,267.51",183,"23,937","N/A","3,667.26",1,4.2,241,9,17,"KLAXON","Home & Kitchen","Heavy and Bulky","FBA","30.00 x 180.00 x 60.00 cm",90,"N/A","Oct 19, 2023",,"No",29,"KLAXON"
87.,"Green Soul Brixton L-Shape Computer Table for Home PC, Keyboard Tray, 2 Storage Shelves, IS-3087 Engineered Wood, Expansive Tabletop, Wenge, 3 Year Warranty","B0FB9CYTPJ","https://www.amazon.in/dp/B0FB9CYTPJ?psc=1","https://m.media-amazon.com/images/I/814ky23ZGsL._SY355_.jpg","Green Soul","7,290",151,0,100,"1,103,969.25",156,"24,112","N/A","N/A",1,4.5,92,8,23,"Green Soul Ergonomics Private Limited","Home & Kitchen","Heavy and Bulky","MFN","120.00 x 47.00 x 65.00 cm",47,"N/A","Feb 12, 2024",,"No",25,"Green Soul Ergonomics Private Limited"
88.,"Callas Laminated Study Table | Computer Table for Home | Office Table | Desktop and Laptop Table | Office Desk (ST-10-White)","B0F29H9QP9","https://www.amazon.in/dp/B0F29H9QP9?psc=1","https://m.media-amazon.com/images/I/816bjQas14L._SY355_.jpg","Callas","2,129",137,0,50,"287,437.11",124,"24,246","N/A","1,017.81",1,3.9,100,9,4,"RetailEZ Pvt Ltd","Home & Kitchen","Standard Size","FBA","101.85 x 11.43 x 70.36 cm",12.54,"N/A","Mar 24, 2025",,"No",12,"RetailEZ Pvt Ltd"
89.,"DeckUp Hermes Engineered Wood Study & Computer Table and Office Desk (White, Matte Finish)","B09Y3K4P9C","https://www.amazon.in/dp/B09Y3K4P9C?psc=1","https://m.media-amazon.com/images/I/61KZD0iMzGL._SX355_.jpg","DeckUp","5,999",145,0,50,"862,186.62",90,"24,308","N/A","2,159.19",2,4.4,"1,470",9,12,"DeckUp","Home & Kitchen","Heavy and Bulky","FBA","10.50 x 126.00 x 64.00 cm",44,"N/A","Feb 28, 2022",,"No",49,"DeckUp"
90.,"120x60x75cm Engineered Wood Study & Office Table with 1 Drawer & Cabinet | Termite & Scratch Resistant, Ample Leg Space, Sturdy Desk for Students | 1 Year Warranty- Teak Walnut","B0F3J7YCBQ","https://www.amazon.in/dp/B0F3J7YCBQ?psc=1","https://m.media-amazon.com/images/I/61Ym2nK-CFL._SY355_.jpg","CREATIVE QUBE","6,199",104,0,20,"658,180.85",176,"25,032","N/A","2,337.4",1,4.7,189,8,12,"Creative-Qube","Home & Kitchen","Heavy and Bulky","MFN","16.00 x 126.00 x 66.00 cm",43,"N/A","Apr 3, 2025",,"No",11,"Creative-Qube"
91.,"Office Table for Home/Writing Desk for Office/Folding Table for School/Folding Study Table/Work from Home - MultipurposeTable-> (DOREMON)","B0DH53TX76","https://www.amazon.in/dp/B0DH53TX76?psc=1","https://m.media-amazon.com/images/I/71khmsSjz8L._SY355_.jpg","VISBY INDIA",349,129,0,50,"45,200.05",137,"25,076","N/A","N/A",1,3.9,421,8,13,"Intex Mart®","Home & Kitchen","Standard Size","FBA","7.00 x 60.00 x 40.00 cm",2.5,"N/A","Sep 16, 2024",,"No",18,"Intex Mart®"
92.,"Office Table for Home/Writing Desk for Office/Folding Table for School/Folding Study Table/Work from Home -Multipurpose Table (DOREMON)","B0FFHDF3ZT","https://www.amazon.in/dp/B0FFHDF3ZT?psc=1","https://m.media-amazon.com/images/I/61r-SHRyLZL._SY355_.jpg","PRB MART",219,128,0,"N/A","19,594.99",135,"25,686","N/A",151.04,1,4.2,39,8,3,"inkery","Home & Kitchen","Standard Size","FBA","5.00 x 20.00 x 12.00 cm",0.5,"N/A","Jul 10, 2025",,"No",8,"inkery"
93.,"EAGLE INDUSTRIES™ Foldable Laptop Table for Bed & Sofa | Wooden Study Table for Students & Adults | Portable Laptop Desk with Cup Holder | Study Table for Home","B0GKG39SNN","https://www.amazon.in/dp/B0GKG39SNN?psc=1","https://m.media-amazon.com/images/I/71MZJHKMSZL._SY355_.jpg","EAGLE INDUSTRIES",589,125,0,"N/A","71,264.28",159,"25,728","N/A","N/A",1,5,5,8,2,"eagle industries","Home & Kitchen","Standard Size","FBA","4.00 x 20.00 x 25.00 cm",0.4,"N/A","Jan 29, 2026",,"No",2,"eagle industries"
94.,"Webelkart Wooden Motivational Quotes Table Decoration for Office Desk | Home Decor Item | Living Room | Modern Art Wood Showpiece Gift Items (Designs-3)","B0CR1PTLX3","https://www.amazon.in/dp/B0CR1PTLX3?psc=1","https://m.media-amazon.com/images/I/61lkg0SwNTL._SY355_.jpg","Webelkart",168,68,0,50,"12,294.88",152,"26,067","N/A",127.44,2,3.9,53,4,3,"ETrade Online","Home & Kitchen","Standard Size","FBA","20.50 x 5.60 x 13.30 cm",0.23,"N/A","Dec 27, 2023",,"No",27,"ETrade Online"
95.,"MY ARMOR Foldable Table for Home | 3x2 Ft Multipurpose Wooden Study Desk with Metal Frame | Portable Folding Computer Table for Laptop | Office Work, Dining & Study Use | Brown Oak Finish","B0FD44Q73Q","https://www.amazon.in/dp/B0FD44Q73Q?psc=1","https://m.media-amazon.com/images/I/71xFjc4fawL._SY355_.jpg","MY ARMOR","2,039",23,0,10,"47,699.47",187,"26,120","N/A",865.4,2,3.8,24,7,0,"ETrade Online","Home & Kitchen","Standard Size","FBA","94.00 x 8.00 x 65.00 cm",10.96,"N/A","Jun 13, 2025",,"No",9,"ETrade Online"
96.,"VMS Office Buddy Adjustable Bedside Portable Table Cart Tray with Adjustable Height, Studying Overbed Breakfast and Sofa Table","B09NGLFPBQ","https://www.amazon.in/dp/B09NGLFPBQ?psc=1","https://m.media-amazon.com/images/I/51XNYDVsLqL._SY355_.jpg","VMS","N/A",13,0,"N/A","37,745.03",126,"39,486","N/A","N/A",1,3.9,494,9,1,,"Computers & Accessories","Standard Size","FBA","11.00 x 58.00 x 38.00 cm",5.89,"N/A","Jan 21, 2022",,"No",50,
97.,"DeckUp Apollo-KT Engineered Wood Study & Computer Table and Office Desk with Keyboard Tray (Walnut, Matte Finish)","B09Y32FPNP","https://www.amazon.in/dp/B09Y32FPNP?psc=1","https://m.media-amazon.com/images/I/71F052OqpbL._SX355_.jpg","DeckUp","3,199",81,0,30,"258,531.71",113,"26,235","N/A","1,273.27",2,4.2,"1,106",8,8,"DeckUp","Home & Kitchen","Standard Size","MFN","10.00 x 110.00 x 45.00 cm",21,"N/A","Feb 28, 2022",,"No",49,"DeckUp"
98.,"WODENWAWE Multipurpose Microwave Oven, OTG Stand, Kitchen Storage Shelf, Microwave Oven Platform Rack, Top Color-Brown, Size-60x39.5x90CM (WW-12B) (Brown)","B0F8XKBJW4","https://www.amazon.in/dp/B0F8XKBJW4?psc=1","https://m.media-amazon.com/images/I/71INBUsvB+L._SY355_.jpg","WOODENWAWE","2,989",86,0,50,"258,150.08",154,"27,009","N/A","1,109.9",1,4.7,40,5,5,"WOODENWAWE","Home & Kitchen","Standard Size","FBA","94.00 x 10.80 x 42.40 cm",13.23,"N/A","Jul 18, 2022",,"No",44,"WOODENWAWE"
99.,"TEKAVO Jimmy Office Table | Computer Table for Home PC, Work Table for Home Workstation, Laptop Desk (120 Cm X 60 Cm X 75 Cm) White Wood, Metal - DIY","B0FZCL8LC3","https://www.amazon.in/dp/B0FZCL8LC3?psc=1","https://m.media-amazon.com/images/I/61iAyzso1OL._SY355_.jpg","TEKAVO","7,299",109,0,"N/A","923,153.15",149,"27,869","N/A","N/A",1,4.4,585,7,10,"EVERS","Home & Kitchen","N/A","MFN","N/A","N/A","N/A","Nov 3, 2025",,"No",4,"EVERS"
100.,"HNI India IVO Home Office Desk – Heavy-Duty Work Table for Home, Study, Office & Workspace | 25mm Thick Engineered Wood Top, Sturdy & Angular Metal Legs | Effective Wire Management | 3 Years Warranty","B097HMVTF1","https://www.amazon.in/dp/B097HMVTF1?psc=1","https://m.media-amazon.com/images/I/51CwMdBMZHL._SY355_.jpg","HNI India","7,299",48,0,10,"338,811.29",199,"28,242","N/A","2,126.77",1,4.4,622,9,1,"Kokuyo India","Home & Kitchen","Heavy and Bulky","FBA","117.00 x 19.00 x 65.00 cm",25.5,"N/A","Jan 13, 2022",,"No",50,"Kokuyo India"