"Display Order","Product Details","ASIN","URL","Image URL","Brand","Price  ₹","Sales","Variation Sales Strength (1 - 10)","Recent Purchases","Revenue","Title Char. Count","BSR","Seller Country/Region","Fees  ₹","Active Sellers","Ratings","Review Count","Images","Review velocity","Buy Box","Category","Size Tier","Fulfillment","Dimensions","Weight","ABA Most Clicked","Creation Date","Sponsored","Best Seller","Seller Age (mo)","Seller"
54.,"Water Fountain for Inside - 67oz/1.8L Automatic Circulating Pet Fountain with Faucet Design - 3 Flow Speeds Complete with Accessories! Fountain Water Bowl Drinking Fountains","B0DJFM3B1Q","https://www.amazon.in/dp/B0DJFM3B1Q?psc=1","https://m.media-amazon.com/images/I/617zSKP8ZOL._SX679_.jpg","OCTOPUSPRIME",999,0,0,"N/A",0,173,"13,314","N/A","N/A",1,"N/A",0,8,0,,"Pet Supplies","Standard Size","MFN","15.00 x 17.00 x 17.00 cm",0.5,"N/A","Oct 3, 2024",,"No",16,
55.,"PetVogue Pet Fountain Cat Water Dispenser (2 L) - Healthy and Hygienic Drinking Fountain Super Quiet Flower Automatic Water Bowl for Cats, Dogs, Birds and Small Animals","B0C3ZSPRD2","https://www.amazon.in/dp/B0C3ZSPRD2?psc=1","https://m.media-amazon.com/images/I/618yNvwqHBL._SY450_.jpg","PetVogue","1,499",16,0,"N/A","21,155.92",168,"13,943","N/A","N/A",1,4,57,7,0,"Bigtime Enterprises","Pet Supplies","Standard Size","FBA","17.10 x 13.00 x 16.50 cm",0.54,"N/A","May 1, 2023",,"No",33,"Bigtime Enterprises"
56.,"PURAM Pet Waterer for Dog Cat Animal Automatic Gravity Water Drinking Dispenser 3.5L Fountain Bottle Bowl Dish Set of 1 Set","B08QS9QWVP","https://www.amazon.in/dp/B08QS9QWVP?psc=1","https://m.media-amazon.com/images/I/41NnFdrdg8L._SX425_.jpg","IKIMI",565,0,0,"N/A",0,123,"14,049","N/A",224.38,2,3.9,235,9,0,"Puram Ecom","Pet Supplies","Standard Size","FBA","30.00 x 10.00 x 5.00 cm",0.5,"N/A","Dec 16, 2020",,"No",62,"Puram Ecom"
57.,"5 Pcs Cat Water Fountain Filter, Replacement Filters for Cat Fountain, 11.3 x 4.3 cm Cotton Filters, Maintain Clean Drinking Water for Cats","B0FQWPHDSG","https://www.amazon.in/dp/B0FQWPHDSG?psc=1","https://m.media-amazon.com/images/I/61CG2Y0APsL._SX569_.jpg","Buildcon",559,6,0,"N/A","3,326.87",139,"14,117","N/A",203.3,1,"N/A",0,6,0,"BuildconX","Pet Supplies","Standard Size","FBA","11.70 x 2.60 x 11.70 cm",0.04,"N/A","Sep 12, 2025",,"No",5,"BuildconX"
58.,"Cat Water Fountain, 3.2L/108oz Automatic Stainless Steel Pet Dog Water Dispenser with Super Quiet&Transparent Window Design Ideal for Cats, Dogs (Steel, Rectangle 3L-2)","B0F8QZPVTG","https://www.amazon.in/dp/B0F8QZPVTG?psc=1","https://m.media-amazon.com/images/I/61tdlncxOLL._SY355_.jpg","ELEXIQ","3,089",10,0,"N/A","17,480.09",168,"14,190","N/A",585.42,1,4.2,7,8,0,"Elexiq Sales India","Pet Supplies","Standard Size","FBA","8.00 x 12.00 x 12.00 cm",0.4,"N/A","Mar 21, 2025",,"No",11,"Elexiq Sales India"
59.,"PETKIT Eversweet 3 Pro Cat Water Fountain with Wireless Pump, 1.6L/56oz Stainless Steel Pet Fountains for Cats Indoor, Automatic Water Dispenser Ultra Quiet, App Monitoring","B09QRH6L3M","https://www.amazon.in/dp/B09QRH6L3M?psc=1","https://m.media-amazon.com/images/I/61jVWEnAFfL._SX569_.jpg","PETKIT","6,999.99",7,0,"N/A","46,717.46",172,"14,288","N/A","1,301.54",2,4.3,"2,408",9,21,"SMART PET Store","Pet Supplies","Standard Size","FBA","22.71 x 19.10 x 22.30 cm",1.97,"N/A","Sep 25, 2022",,"No",41,"SMART PET Store"
60.,"Stainless Steel Pet Water Fountain | 2.5 L Quiet Water Dispenser for Cats & Dogs | 304 Steel | Easy to Clean | Extra Filter Included | Made in India | Replacement Pump Available","B0G5Z6GYJ9","https://www.amazon.in/dp/B0G5Z6GYJ9?psc=1","https://m.media-amazon.com/images/I/51eVeZB+bUL._SY606_.jpg","the loyal whiskers","2,299",9,0,"N/A","20,102.06",177,"14,763","N/A","N/A",1,5,4,9,0,"Divine Enterprises India","Pet Supplies","N/A","FBA","N/A","N/A","N/A","Dec 9, 2025",,"No",2,"Divine Enterprises India"
61.,"Nexlev Splash Pet Water Fountain with LED Light | 2.0L Capacity | Ultra Quiet Cat Drinking Fountain with Filter | Automatic Pet Water Fountain for Cats and Small Dogs | Blue (WF-02-BL)","B0D637B562","https://www.amazon.in/dp/B0D637B562?psc=1","https://m.media-amazon.com/images/I/71EqArq0eBL._SX466_.jpg","nexlev","1,249",6,0,"N/A","7,113.77",184,"15,168","N/A",414.33,1,4.1,99,8,0,"Nexlev® by Cambium","Pet Supplies","Standard Size","FBA","18.60 x 16.10 x 18.30 cm",0.51,"N/A","Jun 4, 2024",,"No",20,"Nexlev® by Cambium"
62.,"Automatic Pet Water Fountain for Cats and Dogs | Ultra-Quiet | BPA-Free & Easy to Clean | Large Capacity Water Dispenser | Promotes Fresh Hydration | Indoor Fountain for Small Cats (Black)","B0F6YNTFSZ","https://www.amazon.in/dp/B0F6YNTFSZ?psc=1","https://m.media-amazon.com/images/I/71rKo148PuL._SX466_.jpg","Petbabas",927.26,8,0,"N/A","8,519.31",188,"15,215","N/A",319.77,2,3.4,17,9,0,"ETrade Online","Pet Supplies","Standard Size","FBA","19.30 x 12.30 x 19.20 cm",0.63,"N/A","Apr 30, 2025",,"No",10,"ETrade Online"
63.,"Toriox Cat Water Fountain Stainless Steel, 84oz/2.5L Automatic Pet Water Fountain with Water Level Window for Water Shortage Alert","B0DHD47SZH","https://www.amazon.in/dp/B0DHD47SZH?psc=1","https://m.media-amazon.com/images/I/41HuJ4YbiYL._SX425_.jpg","TORIOX",999,0,0,"N/A",0,130,"15,307","N/A","N/A",1,3,8,9,0,"TORIOX.","Pet Supplies","Standard Size","FBA","31.00 x 17.60 x 20.80 cm",0.52,"N/A","Sep 18, 2024",,"No",17,"TORIOX."
64.,"8 Packs Replacement Filters for Stainless Steel Cat Water Fountain, 4 Months Set of Replacement Filters fot Pet Water Fountain","B0CBLRTHNS","https://www.amazon.in/dp/B0CBLRTHNS?psc=1","https://m.media-amazon.com/images/I/61vWla5bKjL._SY355_.jpg","upetcasl","4,519.99",2,0,"N/A","6,591.64",126,"15,399","N/A",823.64,2,4.2,355,7,0,,"Pet Supplies","Standard Size","FBA","20.29 x 3.20 x 19.20 cm",0.1,"N/A","Jul 23, 2023",,"No",31,
65.,"Cat Water Fountain Stainless Steel Top (Green)","B07S3Z8KL4","https://www.amazon.in/dp/B07S3Z8KL4?psc=1","https://m.media-amazon.com/images/I/61+5VH-l7VL._SX425_.jpg","Vekonn","3,363",2,0,"N/A","8,785.33",46,"15,602","N/A",726.15,13,4.3,"4,450",7,"N/A",,"Pet Supplies","Standard Size","MFN","19.41 x 14.91 x 19.20 cm",0.7,"N/A","Jun 22, 2019",,"No",80,
66.,"Dog Water Fountain Stainless Steel, 410oz/3.2Gal/12L Large Pet Water Fountain for Dogs, Dog Water Bowl Dispenser with Water Level Window & LED Light, Super Quiet for S-L Dogs and Multi-Pet (Filters)","B0D1K5GGF4","https://www.amazon.in/dp/B0D1K5GGF4?psc=1","https://m.media-amazon.com/images/I/71RvwmQD+KL._SY355_.jpg","MAILOFY","6,098",0,0,"N/A",0,198,"15,928","N/A","1,056.4",3,4.2,730,7,24,,"Pet Supplies","Standard Size","MFN","13.49 x 7.11 x 10.39 cm",0.1,"N/A","Jun 11, 2024",,"No",20,
67.,"Cat Water Fountain, 3.2L/108oz Upgraded Stainless Steel Pet Water Fountain for Cats Inside Drinking, with Water Level Window (Steel, Round 3L-2)","B0GJKRGHZ8","https://www.amazon.in/dp/B0GJKRGHZ8?psc=1","https://m.media-amazon.com/images/I/61EmFnhQVbL._SX679_.jpg","SYGNIUS","3,179",0,0,"N/A",0,144,"16,222","N/A","N/A",1,4.4,6,"N/A",0,"Sygnius Sales India","Pet Supplies","N/A","FBA","N/A","N/A","N/A","N/A",,"No","N/A","Sygnius Sales India"
68.,"PetVogue Cat Water Fountain Animal Water Dispenser 2L Automatic Pet Drinking Fountain Clear Upgrade, 1 Adjustable Silent 1 Water Pump for Cats Kitty Indoor and Small Pets","B0C8D6ZD3T","https://www.amazon.in/dp/B0C8D6ZD3T?psc=1","https://m.media-amazon.com/images/I/61kWRtFgJXL._SX679_.jpg","PetVogue","1,879",6,0,"N/A","10,449.11",170,"16,827","N/A",501.36,1,4.2,14,8,0,"Bigtime Enterprises","Pet Supplies","Standard Size","FBA","17.70 x 16.80 x 17.10 cm",0.53,"N/A","Feb 3, 2024",,"No",24,"Bigtime Enterprises"
69.,"2.5 L Cat Automatic Water Dispenser | Large Capacity Automatic Circulation Drinking Fountain for Cute pet | Fresh Filtered Water Dispenser for Cats, Dogs & Small Pets (1)","B0FF49JRG4","https://www.amazon.in/dp/B0FF49JRG4?psc=1","https://m.media-amazon.com/images/I/61i-kz1yAML._SX466_.jpg","SNAPCOM",849,17,0,10,"14,029.16",170,"17,150","N/A","N/A",1,3.6,5,9,0,"SNAPCOM","Pet Supplies","N/A","FBA","N/A","N/A","N/A","Jun 23, 2025",,"No",8,"SNAPCOM"
70.,"Cat Water Fountain PIR Motion Sensor Switch for Pet Water Fountain Automatic Start Stop Dog Water Dispenser External USB DC 5V 1A Detector Save Energy Accessory Universal Intelligent","B0F63QSYXR","https://www.amazon.in/dp/B0F63QSYXR?psc=1","https://m.media-amazon.com/images/I/51ZqwtBWkcL._SX425_.jpg","GHANU",499,3,0,"N/A","1,415.89",182,"17,571","N/A",178.65,1,4,1,8,0,"GHANU","Pet Supplies","Standard Size","FBA","4.00 x 5.00 x 5.00 cm",0.05,"N/A","Apr 23, 2025",,"No",10,"GHANU"
71.,"Goofy Tails Dog H2O Cordless Water Fountain Filter | Automatic Water Dispenser for Dogs (Replacement Pump)","B0BH4XNDNW","https://www.amazon.in/dp/B0BH4XNDNW?psc=1","https://m.media-amazon.com/images/I/518hlF3y57L._SX679_.jpg","Goofy Tails",999,2,0,"N/A","1,494.77",106,"17,657","N/A",261.82,1,"N/A",0,2,0,"Goofy Tails ®","Pet Supplies","Standard Size","FBA","8.00 x 17.50 x 10.00 cm",0.26,"N/A","Oct 3, 2022",,"No",40,"Goofy Tails ®"
72.,"Drinking Fountain for Cats 3.2L TOMXCUTE cat Fountain Made of Stainless Steel, Water Fountain for Cats Dogs, with Pump and Replacement Filter","B09DSV9KQM","https://www.amazon.in/dp/B09DSV9KQM?psc=1","https://m.media-amazon.com/images/I/61xbNmoYdBL._SX466_.jpg","tomxcute","3,399",9,0,"N/A","29,928.91",141,"17,763","N/A",731.46,1,4.2,"4,318",7,"N/A","MISFANS PVT LIMITED","Pet Supplies","Standard Size","FBA","22.90 x 11.60 x 22.80 cm",0.76,"N/A","Jun 1, 2024",,"No",20,"MISFANS PVT LIMITED"
73.,"12-Pack Cat Water Fountain Filters, Round Replacement Filters for 2.4L Fountains","B08HL7TW61","https://www.amazon.in/dp/B08HL7TW61?psc=1","https://m.media-amazon.com/images/I/71Rq1vNMItL._SY450_PIbundle-12,TopRight,0,0_AA450SH20_.jpg","YAMOZOM",711,3,0,"N/A","2,118.43",80,"17,801","N/A",243.33,1,4.2,651,7,3,"Beauty_Basket","Pet Supplies","Standard Size","FBA","14.20 x 11.51 x 13.59 cm",0.21,"N/A","Nov 14, 2020",,"No",63,"Beauty_Basket"
74.,"WellToBe Cat Water Fountain Filter, Multiple Filtration Pet Water Fountain Replacement Filter, 6 Packs of Cotton Activated Carbon Cat Fountain Filter","B0DRXJJPSY","https://www.amazon.in/dp/B0DRXJJPSY?psc=1","https://m.media-amazon.com/images/I/61AQaRoDfGL._SX466_.jpg","WellToBe","1,299",10,0,"N/A","13,575.26",149,"17,816","N/A",333.8,1,4,1,4,0,"Welltobe","Pet Supplies","Standard Size","FBA","27.30 x 3.40 x 8.30 cm",0.16,"N/A","Dec 31, 2024",,"No",14,"Welltobe"
75.,"24x7 eMall 2 in 1Pet Water Fountain and Bowl with Filter and Pump, 31 x 17 x11 Cm Drinking Bowl for Cats and Dogs, Cat Fountain for Home","B0G9QF5BB3","https://www.amazon.in/dp/B0G9QF5BB3?psc=1","https://m.media-amazon.com/images/I/71EKFTBbXuL._SX522_.jpg","24x7 eMall",925,2,0,"N/A","1,661.37",136,"18,022","N/A",220.37,1,"N/A",0,9,0,"24x7 eMall ®","Pet Supplies","Standard Size","FBA","5.00 x 30.00 x 11.00 cm",0.25,"N/A","Dec 20, 2025",,"No",2,"24x7 eMall ®"
76.,"Dog Water Dispenser, Pet Fountain - Quiet Electric Cat Drinking Fountain, Cat Watering Supplies, Automatic Pet Drinking Fountain with Filter for Puppy Cats Dogs Cats","B0GD16RH2V","https://www.amazon.in/dp/B0GD16RH2V?psc=1","https://m.media-amazon.com/images/I/71qwY9kTniL._SX569_.jpg","Matiko","N/A",7,0,"N/A","4,893",165,"18,407","N/A","N/A",1,1,2,6,0,,"Pet Supplies","Standard Size","MFN","10.00 x 15.00 x 12.00 cm",0.25,"N/A","Dec 29, 2025",,"No",2,
77.,"Cat Water Fountain, Dog Water Dispenser, Automatic Pet Drinking Fountain with Faucet Kits, 1.8L Super Quiet, Transparent Healthy & Hygienic Drinking Bowl for Cats, Dogs, Multiple Pets","B0DHCY19X1","https://www.amazon.in/dp/B0DHCY19X1?psc=1","https://m.media-amazon.com/images/I/513QvgeWeEL._SY355_.jpg","GHANU","N/A",0,0,"N/A","N/A",183,"18,550","N/A","N/A",1,3.6,90,8,0,,"Pet Supplies","Standard Size","MFN","18.00 x 17.60 x 18.00 cm",0.52,"N/A","Sep 18, 2024",,"No",17,
78.,"Cat Water Fountain, Dog Water Dispenser, Automatic Pet Drinking Fountain with Faucet Kits, 1.8L Super Quiet, Transparent Healthy & Hygienic Drinking Bowl for Cats, Dogs, Multiple Pets","B0DQ5SSDHM","https://www.amazon.in/dp/B0DQ5SSDHM?psc=1","https://m.media-amazon.com/images/I/5195XqMp90L._SX466_.jpg","Siarth","N/A",0,0,"N/A","N/A",183,"18,687","N/A","N/A",1,3.4,40,8,0,,"Pet Supplies","Standard Size","MFN","16.50 x 15.50 x 15.50 cm",0.6,"N/A","Dec 11, 2024",,"No",14,
79.,"Cat & Dog Fountain | 64oz/1.8L Automatic Pet Drinking with Quiet Pump, Transparent Bowl, Hygienic Dispenser for Cats, Dogs & Multiple Pets, Cat Water Fountain, Dog Dispenser","B0DJPJVJWL","https://www.amazon.in/dp/B0DJPJVJWL?psc=1","https://m.media-amazon.com/images/I/61ASDPzsGgL._SX569_.jpg","VGMAX","N/A",0,0,"N/A","N/A",173,"19,957","N/A","N/A",1,3.3,26,8,0,,"Pet Supplies","Standard Size","MFN","17.70 x 16.70 x 17.50 cm",0.52,"N/A","Oct 8, 2024",,"No",16,
80.,"Elliptical Cat Water Fountain Filter, 6 Filters Pack for Stainless Steel Top Elliptical Pet Fountain, 4 Carbon Filters and 2 Sponge Filters","B07ZR5TL6M","https://www.amazon.in/dp/B07ZR5TL6M?psc=1","https://m.media-amazon.com/images/I/61kxp2O9zkL._SY355_.jpg","Vekonn","1,804.7",0,0,"N/A",0,139,"20,545","N/A",423.14,8,4.6,307,3,"N/A",,"Pet Supplies","Standard Size","MFN","16.26 x 4.32 x 13.46 cm",0.07,"N/A","Feb 15, 2020",,"No",72,
81.,"Ultra-Silent Cat Water Fountain With LED Light and Activated Carbon Filter - 2 L for Cats and Small Dogs - Encourages Hydration and Improves Water Quality (Green)","B0C66W4CDS","https://www.amazon.in/dp/B0C66W4CDS?psc=1","https://m.media-amazon.com/images/I/61ba3xQeP9L._SX679_.jpg","Pet a pet","N/A",9,0,"N/A","10,199.26",162,"20,583","N/A","N/A",1,3.6,20,6,0,,"Pet Supplies","Standard Size","FBA","16.60 x 13.30 x 16.60 cm",0.53,"N/A","May 24, 2023",,"No",33,
82.,"cat Fountain + 3pack","B0F5N61BBN","https://www.amazon.in/dp/B0F5N61BBN?psc=1","https://m.media-amazon.com/images/I/61uZTlh2NLL._SX679_PIbundle-4,TopRight,0,0_SX679SY771SH20_.jpg","MISFANS","1,789",0,0,"N/A",0,20,"20,799","N/A",560.52,1,4.4,"1,872",6,195,"MISFANS PVT LIMITED","Pet Supplies","Standard Size","FBA","19.51 x 11.40 x 19.41 cm",0.56,"N/A","May 17, 2025",,"No",9,"MISFANS PVT LIMITED"
83.,"Automatic Cycle Multiple Filtering Cat & Dog Water Fountain | 64oz/1.8L Automatic Pet Drinking Fountain with Quiet Pump, Transparent Bowl, Hygienic Water Dispenser for Cats, Dogs & Multiple Pets","B0DJF5878M","https://www.amazon.in/dp/B0DJF5878M?psc=1","https://m.media-amazon.com/images/I/61FGfVb0fpL._SY450_.jpg","Shrevi","N/A",0,0,"N/A","N/A",194,"21,014","N/A","N/A",1,3.4,28,8,0,,"Pet Supplies","Standard Size","FBA","17.00 x 17.00 x 17.00 cm",0.5,"N/A","Oct 3, 2024",,"No",16,
84.,"PetVogue Ultra Premium Stainless Steel Cat Water Dispenser, Large 3.0L Dog Fountain with Ultra-Quiet Pump, Comes with 2 Spouts","B0C3ZSZNTQ","https://www.amazon.in/dp/B0C3ZSZNTQ?psc=1","https://m.media-amazon.com/images/I/61EM3vl-HEL._SX425_.jpg","PetVogue","N/A",0,0,"N/A","N/A",126,"21,087","N/A","N/A",1,4,24,7,"N/A",,"Pet Supplies","Standard Size","FBA","13.00 x 21.00 x 21.00 cm",0.75,"N/A","May 1, 2023",,"No",33,
85.,"6 Pcs Fountain, Cat Water Fountain Filter, for Cat Water Fountain Replacement Filters for Automatic Dog Drinking Dispenser Keeping Water Clear","B0DKSNV753","https://www.amazon.in/dp/B0DKSNV753?psc=1","https://m.media-amazon.com/images/I/61b5b0nSsLL._SY450_.jpg","NUDFSY","N/A",0,0,"N/A","N/A",142,"21,099","N/A","N/A",1,3.8,15,7,0,,"Pet Supplies","Standard Size","FBA","20.60 x 5.20 x 11.00 cm",0.08,"N/A","Oct 24, 2024",,"No",16,
86.,"Cat Water Fountain, 1.8L Automatic Pet Drinking Fountain, Dog Water Dispenser with Transparent Ultra-Quiet Smart, with Filter and Adapter, Suitable for Cats, Small and Medium Dogs (Clear)","B0DJFMZHN3","https://www.amazon.in/dp/B0DJFMZHN3?psc=1","https://m.media-amazon.com/images/I/71gf7mB8n1L._SX355_.jpg","OCTOPUSPRIME",949,12,0,"N/A","11,662.35",187,"21,208","N/A",271.86,1,2.9,15,9,0,,"Pet Supplies","Standard Size","MFN","15.00 x 17.00 x 17.00 cm",0.5,"N/A","Oct 3, 2024",,"No",16,
87.,"6PCS Cat Water Fountain Filter, Water Fountain for Cats, Cat Water Fountain Filter, Water Fountain f","B0F6S88H5D","https://www.amazon.in/dp/B0F6S88H5D?psc=1","https://m.media-amazon.com/images/I/71gi1fZPvpL._SY355_.jpg","Vihaanta",299,5,0,"N/A","1,549.25",100,"21,273","N/A",127.44,1,4,1,7,0,"vihaanta","Pet Supplies","Standard Size","FBA","19.81 x 4.06 x 11.43 cm",0.11,"N/A","Apr 29, 2025",,"No",10,"vihaanta"
88.,"Cat Water Fountain Stainless Steel, 134oz/4 L Pet Water Fountain Automatic Cat Fountain Water Bowl with Transparent Window, Water Dispenser for Dogs (Silver, Handy- 4L)","B0FW59Y2FV","https://www.amazon.in/dp/B0FW59Y2FV?psc=1","https://m.media-amazon.com/images/I/61jeyFBpQnL._SY450_.jpg","SHOPOBOX","3,399",7,0,"N/A","10,886.14",168,"21,644","N/A",679.54,1,5,2,7,0,"SHOPOBOX SALES INDIA","Pet Supplies","Standard Size","FBA","10.00 x 14.00 x 14.00 cm",0.8,"N/A","Mar 10, 2023",,"No",35,"SHOPOBOX SALES INDIA"
89.,"OYES Stainless Steel Cat Water Fountain - 2.0L/67Oz Automatic Circulating Pet Fountain With Ultra-Quiet Pump, Led Light - Dishwasher Safe For Cats And Puppies","B09M2XKDWX","https://www.amazon.in/dp/B09M2XKDWX?psc=1","https://m.media-amazon.com/images/I/71HSBCF3raL._SX466_.jpg","OYES","3,152",5,0,"N/A","17,833.08",158,"21,831","N/A",695.02,2,4,"2,396",7,9,"IBHEJO","Pet Supplies","Standard Size","FBA","22.90 x 10.00 x 22.80 cm",0.72,"N/A","Dec 24, 2021",,"No",50,"IBHEJO"
90.,"24x7 eMall Pet Water Fountain with Filter and Pump, 13.5 x 13.5 x 10 cm, Small Drinking Bowl for Cats and Dogs, Cat Fountain for Home","B0FJM9DRT4","https://www.amazon.in/dp/B0FJM9DRT4?psc=1","https://m.media-amazon.com/images/I/61ldeqLsPZL._SX466_.jpg","24x7 eMall","N/A",9,0,"N/A","4,657.44",133,"22,076","N/A","N/A",1,4.2,3,6,0,,"Pet Supplies","Standard Size","MFN","14.40 x 11.00 x 13.90 cm",0.29,"N/A","Jul 23, 2025",,"No",7,
91.,"USB Automatic Pets Cat Water Drinking Fountain Silenced Pump Power Adapter | Dishes Feeders & Fountains | Cat Supplies | Pet Supplies","B0FZV39M4C","https://www.amazon.in/dp/B0FZV39M4C?psc=1","https://m.media-amazon.com/images/I/51FqODNNFxL._SX466_.jpg","TRENDYNEST","N/A",0,0,"N/A","N/A",133,"22,115","N/A","N/A",1,"N/A",0,"N/A",0,,"Pet Supplies","N/A","N/A","N/A","N/A","N/A","N/A",,"No","N/A",
92.,"FEELING MALL 5L Dog Water Dispenser | Dog Water Fountain | Automatic Water Dispenser for Pets | Wireless Automatic Infrared Sensing Pet Water Fountain | Pet Fountain for Cat","B0D6GMSPPK","https://www.amazon.in/dp/B0D6GMSPPK?psc=1","https://m.media-amazon.com/images/I/514rmjyk1gL._SY450_.jpg","FEELING MALL","2,299",4,0,"N/A","9,808.03",173,"22,222","N/A",496.05,1,3,1,6,0,"FEELING MALL","Pet Supplies","Standard Size","FBA","8.00 x 7.00 x 10.00 cm",0.4,"N/A","Jun 7, 2024",,"No",20,"FEELING MALL"
93.,"Cat Water Fountain, 1.8L Automatic Pet Drinking Fountain, Dog Water Dispenser with Transparent Ultra-Quiet Smart, with Filter and Adapter, Suitable for Cats, (1.8 Liter)","B0DHS8SFMK","https://www.amazon.in/dp/B0DHS8SFMK?psc=1","https://m.media-amazon.com/images/I/61cgT5G9+0L._SX679_.jpg","ARJEX",999,8,0,"N/A","7,949.05",169,"22,281","N/A",324.37,1,3.1,27,9,0,"SONIQE","Pet Supplies","Standard Size","FBA","17.20 x 16.50 x 17.10 cm",0.51,"N/A","May 16, 2025",,"No",9,"SONIQE"
94.,"Dog Trust Pet Products 3L Pet Water Fountain Pet for Cats & Dogs, Dry Burning Protection Pump Cat Fountain Water Bowl, Automatic Water Dispenser for Cats with Low Water Shut Off","B0CL9PJ2VQ","https://www.amazon.in/dp/B0CL9PJ2VQ?psc=1","https://m.media-amazon.com/images/I/61ccAm6BGvL._SX522_.jpg","Dog Trust","1,249",6,0,"N/A","7,197.69",177,"22,297","N/A",506.37,1,3.8,23,9,0,"ETrade Online","Pet Supplies","Standard Size","FBA","37.40 x 16.90 x 30.30 cm",0.66,"N/A","Oct 18, 2023",,"No",28,"ETrade Online"
95.,"Cat Water Fountain Filters, 84oz/2.5L Cat Fountain Compatible, 8Pack","B0925DNJ2Y","https://www.amazon.in/dp/B0925DNJ2Y?psc=1","https://m.media-amazon.com/images/I/61gyaTkqn9L._SX450_.jpg","BONBELONG",533,6,0,"N/A","3,024.88",68,"22,974","N/A",196.62,1,4.4,"2,792",7,18,"Beauty_Basket","Pet Supplies","Standard Size","FBA","25.00 x 4.30 x 13.10 cm",0.11,"N/A","Oct 19, 2024",,"No",16,"Beauty_Basket"
96.,"8PCS Cat Water Fountain Filter, Freestanding, Tabletop, Wall-Mounted, Arc-Shaped NonWoven Cat Water Dispenser Filter Element with Triple Filtration System","B0FQV472WZ","https://www.amazon.in/dp/B0FQV472WZ?psc=1","https://m.media-amazon.com/images/I/71c7B1WnoML._SX569_.jpg","Pmeixcy","N/A",10,0,"N/A","4,429.55",154,"23,062","N/A","N/A",1,1,1,7,0,,"Pet Supplies","Standard Size","FBA","15.40 x 5.30 x 13.20 cm",0.03,"N/A","Sep 12, 2025",,"No",5,
97.,"PetVogue Cat Fountain Water Dispensor (2.2 LTR Water Dispenser)","B0C8D6V3VC","https://www.amazon.in/dp/B0C8D6V3VC?psc=1","https://m.media-amazon.com/images/I/71PsqS0Hy-L._SX679_.jpg","PetVogue","N/A",0,0,"N/A","N/A",63,"23,384","N/A","N/A",1,4.3,34,7,0,,"Pet Supplies","Standard Size","FBA","18.50 x 13.80 x 17.10 cm",0.64,"N/A","Feb 3, 2024",,"No",24,
98.,"NPET Resin Cat Foutain, 54Oz/1.6L Automatic Cat Water Fountain | Bottom Suction Ultra Quiet Pump For Cats & Small Dogs Without Adapter (Wf050Tp)","B0895P6XBV","https://www.amazon.in/dp/B0895P6XBV?psc=1","https://m.media-amazon.com/images/I/71AkRMGBWrL._SX679_.jpg","NPET","3,319.34",5,0,"N/A","26,550.1",144,"23,398","N/A",685.49,9,4.4,"13,265",8,6,,"Pet Supplies","Standard Size","MFN","17.40 x 16.89 x 17.20 cm",0.67,"N/A","Jul 9, 2020",,"No",67,
99.,"24x7 eMall Cat Pet Fountain with FilterUltra Quiet Cat Drinking Fountain with Filter, Automatic Pet Water Fountain for Cats and Small Dogs","B0BCGMQ1Y8","https://www.amazon.in/dp/B0BCGMQ1Y8?psc=1","https://m.media-amazon.com/images/I/41Ji37pEiiL._SX466_.jpg","24x7 eMall",799,5,0,"N/A","4,962.06",138,"21,530","N/A","N/A",1,3.9,434,8,1,"24x7 eMall ®","Pet Supplies","Standard Size","FBA","16.80 x 13.10 x 16.40 cm",0.53,"N/A","Jun 9, 2020",,"No",68,"24x7 eMall ®"
100.,"2.5 Liter Automatic Pet Drinking Fountain for Dog and cat | BPA-Free, Ultra-Quiet Pump, 3 Water Flow Modes, USB Compatible, Clean Water for Pets | Animal Water Dispenser (1)","B0FF4CJBP8","https://www.amazon.in/dp/B0FF4CJBP8?psc=1","https://m.media-amazon.com/images/I/61i-kz1yAML._SX466_.jpg","SNAPSHOPECOM",829,4,0,"N/A","3,119.38",173,"23,574","N/A","N/A",1,5,1,9,0,"ISHVARBHAI DHARAMSHIBHAI VANANI","Pet Supplies","N/A","FBA","N/A","N/A","N/A","Jun 23, 2025",,"No",8,"ISHVARBHAI DHARAMSHIBHAI VANANI"