"Display Order","Product Details","ASIN","URL","Image URL","Brand","Price  ₹","Sales","Variation Sales Strength (1 - 10)","Recent Purchases","Revenue","Title Char. Count","BSR","Seller Country/Region","Fees  ₹","Active Sellers","Ratings","Review Count","Images","Review velocity","Buy Box","Category","Size Tier","Fulfillment","Dimensions","Weight","ABA Most Clicked","Creation Date","Sponsored","Best Seller","Seller Age (mo)","Seller"
1.,"Qpets® Cat Water Fountain with LED Light, 67oz/2.0L, Ultra Quiet Cat Drinking Fountain with Filter, Automatic Pet Water Fountain for Cats and Small Dogs, Blue (Blue Water Fountain)","B09BQ4NGDH","https://www.amazon.in/dp/B09BQ4NGDH?psc=1","https://m.media-amazon.com/images/I/61gkQDH+tmL._SX569_.jpg","Qpets","1,219",840,0,200,"1,123,251.98",180,298,"N/A",409.91,2,4.1,"1,284",8,24,"Qpets Mall","Pet Supplies","Standard Size","FBA","19.00 x 17.10 x 18.90 cm",0.72,"N/A","Aug 3, 2021",,"No",54,"Qpets Mall"
2.,"Amazon Basics Automatic Pet Water Fountain | Stainless Steel Bowl | Continuous Flow with Filter | Ultra-Quiet | 3L Capacity | for Cats & Dogs","B0F5Q1FGB4","https://www.amazon.in/dp/B0F5Q1FGB4?psc=1","https://m.media-amazon.com/images/I/611ErB-dS0L._SY355_.jpg","amazon basics","2,999",326,0,200,"792,215.31",141,826,"N/A",672.46,1,4.2,470,8,5,"ETrade Online","Pet Supplies","Standard Size","FBA","24.30 x 11.90 x 23.60 cm",0.74,"N/A","Apr 21, 2025",,"No",10,"ETrade Online"
3.,"Pets Empire Cat Water Fountain 1.8l Automatic Cycle Multiple Filtering Cat Dog Water Dispenser Super Quiet Automatic Pet Drinking Fountain with Faucet Kits","B0CRVP34GH","https://www.amazon.in/dp/B0CRVP34GH?psc=1","https://m.media-amazon.com/images/I/71gf7mB8n1L._SX355_.jpg","PETS EMPIRE",995,157,0,100,"165,271.22",155,"1,298","N/A","N/A",1,3.5,31,8,2,"ETrade Online","Pet Supplies","Standard Size","FBA","24.00 x 19.40 x 23.90 cm",0.97,"N/A","Jan 9, 2024",,"No",25,"ETrade Online"
4.,"Cat Water Fountain Blue Flower Cat Fountain Cute Small Pet Water Fountain - for Kitten&Kitty& Small Dogs - 2L","B0FS1NTTCK","https://www.amazon.in/dp/B0FS1NTTCK?psc=1","https://m.media-amazon.com/images/I/61xzqUz0BeL._SY450_.jpg","AONBOY","1,199",167,0,50,"239,746.75",109,"1,450","N/A",401.06,2,4.2,"34,192",7,216,"Beauty_Basket","Pet Supplies","Standard Size","FBA","17.20 x 16.90 x 17.10 cm",0.54,"N/A","Sep 22, 2025",,"No",5,"Beauty_Basket"
5.,"Petverse® Motion Sensor Stainless Steel Pet Water Fountain for Cats & Dogs-4L, Wireless, Battery Operated, 3 Modes (Sensor/Timer/Continuous), Triple Filtration, FCC/CE/RoHS Certified, 12M Warranty","B0FHBBQ3JS","https://www.amazon.in/dp/B0FHBBQ3JS?psc=1","https://m.media-amazon.com/images/I/71-iHgmOFHL._SY355_.jpg","Petverse","5,499",46,0,30,"229,490.17",196,"2,437","N/A","1,081.33",1,4,23,9,0,"PETVERSE","Pet Supplies","Standard Size","FBA","24.50 x 16.40 x 24.30 cm",1.09,"N/A","Jul 11, 2025",,"No",7,"PETVERSE"
6.,"Emily Pets Cat Water Fountain, 2.5L Capacity, Dual Stream Design, Electric USB Powered, 16.5 x 11.5 x 12 cm (Color May Vary)","B0FR94WJ51","https://www.amazon.in/dp/B0FR94WJ51?psc=1","https://m.media-amazon.com/images/I/71mGzaL-uzL._SX466_.jpg","emily pets",999,94,0,50,"94,073.07",124,"2,509","N/A",280.7,3,3.8,14,9,4,"ETrade Online","Pet Supplies","Standard Size","FBA","17.60 x 12.60 x 14.60 cm",0.42,"N/A","Sep 16, 2025",,"No",5,"ETrade Online"
7.,"Petverse® Wireless Cat Water Fountain – FCC, CE & RoHS Certified, BPA-Free, Ultra Quiet 2L Pet Water Dispenser for Cats & Dogs with Filters & 3 Operation Modes, Battery Operated, LED Light","B0FH9NMF79","https://www.amazon.in/dp/B0FH9NMF79?psc=1","https://m.media-amazon.com/images/I/71FaODGK5WL._SY450_.jpg","Petverse","2,499",63,0,40,"152,306.19",188,"2,553","N/A",644.73,1,3.9,35,9,3,"PETVERSE","Pet Supplies","Standard Size","FBA","25.75 x 16.30 x 25.60 cm",1.14,"N/A","Jul 11, 2025",,"No",7,"PETVERSE"
8.,"Pet Water Fountain Super Silent - Water Fountains for All Pets Indoor - Suitable for Cats, Birds, Rabits and Dogs (Transparent01, 2L)","B0FV8SPKX4","https://www.amazon.in/dp/B0FV8SPKX4?psc=1","https://m.media-amazon.com/images/I/51GGIYv1IyL.jpg","BEMOONY","1,199",122,0,30,"140,332.38",133,"2,615","N/A",401.06,1,4.4,148,7,10,"FURRY LIFE","Pet Supplies","Standard Size","FBA","17.20 x 16.30 x 16.70 cm",0.54,"N/A","Oct 8, 2025",,"No",4,"FURRY LIFE"
9.,"MAK7 Transparent Cat Water Fountain | Automatic Water Fountain for Pets Dispenser | Cat Water Dispenser for Cats & Small Pets, Health Hydration System","B0G393FXFH","https://www.amazon.in/dp/B0G393FXFH?psc=1","https://m.media-amazon.com/images/I/81AAVcYn7LL._SX679_.jpg","MAK7 ONLINE BIZ","1,099",61,0,40,"67,147.01",150,"2,644","N/A",386.31,1,5,2,7,0,"MAK7 ONLINE BIZ","Pet Supplies","Standard Size","FBA","17.90 x 16.00 x 17.10 cm",0.53,"N/A","Nov 21, 2025",,"No",3,"MAK7 ONLINE BIZ"
10.,"YellowCult Pet Water Fountain for Cats Dogs Kitten, 1.8L Automatic Cat Drinking Water Dispenser Feeder for Cats and Medium to Large Dogs Indoor, Dog Water Fountain Feeder Large Capacity at Home","B0F13HM22G","https://www.amazon.in/dp/B0F13HM22G?psc=1","https://m.media-amazon.com/images/I/61R-EJnoQYL._SY450_.jpg","YellowCult",899,53,0,30,"47,962.23",193,"2,746","N/A",317.29,1,3.2,10,7,1,"ETrade Online","Pet Supplies","Standard Size","FBA","17.50 x 16.70 x 17.20 cm",0.57,"N/A","Mar 11, 2025",,"No",11,"ETrade Online"
11.,"LEMISH Multicolor Gravity-Fed Pet Water Dispenser, 3.8L Large Capacity, Cat & Dog Feeder","B07Z3HGLZF","https://www.amazon.in/dp/B07Z3HGLZF?psc=1","https://m.media-amazon.com/images/I/51KS3lz2B4L._SX466_.jpg","Lemish",605,45,0,30,"27,045.79",88,"2,911","N/A",417.19,1,4,420,9,0,"DRIXTY","Pet Supplies","Standard Size","FBA","36.79 x 19.50 x 32.20 cm",0.32,"N/A","Sep 11, 2020",,"No",65,"DRIXTY"
12.,"10-Pack Activated Carbon Filters for Cat Water Fountain, Replacement Filters for Water Fountain for Pets & Cat Water Dispenser, Keeps Pet Fountain Water Clear & Fresh","B0FPCL17S7","https://www.amazon.in/dp/B0FPCL17S7?psc=1","https://m.media-amazon.com/images/I/61xClhEC3QL._SX569_.jpg","Cybersnc",559,53,0,40,"29,777.45",166,"2,929","N/A",226.9,1,3.5,3,6,0,"NKPP Shop","Pet Supplies","Standard Size","FBA","35.90 x 5.10 x 22.30 cm",0.1,"N/A","Sep 1, 2025",,"No",5,"NKPP Shop"
13.,"Qpets® Automatic Cycle Multiple Filtering Cat Water Fountain Dog Water Dispenser 1.8L Super Quiet Automatic Pet Drinking Fountain with Faucet Kits","B09FS381N6","https://www.amazon.in/dp/B09FS381N6?psc=1","https://m.media-amazon.com/images/I/71+V8WF9JJL._SX425_.jpg","Qpets","1,866",102,0,40,"170,052.13",146,"3,284","N/A",505.34,3,4,360,8,2,"Qpets Mall","Pet Supplies","Standard Size","FBA","17.60 x 16.90 x 17.60 cm",0.59,"N/A","Sep 9, 2021",,"No",53,"Qpets Mall"
14.,"Parner Cat Drinking Fountain, Water Dispenser for Cats with Water Level Window, Cat Flower Art Water Bowl with 4 Pieces, Hygiene Filter, Pet Drinking Fountain with LED Light (Green, 2 litres)","B0FR56NFY9","https://www.amazon.in/dp/B0FR56NFY9?psc=1","https://m.media-amazon.com/images/I/31xFL9wrwkL._SY355_.jpg","Parner","1,377",175,0,"N/A","181,691.58",191,"3,404","N/A","N/A",1,3.9,"4,387",7,7,"Beauty_Basket","Pet Supplies","Standard Size","FBA","17.50 x 16.40 x 17.10 cm",0.54,"N/A","Sep 15, 2025",,"No",5,"Beauty_Basket"
15.,"PetVogue Exclusive Cat Water Fountain and Food Bowl, 3L Ultra Quiet Pet Water Dispenser, Dog Drinking Fountain with Ultra-Quiet Pump and Filter, for Cats and Small Dogs - Green","B0C8D8YN1K","https://www.amazon.in/dp/B0C8D8YN1K?psc=1","https://m.media-amazon.com/images/I/71ihKL+pQbL._SX522_.jpg","PetVogue","1,199",60,0,20,"72,573.93",176,"3,519","N/A",406.96,1,4,42,7,0,"Bigtime Enterprises","Pet Supplies","Standard Size","FBA","12.00 x 31.00 x 17.00 cm",0.85,"N/A","Jun 17, 2023",,"No",32,"Bigtime Enterprises"
16.,"Automatic Pet Water Fountain for Cats and Dogs Ultra-Quiet| BPA-Free and Easy to Clean - 2.5L Capacity with Flower Design and Filter System| Encourages Hydration and Fresh Water Flow (Blue)","B0G58FK5L6","https://www.amazon.in/dp/B0G58FK5L6?psc=1","https://m.media-amazon.com/images/I/71vSArXlqgL._SX569_.jpg","Pawbabas","1,399",24,0,10,"29,818.46",189,"3,596","N/A","N/A",1,5,2,8,0,"ETrade Online","Pet Supplies","Standard Size","FBA","21.60 x 12.30 x 21.20 cm",0.73,"N/A","Dec 5, 2025",,"No",2,"ETrade Online"
17.,"Water Fountain for Cats, Cat Drinking for Garden Indoor Outdoor Automatic Drinking Water Dispenser for Cats Dogs Other Pets Dog Water Fountain with Filter","B0GCNJNTDX","https://www.amazon.in/dp/B0GCNJNTDX?psc=1","https://m.media-amazon.com/images/I/41rBuX8xieL._SX466_.jpg","RIVUGJA",750.9,40,0,30,"31,609.68",154,"3,667","N/A","N/A",1,5,1,7,0,"RIVUGJA","Pet Supplies","Standard Size","FBA","4.00 x 20.00 x 10.00 cm",0.49,"N/A","Dec 26, 2025",,"No",2,"RIVUGJA"
18.,"Cat Water Fountain Animal Water Dispenser 2L Automatic Pet Drinking Fountain Clear Upgrade, 1 Adjustable Silent 1 Water Pump for Cats Kitty Indoor and Small Pets, Transparent","B0DJGMZL3D","https://www.amazon.in/dp/B0DJGMZL3D?psc=1","https://m.media-amazon.com/images/I/61FGfVb0fpL._SY450_.jpg","Virza trade",999,3,0,"N/A","3,300.44",174,"4,449","N/A",251.21,1,4.7,3,8,0,"RAPTUROUS","Pet Supplies","Standard Size","FBA","15.00 x 17.00 x 17.00 cm",0.5,"N/A","Oct 4, 2024",,"No",16,"RAPTUROUS"
19.,"Ultra-Quiet 2.2L/74oz Pet Water Fountain | USB-Powered, Quiet Operation, Keeps Drinks Fresh | Pet Water Station, Pet Accessory, Cat Water Fountain Automatic (White, M)","B0FBY5J148","https://www.amazon.in/dp/B0FBY5J148?psc=1","https://m.media-amazon.com/images/I/61tojeZ6gsL._SY355_.jpg","GHANU",949,67,0,30,"64,085.34",167,"4,542","N/A","N/A",1,3.6,17,7,1,"GHANU","Pet Supplies","N/A","FBA","N/A","N/A","N/A","Jun 4, 2025",,"No",8,"GHANU"
20.,"Petverse® Water Fountain Filters for 4L Smart Motion Sensor Stainless Steel Fountain | Multi-Layer Activated Carbon Filters for Cats & Dogs | Replacement Filter Pack of 2","B0G2MDQP48","https://www.amazon.in/dp/B0G2MDQP48?psc=1","https://m.media-amazon.com/images/I/41vnJde8iuL._SX466_.jpg","Petverse",599,15,0,10,"9,101.44",170,"4,569","N/A","N/A",1,1,1,4,0,"PETVERSE","Pet Supplies","Standard Size","FBA","10.10 x 2.20 x 8.10 cm",0.03,"N/A","Nov 17, 2025",,"No",3,"PETVERSE"
21.,"RBAYSALE Cat Water Fountain Filters for Parner 2.4 L Water Dispenser 10 Pack Triple Action Replacement Pet Filter Cartridges for Dogs Cat","B08RNKDNLC","https://www.amazon.in/dp/B08RNKDNLC?psc=1","https://m.media-amazon.com/images/I/71dOqhNJgnL._SX466_PIbundle-10,TopRight,0,0_SX466SY472SH20_.jpg","RBAYSALE",622,14,0,"N/A","8,978.71",137,"4,805","N/A",212.9,1,4.4,"6,851",7,83,"Beauty_Basket","Pet Supplies","Standard Size","FBA","26.20 x 5.10 x 13.20 cm",0.25,"N/A","Aug 9, 2023",,"No",30,"Beauty_Basket"
22.,"8PCS Cat Water Fountain Filter, Freestanding, Tabletop, Wall-Mounted, Arc-Shaped NonWoven Cat Water Dispenser Filter Element with Triple Filtration System","B0F3JFZY31","https://www.amazon.in/dp/B0F3JFZY31?psc=1","https://m.media-amazon.com/images/I/71c4J4CzyEL._SX569_.jpg","INOCEAN",759,41,0,30,"30,488.83",154,"4,891","N/A",225.96,1,4,16,7,0,"ECOCEAN","Pet Supplies","Standard Size","FBA","20.80 x 4.90 x 19.20 cm",0.05,"N/A","Apr 3, 2025",,"No",10,"ECOCEAN"
23.,"Buraq Automatic 2.2L Cat Water Fountain, Ultra-Quiet LED Drinking Fountain with Flower Waterfall, 4-Stage Filtration, USB Powered, Water Fountain for Cats & Dogs (Blue)","B0GH1C1ZC5","https://www.amazon.in/dp/B0GH1C1ZC5?psc=1","https://m.media-amazon.com/images/I/61oUBS7y54L._SY355_.jpg","BURAQ","1,199",22,0,10,"28,859.86",168,"4,988","N/A",357.4,1,"N/A",0,6,0,"BURAQ  PETS  ®","Pet Supplies","Standard Size","FBA","17.00 x 17.00 x 13.00 cm",0.7,"N/A","Jan 15, 2026",,"No",1,"BURAQ  PETS  ®"
24.,"Cat Water Fountain Stainless Steel, 108oz/3.2L Pet Water Fountain Automatic Cat Fountain Water Bowl with Transparent Window, Water Dispenser for Dogs, Dishwasher Safe","B0BVWJ37RP","https://www.amazon.in/dp/B0BVWJ37RP?psc=1","https://m.media-amazon.com/images/I/71stW6LmVHL._SX425_.jpg","MISFANS","3,299",16,0,10,"54,227.78",166,"5,034","N/A",716.71,1,4.3,819,8,2,"MISFANS PVT LIMITED","Pet Supplies","Standard Size","FBA","25.30 x 11.61 x 19.41 cm",0.8,"N/A","Mar 11, 2023",,"No",35,"MISFANS PVT LIMITED"
25.,"Cat Water Fountain, 2.1L/67oz Plastic Pet Water Fountain for Cats Inside Drinking, Automatic Dog Cat Water Dispenser with Water Level Window (Plastic, Black 2L)","B0FZCM4MTF","https://www.amazon.in/dp/B0FZCM4MTF?psc=1","https://m.media-amazon.com/images/I/61ObuvG551L._SX466_.jpg","FLOMERO","1,695",54,0,20,"101,710.76",160,"5,205","N/A","N/A",1,5,5,8,1,"MISFANS PVT LIMITED","Pet Supplies","N/A","FBA","N/A","N/A","N/A","Mar 20, 2025",,"No",11,"MISFANS PVT LIMITED"
26.,"8PCS Cat Water Fountain Filter, Water Fountain Filter Replacement with Sponge, Triple Filtration System for Clean Water, Multi-Cat Household Solution, Easy Maintenance","B0FR4Y43VT","https://www.amazon.in/dp/B0FR4Y43VT?psc=1","https://m.media-amazon.com/images/I/71tdtHsS3pL._SX569_.jpg","Truvart",659,21,0,10,"13,535.68",167,"5,227","N/A","N/A",1,"N/A",0,7,0,"truvart","Pet Supplies","Standard Size","FBA","19.10 x 4.50 x 18.80 cm",0.03,"N/A","Sep 15, 2025",,"No",5,"truvart"
27.,"(Label) Automatic Drinking Fountain Water Dispenser, Water Bowl for Dog and Cat","B07ZJGFD54","https://www.amazon.in/dp/B07ZJGFD54?psc=1","https://m.media-amazon.com/images/I/51MHo0FyRTL._SY450_.jpg","Supreme Mall",468.56,20,0,10,"9,467.3",79,"6,461","N/A",193.76,1,3.9,264,8,0,"Supreme Mall®","Pet Supplies","Standard Size","FBA","9.00 x 31.00 x 14.60 cm",0.49,"N/A","Oct 24, 2019",,"No",76,"Supreme Mall®"
28.,"Buraq Automatic Cat Water Fountain 2.2L, Ultra Silent Pump, Dual Faucet & Modes, USB Powered Drinking Dog Water Dispenser for Cats & Dogs (2.2 L Water Fountain)","B0GMJTTKTZ","https://www.amazon.in/dp/B0GMJTTKTZ?psc=1","https://m.media-amazon.com/images/I/617LE3eHZuL._SX466_.jpg","BURAQ","1,299",6,0,"N/A","7,794",160,"6,563","N/A",372.15,1,"N/A",0,7,0,"BURAQ  PETS  ®","Pet Supplies","Standard Size","FBA","17.00 x 17.00 x 13.00 cm",0.7,"N/A","Feb 9, 2026",,"No",0,"BURAQ  PETS  ®"
29.,"MAK7 Stainless Steel Pet Water Fountain for Cats & Dogs | Smart Automatic Pet Water Fountain 3L | Cat Water Fountain with Silent Pump Circulation System | Fresh & Automatic Pet Water Dispenser","B0G24CKMZC","https://www.amazon.in/dp/B0G24CKMZC?psc=1","https://m.media-amazon.com/images/I/815KZFb+3pL._SX522_.jpg","MAK7 ONLINE BIZ","2,609",39,0,30,"106,264.09",192,"7,580","N/A",614.92,1,3.8,3,7,1,"MAK7 ONLINE BIZ","Pet Supplies","Standard Size","FBA","23.80 x 11.20 x 23.80 cm",0.73,"N/A","Nov 13, 2025",,"No",3,"MAK7 ONLINE BIZ"
30.,"Petverse® Wireless Cat Water Fountain Filters - 2 Pack Activated Carbon Replacement Filters for Clean & Fresh Drinking Water","B0G2MHQZ3Y","https://www.amazon.in/dp/B0G2MHQZ3Y?psc=1","https://m.media-amazon.com/images/I/61v+wPLj+DL._SY450_.jpg","Petverse",499,10,0,10,"5,043.91",124,"7,841","N/A",173.93,1,"N/A",0,4,0,"PETVERSE","Pet Supplies","Standard Size","FBA","9.70 x 3.90 x 6.70 cm",0.03,"N/A","Nov 17, 2025",,"No",3,"PETVERSE"
31.,"Automatic Cat Water Fountain with Ultra-Quiet Pump | Activated Carbon Filter for Clean Drinking Water (Anthracite Grey, 3L)","B0FQZZ5V6M","https://www.amazon.in/dp/B0FQZZ5V6M?psc=1","https://m.media-amazon.com/images/I/61-eZZM+9wL._SX425_.jpg","Furry Life","1,595",0,0,"N/A",0,123,"7,903","N/A","N/A",1,3.5,2,"N/A",0,"FURRY LIFE","Pet Supplies","N/A","FBA","N/A","N/A","N/A","N/A",,"No","N/A","FURRY LIFE"
32.,"Premium Cat Drinking Fountain - Indoor/Outdoor Automatic Pet Water Fountain with Filter - 67oz Capacity for Cats & Dogs","B0CCWKRVVZ","https://www.amazon.in/dp/B0CCWKRVVZ?psc=1","https://m.media-amazon.com/images/I/61WQ3IgHSYL._SX569_.jpg","Pet Central","N/A",118,0,"N/A","153,729.92",119,"8,053","N/A","N/A",1,4.2,215,6,13,,"Pet Supplies","Standard Size","FBA","16.60 x 13.40 x 16.50 cm",0.53,"N/A","Jul 26, 2023",,"No",31,
33.,"PETKIT New Cat Water Fountain with Wireless Pump, Ultra Quiet 65oz/1.85L Pet Water Fountain for Cats and Dogs Inside, Detachable Design Easy to Clean and Assemble, Filters Included","B0C2YMBQ2Y","https://www.amazon.in/dp/B0C2YMBQ2Y?psc=1","https://m.media-amazon.com/images/I/61g7S1cXh8L._SX522_.jpg","PETKIT","3,990",9,0,"N/A","38,053.89",180,"8,654","N/A",818.63,1,4.5,575,8,12,"SMART PET Store","Pet Supplies","Standard Size","FBA","18.40 x 17.00 x 17.70 cm",1.01,"N/A","May 24, 2023",,"No",33,"SMART PET Store"
34.,"Qpets® 6PCS Cat Water Fountain Filter Replacements, Arc-Shaped NonWoven Cat Water Dispenser Filter Element with Triple Filtration System","B0CJJGM459","https://www.amazon.in/dp/B0CJJGM459?psc=1","https://m.media-amazon.com/images/I/61UL0V01DkL._SX466_.jpg","Qpets",722,28,0,20,"20,293.79",136,"9,117","N/A",195.2,1,3.9,25,7,0,"Xspace Offer","Pet Supplies","Standard Size","FBA","19.70 x 5.60 x 14.50 cm",0.04,"N/A","Sep 21, 2023",,"No",29,"Xspace Offer"
35.,"PetVogue Cat Water Fountain With LED Light, 2.0L Ultra Quiet Automatic Pet Drinking Fountain With Filter for Cats and Small Dogs, Orange","B0C8B129QK","https://www.amazon.in/dp/B0C8B129QK?psc=1","https://m.media-amazon.com/images/I/51voVl+ytML._SY450_.jpg","PetVogue","1,245",2,0,"N/A","2,141.44",136,"9,568","N/A",364.18,1,5,2,5,0,"Bigtime Enterprises","Pet Supplies","Standard Size","FBA","12.00 x 18.00 x 16.00 cm",0.42,"N/A","May 1, 2023",,"No",33,"Bigtime Enterprises"
36.,"GION Cats Dog Water Fountain Animal Water Dispenser 2.5L Automatic Pet Drinking Fountain for Cats Kitty Indoor and Small Pets, Ultra Quiet Cat Drinking Fountain with Filter (1Pcs)","B0D9DJ2BFL","https://www.amazon.in/dp/B0D9DJ2BFL?psc=1","https://m.media-amazon.com/images/I/61KgS8KqjWL._SX450_.jpg","GION",997,2,0,"N/A","2,120.7",179,"9,637","N/A",711.12,1,4,20,9,0,"G-Store","Pet Supplies","Standard Size","FBA","32.00 x 13.40 x 19.60 cm",0.72,"N/A","Jul 13, 2024",,"No",19,"G-Store"
37.,"AOOGITF Cat Water Fountain: Stainless Steel Pet Water Fountains Indoor Metal Automatic Cat/Dog Waterer Bowls Faucet Bottle Watering Pets 24/7 Running Water Dispenser For Drinking","B0BYD7KFFQ","https://www.amazon.in/dp/B0BYD7KFFQ?psc=1","https://m.media-amazon.com/images/I/71UKdNm-nJL._SX569_.jpg","AOOGITF","4,287.77",3,0,"N/A","14,797.17",178,"9,855","N/A",812.98,11,4.2,"2,938",8,9,,"Pet Supplies","Standard Size","MFN","19.30 x 11.71 x 19.30 cm",0.68,"N/A","Apr 4, 2023",,"No",34,
38.,"Cat Water Fountain 2.2L/74Oz Cute Dog Water Fountain Dispenser Super Silent Pet Drinking Fountain Abrevoir Pour Chat for Indoor Dogs Cats","B0FGVH1KJN","https://www.amazon.in/dp/B0FGVH1KJN?psc=1","https://m.media-amazon.com/images/I/71VGfRdABBL._SX466_.jpg","RtnSparsh",899,2,0,"N/A","2,328.58",137,"10,370","N/A","N/A",1,"N/A",0,"N/A",0,"SPARSH SALES","Pet Supplies","Standard Size","FBA","14.50 x 19.00 x 14.50 cm",0.6,"N/A","Jul 5, 2025",,"No",7,"SPARSH SALES"
39.,"RvPaws LED Pet Water Fountain for Dogs & Cats – Quiet Filtered Dispenser with Automatic Night Light, Promotes Hydration & Clean Drinking Water","B0FB8TLXJM","https://www.amazon.in/dp/B0FB8TLXJM?psc=1","https://m.media-amazon.com/images/I/31UfUNc0CrL._SX466_.jpg","RvPaws","1,699",0,0,"N/A",0,142,"10,457","N/A","N/A",1,"N/A",0,"N/A",0,"RISHAV PET CARE®","Pet Supplies","N/A","FBA","N/A","N/A","N/A","N/A",,"No","N/A","RISHAV PET CARE®"
40.,"WellToBe Battery Operated Cat Water Fountain, 2.5L Smart Pet Water Fountain for Cats and Dogs with Motion Sensor, Wireless Automatic Cat Water Dispenser with Ultra Quiet Pump, 2 Filters","B0DRHXTYMV","https://www.amazon.in/dp/B0DRHXTYMV?psc=1","https://m.media-amazon.com/images/I/6114ZuEuD5L._SX569_.jpg","WellToBe","2,699",22,0,10,"59,142.73",185,"10,499","N/A","N/A",1,4.2,15,8,0,"Welltobe","Pet Supplies","Standard Size","FBA","23.90 x 17.70 x 20.00 cm",0.96,"N/A","Dec 26, 2024",,"No",14,"Welltobe"
41.,"iPettie Neverland Cat Water Fountain with LED Light, 67oz/2.0L, Ultra Quiet Drinking Waterer, Automatic Filtered Water Dispenser, Water Purifier for Pets, (Transparent)","B0G1H1C9ZB","https://www.amazon.in/dp/B0G1H1C9ZB?psc=1","https://m.media-amazon.com/images/I/612zk4jUjLL._SX522_.jpg","iPettie","1,249",37,0,"N/A","46,574.27",168,"10,577","N/A",364.77,2,4.3,"7,916",7,16,"Just Peachy!","Pet Supplies","Standard Size","FBA","17.70 x 16.40 x 17.20 cm",0.57,"N/A","Nov 8, 2025",,"No",3,"Just Peachy!"
42.,"ELEPHANTBOAT® 5V USB Cat Water Fountain Pump, Cat Water Replacement Fountain Pump with Low Noise, Drinking Fountain Cat Water Dispenser Cat Water Fountain Pump for Pet","B0BNLD9LM1","https://www.amazon.in/dp/B0BNLD9LM1?psc=1","https://m.media-amazon.com/images/I/51yZbNWSIKL._SY355_.jpg","ELEPHANTBOAT",759,21,0,10,"15,629.34",167,"10,654","N/A",225.96,1,4.3,5,7,0,"ELEPHANTBOAT Mall","Pet Supplies","Standard Size","FBA","9.30 x 5.90 x 7.20 cm",0.13,"N/A","Nov 29, 2022",,"No",39,"ELEPHANTBOAT Mall"
43.,"Catit PIXI Cat Drinking Fountain, Running Water Fountain, Green","B095PZRWB1","https://www.amazon.in/dp/B095PZRWB1?psc=1","https://m.media-amazon.com/images/I/61gAMaIUb9S._SX679_.jpg","Catit","2,999",5,0,"N/A","14,985.9",63,"10,655","N/A",672.46,2,4.2,"1,760",4,25,"MAPLE PETS","Pet Supplies","Standard Size","FBA","21.20 x 19.20 x 20.60 cm",0.99,"N/A","Aug 23, 2021",,"No",54,"MAPLE PETS"
44.,"Emily Pets Cat Water Fountain, Plastic Automatic Drinking Bowl, 2.5L Capacity, Circulating Fountain Design with Filter, Indoor Use, 16.5x11.5x12.7 cm (Colors May Vary)","B0FTVWDT42","https://www.amazon.in/dp/B0FTVWDT42?psc=1","https://m.media-amazon.com/images/I/71mGzaL-uzL._SX466_.jpg","emily pets",999,37,0,20,"37,168.52",167,"10,667","N/A",280.7,3,2.6,5,9,1,"ETrade Online","Pet Supplies","Standard Size","FBA","17.30 x 12.90 x 14.50 cm",0.39,"N/A","Oct 4, 2025",,"No",4,"ETrade Online"
45.,"Qpets® Cat Water Fountain for Pets, Stainless Steel 2.2L Automatic Dog Water Dispenser with Filter, Encourages Drinking & Prevents UTIs, Ultra Quiet Pump, Easy Clean Design for Cats & Small Dogs","B0G39CRQPQ","https://www.amazon.in/dp/B0G39CRQPQ?psc=1","https://m.media-amazon.com/images/I/51OdX8OBmcL._SX425_.jpg","Qpets","N/A",18,0,"N/A","52,775.87",194,"11,001","N/A","N/A",1,5,1,7,0,,"Pet Supplies","Standard Size","FBA","11.50 x 19.50 x 19.50 cm",0.57,"N/A","Nov 21, 2025",,"No",3,
46.,"Catit PIXI Cat Drinking Fountain, Running Water Fountain, Blue","B095Q1YCR3","https://www.amazon.in/dp/B095Q1YCR3?psc=1","https://m.media-amazon.com/images/I/61am+6lapfS._SX569_.jpg","Catit","2,999",12,0,"N/A","36,065.89",62,"11,663","N/A",672.46,2,4.2,"10,388",4,140,"MAPLE PETS","Pet Supplies","Standard Size","FBA","21.30 x 19.30 x 20.60 cm",1.01,"N/A","May 24, 2021",,"No",57,"MAPLE PETS"
47.,"2.2L Ultra-Quiet Pet Water Fountain - Automatic Cat Drinking Water Dispenser with USB-Powered Filter for Cats & Dogs, Circulation System, Easy Cleaning for Indoor Cats, Without Battery (White, Medium)","B0FGTFTFLX","https://www.amazon.in/dp/B0FGTFTFLX?psc=1","https://m.media-amazon.com/images/I/71VGfRdABBL._SX466_.jpg","Siarth",899,35,0,10,"31,616.79",200,"11,708","N/A",267.73,1,2.1,3,7,1,"Dhvani sales","Pet Supplies","Standard Size","FBA","14.50 x 19.00 x 14.50 cm",0.75,"N/A","Jul 5, 2025",,"No",7,"Dhvani sales"
48.,"6Pcs Cat Water Fountain Filter, Circular Non-Woven Cat Fountain Filter, Cat Fountain Water Filter Activated Carbon Filter Element with Triple Filtration System for Water Fountain for Cats","B0DKBYYGXB","https://www.amazon.in/dp/B0DKBYYGXB?psc=1","https://m.media-amazon.com/images/I/61NO2eR7O0L._SX522_PIbundle-6,TopRight,0,0_AA522SH20_.jpg","Plexaris",533,14,0,"N/A","8,590.04",187,"11,902","N/A",220.22,1,3.5,22,7,0,"FDLTMK","Pet Supplies","Standard Size","FBA","22.10 x 4.80 x 19.00 cm",0.12,"N/A","Oct 19, 2024",,"No",16,"FDLTMK"
49.,"Automatic Pet Water Fountain for Cats & Dogs – Quiet Flow Drinking Fountain with Continuous Fresh Water Circulation","B0GDQVJKD1","https://www.amazon.in/dp/B0GDQVJKD1?psc=1","https://m.media-amazon.com/images/I/41rBuX8xieL._SX466_.jpg","RIVUGJA",799,4,0,"N/A","3,196",115,"12,160","N/A",259.47,1,"N/A",0,8,0,"RIVUGJA","Pet Supplies","Standard Size","FBA","4.00 x 22.00 x 12.00 cm",0.49,"N/A","Jan 2, 2026",,"No",1,"RIVUGJA"
50.,"YellowCult Cat Water Fountain & Food Bowl, 3L Ultra Quiet Pet Feeder Drinking Water Dispenser set for puppy dogs kitten Cat Pet Large Capacity at home, Automatic Flower Fountain & Stainless Steel Bowl","B0F13KYL1C","https://www.amazon.in/dp/B0F13KYL1C?psc=1","https://m.media-amazon.com/images/I/617IFsEbtdL._SX569_.jpg","YellowCult","1,298",13,0,"N/A","16,286.26",200,"12,836","N/A","N/A",1,5,2,7,0,"ETrade Online","Pet Supplies","Standard Size","FBA","32.50 x 13.20 x 18.10 cm",0.73,"N/A","Mar 11, 2025",,"No",11,"ETrade Online"
51.,"Cat Water Fountain Pump with LED Light, USB Jack, Suitable for 1108/3.2L & 67oz/2L/4L/134oz Pet Fountain Stainless Steel(S3-SC), Ultra Quiet, Super Waterproof, Long Lifespan (MOTOR, FOUNTAIN MOTOR)","B0GJPN3TVF","https://www.amazon.in/dp/B0GJPN3TVF?psc=1","https://m.media-amazon.com/images/I/61ZJo89q-xL._SX679_.jpg","Foliam","1,499",0,0,"N/A",0,197,"8,575","N/A","N/A",1,4.5,48,"N/A",0,"Foliam Sales India","Pet Supplies","N/A","FBA","N/A","N/A","N/A","N/A",,"No","N/A","Foliam Sales India"
52.,"Trixie Drinking Fountain Flower Water Dispenser for Dogs and Cats, Pet Water Fountain, Provides Filtered Water - 2 L, 7L × 5W × 7H inch (White and Grey)","B0CGM5F2MD","https://www.amazon.in/dp/B0CGM5F2MD?psc=1","https://m.media-amazon.com/images/I/413SQi2SDDL._SX466_.jpg","TRIXIE","2,480",2,0,"N/A","5,776.06",152,"13,081","N/A",522.74,2,5,2,7,0,"Pet - Central","Pet Supplies","Standard Size","FBA","5.00 x 15.00 x 10.00 cm",0.3,"N/A","Aug 25, 2023",,"No",30,"Pet - Central"
53.,"Cat Water Fountain, 84oz/2.5L Stainless Steel Pet Water Dispenser, Automatic Dog Water Dispenser, Ultra-Quiet Pump, Perfect for Cats, Dogs and Multiple Pets","B0C3T4KKGB","https://www.amazon.in/dp/B0C3T4KKGB?psc=1","https://m.media-amazon.com/images/I/61f4ZJuDQGL._SX679_.jpg","BOORCA","4,904",2,0,"N/A","16,555.46",156,"13,310","N/A",920.4,7,4.3,"1,419",6,226,,"Pet Supplies","Standard Size","MFN","19.00 x 14.40 x 18.90 cm",0.81,"N/A","Jun 10, 2023",,"No",32,
