"Display Order","Product Details","ASIN","URL","Image URL","Brand","Price  ₹","Sales","Variation Sales Strength (1 - 10)","Recent Purchases","Revenue","Title Char. Count","BSR","Seller Country/Region","Fees  ₹","Active Sellers","Ratings","Review Count","Images","Review velocity","Buy Box","Category","Size Tier","Fulfillment","Dimensions","Weight","ABA Most Clicked","Creation Date","Sponsored","Best Seller","Seller Age (mo)","Seller"
1.,"Coway Airmega 150 (Ap-1019C) Air Purifier For Home, Longest Filter Life 8500Hrs (Approx. 1.5-2 Yrs), Anti-Virus True Hepa Filter (H13), Kills Allergies, Virus, Germs & Pm 0.01 With 99.999% Efficiency, White","B08GJ57MKL","https://www.amazon.in/dp/B08GJ57MKL?psc=1","https://m.media-amazon.com/images/I/91mE+0CCnGL._SX569_.jpg","Coway","15,999","N/A",0,"1,000","N/A",206,206,"N/A","N/A",1,4.5,"8,372","N/A","N/A","Frootle India Pvt. Ltd.","Home & Kitchen","N/A","FBA","N/A","N/A","N/A","N/A",,"No","N/A","Frootle India Pvt. Ltd."
2.,"Honeywell Air Purifier for Home & Office, 3-in-1, Pre, H13 HEPA, Activated Carbon, Removes 99.99% Pollutants, Allergens, Pet Dander, Smoke, Dust & Pollens - Air touch V1","B0DB65HXZP","https://www.amazon.in/dp/B0DB65HXZP?psc=1","https://m.media-amazon.com/images/I/71ipnrfS-1L._SX466_.jpg","Honeywell","4,997","N/A",0,"3,000","N/A",169,379,"N/A","N/A",9,4,"11,285","N/A","N/A","RetailEZ Pvt Ltd","Home & Kitchen","N/A","FBA","N/A","N/A","N/A","N/A",,"No","N/A","RetailEZ Pvt Ltd"
3.,"LEVOIT Core Mini Air Purifier For Coverage Area 183 Sq Ft, H13 Truehepa Filter, Remove 99.97% Dust, Smoke, & Pollen, With Fragrance Sponge, (2 Years Warranty), White","B0CG1N11DV","https://www.amazon.in/dp/B0CG1N11DV?psc=1","https://m.media-amazon.com/images/I/61qe7hzT8SL._SY741_.jpg","LEVOIT","4,999","N/A",0,"2,000","N/A",165,400,"N/A","N/A",1,4.4,"91,202","N/A","N/A","Frootle India Pvt Ltd (FIPL)","Home & Kitchen","N/A","FBA","N/A","N/A","N/A","N/A",,"No","N/A","Frootle India Pvt Ltd (FIPL)"
4.,"Honeywell Air Purifier for Home, 4 Stage Filtration, Covers 388 sq.ft, High Efficiency Pre-Filter, H13 HEPA, Activated Carbon, Removes 99.99% Pollutants & Micro Allergens - Air touch V2","B09C64QJMS","https://www.amazon.in/dp/B09C64QJMS?psc=1","https://m.media-amazon.com/images/I/51IACRbkP-L._SX466_.jpg","Honeywell","8,389","N/A",0,500,"N/A",185,"1,305","N/A","N/A",7,3.7,"15,057","N/A","N/A","RetailEZ Pvt Ltd","Home & Kitchen","N/A","FBA","N/A","N/A","N/A","N/A",,"No","N/A","RetailEZ Pvt Ltd"
5.,"Philips AC0950 Smart Wifi Air Purifier For Home, Real Time AQI Display, Covers Upto 300 Sqft(30M2) With CADR 250 M3/H, HEPA Filter With Activa Carbon, Scheduler Feature Connected With Air + APP, White","B0DB85YDRS","https://www.amazon.in/dp/B0DB85YDRS?psc=1","https://m.media-amazon.com/images/I/51LO7GBxQTL._SX679_.jpg","Philips","10,599","N/A",0,100,"N/A",200,"2,429","N/A","N/A",2,4.2,"3,459","N/A","N/A","RetailEZ Pvt Ltd","Home & Kitchen","N/A","FBA","N/A","N/A","N/A","N/A",,"No","N/A","RetailEZ Pvt Ltd"
6.,"WEYLYN 3-in-1, Pre, H13 HEPA, Activated Carbon, Removes 99.99% Pollutants, Allergens, Pet Danger, Smoke, Dust & Pollens Air Purifier for Home & Office Air Purifier for Home & Office (VERTICAL)","B0G6MG1XMJ","https://www.amazon.in/dp/B0G6MG1XMJ?psc=1","https://m.media-amazon.com/images/I/619JLJa4QjL._SX466_.jpg","WEYLYN","1,699","N/A",0,50,"N/A",192,"4,250","N/A","N/A",1,5,19,"N/A","N/A","Weylyn.","Home & Kitchen","N/A","FBA","N/A","N/A","N/A","N/A",,"No","N/A","Weylyn."
7.,"Qubo Smart Air Purifier Q200 for Home by Hero Group | Upto 200 Sq Ft | 99.99% Allergen Removal | HEPA H13 | 9000 Hrs Filter Life | App & Voice Control | Energy Saving | Ultra-Quiet BLDC Motor","B0CMH94KPM","https://www.amazon.in/dp/B0CMH94KPM?psc=1","https://m.media-amazon.com/images/I/51+7Q1LCN6L._SX679_.jpg","Qubo","7,490","N/A",0,50,"N/A",191,"4,394","N/A","N/A",1,4.1,681,"N/A","N/A","RetailEZ Pvt Ltd","Home & Kitchen","N/A","FBA","N/A","N/A","N/A","N/A",,"No","N/A","RetailEZ Pvt Ltd"
8.,"Dyson Hushjet Purifier Compact-HJ10 | Removes 99.97% of pollutants as small as PM 0.3 | Upto 5 Yr Electrostatic filter life | Max coverage upto 1076 sq.ft. | 2 Yr Warranty (White/Silver)","B0FX51DWS4","https://www.amazon.in/dp/B0FX51DWS4?psc=1","https://m.media-amazon.com/images/I/71liDkj9GOL._SX425_.jpg","Dyson","29,900","N/A",0,100,"N/A",186,"4,423","N/A","N/A",2,4.6,52,"N/A","N/A","CloudNine India","Home & Kitchen","N/A","FBA","N/A","N/A","N/A","N/A",,"No","N/A","CloudNine India"
9.,"AIRTH AC Air Purifier [AQI <300, Summer Version] with Time Indicator | IIT Bombay Technology | Upgrades AC into Air Purifier | PM2.5, Germ & Allergy Protection | HEPA Filter for Home & Office","B0FVFWXXRQ","https://www.amazon.in/dp/B0FVFWXXRQ?psc=1","https://m.media-amazon.com/images/I/61YLqXb+p5L._SX569_.jpg","AiRTH","2,499","N/A",0,200,"N/A",191,"4,048","N/A","N/A",2,3.8,"1,019","N/A","N/A","AiRTH","Home & Kitchen","N/A","FBA","N/A","N/A","N/A","N/A",,"No","N/A","AiRTH"
10.,"Philips Smart Air Purifier Ac1711 - Purifies Rooms Up To 36 M² - Removes 99.97% Of Pollen, Allergies Dust And, Hepa Filter, Ideal For Bedrooms. -","B0CW1SZV6L","https://www.amazon.in/dp/B0CW1SZV6L?psc=1","https://m.media-amazon.com/images/I/71PUoytURBL._SY355_.jpg","Philips","12,699","N/A",0,800,"N/A",145,"9,687","N/A","N/A",2,4.1,"5,641","N/A","N/A","RetailEZ Pvt Ltd","Home & Kitchen","N/A","FBA","N/A","N/A","N/A","N/A",,"No","N/A","RetailEZ Pvt Ltd"
11.,"CUCKOO Respure Air Purifier For Home | Biggest True HEPA Filter Cleans 570 Sqft in 15min | 8 Yrs Warranty on Motor | | Suitable For Heavy Pollution Allergies & Pet Hair | RedDot Award Winner","B0DHW4H1CV","https://www.amazon.in/dp/B0DHW4H1CV?psc=1","https://m.media-amazon.com/images/I/61u0t+n41-L._SY450_.jpg","CUCKOO","14,490","N/A",0,200,"N/A",190,"11,094","N/A","N/A",2,4.4,"1,152","N/A","N/A","RetailEZ Pvt Ltd","Home & Kitchen","N/A","FBA","N/A","N/A","N/A","N/A",,"No","N/A","RetailEZ Pvt Ltd"
12.,"Small Air Purifiers for Bedroom Home with H13 HEPA Filters, Quiet HEPA Filter Cleaner with Aromatherapy for Better Sleep, Air Frenshener, Allergies, Dust, Pet Dander, Odour, Smoke, Office","B0GJMSC7D9","https://www.amazon.in/dp/B0GJMSC7D9?psc=1","https://m.media-amazon.com/images/I/51OLpKn6HFL._SY679_.jpg","SEAHELTON","1,799","N/A",0,200,"N/A",187,"11,264","N/A","N/A",2,4.2,16,"N/A","N/A","UNICRON","Home & Kitchen","N/A","FBA","N/A","N/A","N/A","N/A",,"No","N/A","UNICRON"
13.,"Dr Trust USA Zurich Portable Room Air Purifier, HEPA Filter UV 4 Stage Filtration & Air Quality Monitoring, Low Noise, 360° Air Inlet Removes 99.97% Pollutants Dust, Smoke, Bacterial Particles (Black)","B0DM9FYBX9","https://www.amazon.in/dp/B0DM9FYBX9?psc=1","https://m.media-amazon.com/images/I/71Z9jFurdAL._SX679_.jpg","Dr Trust","5,699","N/A",0,100,"N/A",200,"12,660","N/A","N/A",2,3.9,143,"N/A","N/A","RetailEZ Pvt Ltd","Home & Kitchen","N/A","FBA","N/A","N/A","N/A","N/A",,"No","N/A","RetailEZ Pvt Ltd"
14.,"Eureka Forbes 270 Air Purifier for Home |True HEPA H13 Filter & Real-time AQI Indicator |1.5-2 Yrs Filter Life* | Removes 99.97% PM2.5, Dust, Allergens, Bacteria & Pollen | Covers up to 365 Sq.Ft","B0FN45MT9C","https://www.amazon.in/dp/B0FN45MT9C?psc=1","https://m.media-amazon.com/images/I/51l3nUQtfNL._SY741_.jpg","Eureka Forbes","7,999","N/A",0,50,"N/A",195,"16,923","N/A","N/A",3,3.2,344,"N/A","N/A","RetailEZ Pvt Ltd","Home & Kitchen","N/A","FBA","N/A","N/A","N/A","N/A",,"No","N/A","RetailEZ Pvt Ltd"
15.,"WINIX 5500-2 Air Purifier for Home Large Room Up to 1881 Ft² in 1 Hr, True HEPA, High Deodorization Carbon Filter and Auto Mode, Captures Pet Allergies, Smoke, 2 YEAR WARRANTY","B01D8DAYII","https://www.amazon.in/dp/B01D8DAYII?psc=1","https://m.media-amazon.com/images/I/61LhVefvTiL._SY450_.jpg","Winix","15,998","N/A",0,50,"N/A",175,"18,697","N/A","N/A",1,4.2,"39,771","N/A","N/A","Justshop India","Home & Kitchen","N/A","FBA","N/A","N/A","N/A","N/A",,"No","N/A","Justshop India"
16.,"Nutripro Air Purifier For Home & Office 300 sq.ft, H13 HEPA, Activated Carbon, Removes 99.99% Pollutants & Micro Allergens - (Grey)","B0FL7ZD2P1","https://www.amazon.in/dp/B0FL7ZD2P1?psc=1","https://m.media-amazon.com/images/I/61KhBx4nvaL._SX466_.jpg","nutripro","2,999","N/A",0,100,"N/A",131,"22,262","N/A","N/A",1,3.4,168,"N/A","N/A","Appliance E-shop","Home & Kitchen","N/A","FBA","N/A","N/A","N/A","N/A",,"No","N/A","Appliance E-shop"
17.,"VEWIOR A1 World No.1 Air Purifier for Home up to 600 Sq.ft, H13 True HEPA Filter, 99.99% Allergen & Dust Removal, PM2.5 Air Quality Monitor, 6 Timer Settings, 8500 Hrs Filter Life, Smoke & Pollution","B09WHV1NJL","https://www.amazon.in/dp/B09WHV1NJL?psc=1","https://m.media-amazon.com/images/I/71tKyP04wsL._SX466_.jpg","VEWIOR","7,999","N/A",0,100,"N/A",198,"24,263","N/A","N/A",1,4.2,"9,076","N/A","N/A","PR Global Brands-Authorized Distributor","Home & Kitchen","N/A","FBA","N/A","N/A","N/A","N/A",,"No","N/A","PR Global Brands-Authorized Distributor"
18.,"Qubo Smart Air Purifier Q400 for Home by Hero Group | Up to 400 Sq Ft | 99.99% Allergen Removal | True HEPA13 | 9000 Hrs Filter Life | App & Voice Control","B0CMHDMPWX","https://www.amazon.in/dp/B0CMHDMPWX?psc=1","https://m.media-amazon.com/images/I/51JxJyQwiBL._SX569_.jpg","Qubo","N/A","N/A",0,"N/A","N/A",154,"25,700","N/A","N/A",1,3.9,467,"N/A","N/A",,"Home & Kitchen","N/A","N/A","N/A","N/A","N/A","N/A",,"No","N/A",
19.,"PHILIPS 3200 Series Smart Air Purifier with Remote Scheduling (App Control with Wi-Fi, Dark Slate), Black","B0DWSK7W6D","https://www.amazon.in/dp/B0DWSK7W6D?psc=1","https://m.media-amazon.com/images/I/51AKPM-DIyL._SX569_.jpg","PHILIPS","N/A","N/A",0,"N/A","N/A",105,"26,350","N/A","N/A",1,4.8,8,"N/A","N/A",,"Home & Kitchen","N/A","N/A","N/A","N/A","N/A","N/A",,"No","N/A",
20.,"Shark HP300 Air Purifier |1400 sq.ft Coverage | 5 Year NeverChange True HEPA 14 Filter | Captures 99.98% Dust, Smoke & Allergens | 4-Layer Filtration | Odor Neutralizer | PM1.0/PM2.5/PM10 Display","B0FWRTBVBN","https://www.amazon.in/dp/B0FWRTBVBN?psc=1","https://m.media-amazon.com/images/I/71QUDnhYJJL._SY450_.jpg","Shark","29,490","N/A",0,50,"N/A",195,"27,439","N/A","N/A",1,4.2,"1,099","N/A","N/A","SharkNinja India","Home & Kitchen","N/A","FBA","N/A","N/A","N/A","N/A",,"No","N/A","SharkNinja India"
21.,"FULMINARE Air Purifiers for Bedroom, FULMINARE H13 True HEPA Air Filter, Quiet Air Cleaner With Night Light, Portable Small Air Purifier for Home, Office, Pet","B0GFMFFDP7","https://www.amazon.in/dp/B0GFMFFDP7?psc=1","https://m.media-amazon.com/images/I/71UoENKnfkL._SX466_.jpg","FULMINARE","3,999","N/A",0,50,"N/A",158,"28,994","N/A","N/A",1,4.4,93,"N/A","N/A","FULMIN STORE","Home & Kitchen","N/A","FBA","N/A","N/A","N/A","N/A",,"No","N/A","FULMIN STORE"
22.,"Coway Original 3-in-1 Filter for Airmega Aim, True HEPA & Carbon Filter Combo, 8500 Hrs (approx. 1.5-2 yrs) Long Life, Kills Allergies, Virus, Germs, PM 0.01 with 99.999% efficiency","B0CQKG2XT2","https://www.amazon.in/dp/B0CQKG2XT2?psc=1","https://m.media-amazon.com/images/I/51nPjdDQ81L._SX569_.jpg","Coway","3,299","N/A",0,100,"N/A",181,"29,310","N/A","N/A",1,4.4,80,"N/A","N/A","Frootle India Pvt. Ltd.","Home & Kitchen","N/A","FBA","N/A","N/A","N/A","N/A",,"No","N/A","Frootle India Pvt. Ltd."
23.,"Sharp Air Purifier for Homes/Offices Dual Purification, Plasmacluster Technology, (True HEPA+Carbon+Pre-Filter) Captures 99.97% of Impurities (White) FP-F40E-W White 7 Years Warranty","B01B0DT29A","https://www.amazon.in/dp/B01B0DT29A?psc=1","https://m.media-amazon.com/images/I/41Cgy1XLcCL._SX466_.jpg","SHARP","10,990","N/A",0,50,"N/A",182,"29,872","N/A","N/A",2,4.2,"2,123","N/A","N/A","KIDA Retail Private Ltd","Home & Kitchen","N/A","FBA","N/A","N/A","N/A","N/A",,"No","N/A","KIDA Retail Private Ltd"
24.,"CPENSUS Air Purifier For Bedroom Coverage 107 Ft² True H13 With Activated Carbon Filter Aromatherapy Child-Lock Timer Portable For Living Room Home Office Deodorizing Tech., White","B0DY56YLP3","https://www.amazon.in/dp/B0DY56YLP3?psc=1","https://m.media-amazon.com/images/I/51yd3-ACxAL._SX466_.jpg","CPENSUS","2,999","N/A",0,50,"N/A",179,"31,568","N/A","N/A",1,3.9,177,"N/A","N/A","CPENSUS.","Home & Kitchen","N/A","FBA","N/A","N/A","N/A","N/A",,"No","N/A","CPENSUS."
25.,"Qubo Smart Air Purifier Q500 for Home by Hero Group | Up to 500 Sq Ft | 99.99% Allergen Removal | True HEPA13 | 9000 Hrs Filter Life | App & Voice Control","B0CMH9TSVC","https://www.amazon.in/dp/B0CMH9TSVC?psc=1","https://m.media-amazon.com/images/I/510OYh2AbDL._SX569_.jpg","Qubo","N/A","N/A",0,"N/A","N/A",154,"32,497","N/A","N/A",1,3.8,416,"N/A","N/A",,"Home & Kitchen","N/A","N/A","N/A","N/A","N/A","N/A",,"No","N/A",
26.,"Philips Nano Protect Hepa 1000 Series Replacement Air Purifier Filter FY1410/30 – For AC1215/20| AC1217/20| AC1211/20","B0CMD1DDDQ","https://www.amazon.in/dp/B0CMD1DDDQ?psc=1","https://m.media-amazon.com/images/I/51iv8nalDOL._SX466_.jpg","Philips","1,890","N/A",0,50,"N/A",117,"38,424","N/A","N/A",5,4.3,30,"N/A","N/A","Aalap Inc.","Home & Kitchen","N/A","FBA","N/A","N/A","N/A","N/A",,"No","N/A","Aalap Inc."
27.,"Sharp Air Purifier for Home & Office with Plasmacluster (Removes Bacteria, Virus, Mold, VOCs I JAPAN TECHNOLOGY I Traps 99.97% Pollutants I HEPA, Carbon & Pre Filter (FP-J30M-BK I 250 sq.ft. (Black)","B0D83PCXM3","https://www.amazon.in/dp/B0D83PCXM3?psc=1","https://m.media-amazon.com/images/I/51ScaUmkY0L._SX522_.jpg","SHARP","8,990","N/A",0,50,"N/A",198,"39,351","N/A","N/A",1,4.4,126,"N/A","N/A","Convex Gadgets","Home & Kitchen","N/A","FBA","N/A","N/A","N/A","N/A",,"No","N/A","Convex Gadgets"
28.,"Beurer LR 210 HEPA H13 Air Purifier I 3-Layer Filter with 99.95% Efficiency I Ion function I Room Size Upto 280 sq ft I 3 fan Settings I Night Mode I Timer Option I 3 Years Guarantee I White","B0829M6JXN","https://www.amazon.in/dp/B0829M6JXN?psc=1","https://m.media-amazon.com/images/I/51acmYL7V1L._SX466_.jpg","Beurer","3,990","N/A",0,10,"N/A",190,"40,359","N/A","N/A",6,3.6,182,"N/A","N/A","Medaxo","Home & Kitchen","N/A","FBA","N/A","N/A","N/A","N/A",,"No","N/A","Medaxo"
29.,"Air Purifiers for Home Bedroom, Air Cleaner with 3-In-1 HEPA Filter for Dust Smoke Pet Dander Odor with Sleep Mode, Aromatherapy, Timer, Portable (Black)","B0FMQBP1NQ","https://www.amazon.in/dp/B0FMQBP1NQ?psc=1","https://m.media-amazon.com/images/I/61u9w-DiVuL._SX569_.jpg","Rosekm","4,084","N/A",0,20,"N/A",153,"42,202","N/A","N/A",1,4.4,67,"N/A","N/A","XKT store","Home & Kitchen","N/A","FBA","N/A","N/A","N/A","N/A",,"No","N/A","XKT store"
30.,"NexLev Smart Air Purifier | Home Room & Office Use upto 220 sq ft |True HEPA 13 Filter | Eliminate 99.99% Virus Dust Smoke Odor Pollen Allergens & Pollutants | Long Filter Life |3 Year Warranty |AP220","B0DVC58QPZ","https://www.amazon.in/dp/B0DVC58QPZ?psc=1","https://m.media-amazon.com/images/I/71rPCJ1Vi5L._SY450_.jpg","nexlev","3,999","N/A",0,10,"N/A",200,"43,190","N/A","N/A",2,3.7,82,"N/A","N/A","Nexlev® by Cambium","Home & Kitchen","N/A","FBA","N/A","N/A","N/A","N/A",,"No","N/A","Nexlev® by Cambium"
31.,"Bepure B2 Air Purifier with True HEPA Filtration| Area Upto 500 sq ft | Removes 99.97% pollutants by 4 Stage Filtration| Remote control provided for convenience","B0G1MQW48B","https://www.amazon.in/dp/B0G1MQW48B?psc=1","https://m.media-amazon.com/images/I/51-0CKd33QL._SX679_.jpg","BePURE","5,999","N/A",0,10,"N/A",160,"45,221","N/A","N/A",1,3.5,363,"N/A","N/A","BePURE","Home & Kitchen","N/A","FBA","N/A","N/A","N/A","N/A",,"No","N/A","BePURE"
32.,"Eureka Forbes Air Purifier 150 for bedroom | Covers upto 200 Sq. Ft. | True HEPA H13 Filter & Surround 360° Air Technology | Removes 99.97% Dust & Particulate Matter | 3-Stage Purification","B0CMJ6X9BV","https://www.amazon.in/dp/B0CMJ6X9BV?psc=1","https://m.media-amazon.com/images/I/71b7aWHt2YL._SX522_.jpg","Eureka Forbes","6,399","N/A",0,30,"N/A",188,"47,695","N/A","N/A",1,3.7,653,"N/A","N/A","Eureka Forbes LTD","Home & Kitchen","N/A","FBA","N/A","N/A","N/A","N/A",,"No","N/A","Eureka Forbes LTD"
33.,"Nutripro Air Purifier For Home & Office 600 sq.ft, H13 HEPA, Activated Carbon, Removes 99.99% Pollutants & Micro Allergens - (Grey)","B0FL819BYB","https://www.amazon.in/dp/B0FL819BYB?psc=1","https://m.media-amazon.com/images/I/71k686ihV5L._SY550_.jpg","nutripro","4,999","N/A",0,10,"N/A",131,"48,633","N/A","N/A",1,3.6,111,"N/A","N/A","Appliance E-shop","Home & Kitchen","N/A","FBA","N/A","N/A","N/A","N/A",,"No","N/A","Appliance E-shop"
34.,"""Honeywell Air Touch V4 Compound Anti-Bacterial with HEPA H13 Filter | Removes 99.99% Allergens, Pollutants, PM2.5, Dust, Fibres and Pollens ""","B0BHWVBLRQ","https://www.amazon.in/dp/B0BHWVBLRQ?psc=1","https://m.media-amazon.com/images/I/41KKu5ZYW4L._SY450_.jpg","Honeywell","1,799","N/A",0,10,"N/A",142,"22,140","N/A","N/A",2,4.2,134,"N/A","N/A","RetailEZ Pvt Ltd","Home & Kitchen","N/A","FBA","N/A","N/A","N/A","N/A",,"No","N/A","RetailEZ Pvt Ltd"
35.,"FY0910/30 IN AIR AC-HEPA FILTER","B0F636PV93","https://www.amazon.in/dp/B0F636PV93?psc=1","https://m.media-amazon.com/images/I/81oAmNoKN+L._SY450_.jpg","Philips","2,849","N/A",0,50,"N/A",31,"51,471","N/A","N/A",7,4.6,19,"N/A","N/A","StarLogisticsPvtLtd","Home & Kitchen","N/A","FBA","N/A","N/A","N/A","N/A",,"No","N/A","StarLogisticsPvtLtd"
36.,"finehepa Convert Your Split Ac Into An Airpurifier || No Module Required || High Performace Filtration For Home And Office To Protect From Ultrafine Dust ||Reduces Pm 2.5, Allergen & Viruses (2)","B0F6YBG2QJ","https://www.amazon.in/dp/B0F6YBG2QJ?psc=1","https://m.media-amazon.com/images/I/51VkgpmSXVL._SX679_.jpg","finehepa","1,199","N/A",0,"N/A","N/A",194,"51,818","N/A","N/A",2,3.6,46,"N/A","N/A","aerofresh","Home & Kitchen","N/A","FBA","N/A","N/A","N/A","N/A",,"No","N/A","aerofresh"
37.,"OTEK 330A Smart Air Purifier for Home & Office | HEPA H13 & Activated Carbon Filter | UV-C Sterilization | Real-Time AQI Display | Removes 99.9% Dust, Smoke & Allergens | 280 sq.ft","B0DPH8F48B","https://www.amazon.in/dp/B0DPH8F48B?psc=1","https://m.media-amazon.com/images/I/71v514aZ07L._SX679_.jpg","OTEK","5,499","N/A",0,10,"N/A",180,"57,064","N/A","N/A",1,4,151,"N/A","N/A","OTEK WORLD","Home & Kitchen","N/A","FBA","N/A","N/A","N/A","N/A",,"No","N/A","OTEK WORLD"
38.,"Philips Nano Protect Hepa 3000 Series Replacement Air Purifier Filter FY3433/30 – For AC3256/20| AC3259/20","B0DPWHZ5QY","https://www.amazon.in/dp/B0DPWHZ5QY?psc=1","https://m.media-amazon.com/images/I/71LSnfgO7fL._SY355_.jpg","Philips","2,549","N/A",0,40,"N/A",106,"59,912","N/A","N/A",7,4.5,22,"N/A","N/A","E.V.A.N","Home & Kitchen","N/A","FBA","N/A","N/A","N/A","N/A",,"No","N/A","E.V.A.N"
39.,"Xiaomi Smart Air Purifier 4, Best Purified Air Delivery Rate 387 m3/hr, True HEPA, traps 99.99% Virus, High coverage: 516 Sq Ft, Fast Purification in 7 Mins, RoHS & Allergy Care Certified, Alexa&GA","B0C1P45C31","https://www.amazon.in/dp/B0C1P45C31?psc=1","https://m.media-amazon.com/images/I/81gFN8NK5VL._SX679_.jpg","MI","N/A","N/A",0,"N/A","N/A",197,"61,815","N/A","N/A",1,4.3,"4,576","N/A","N/A",,"Home & Kitchen","N/A","N/A","N/A","N/A","N/A","N/A",,"No","N/A",
40.,"Philips Nano Protect Hepa 2000 Series Replacement Air Purifier Filter FY2422/30 – For AC2887/20| AC2892/20| AC2882/20","B0DPWL2V33","https://www.amazon.in/dp/B0DPWL2V33?psc=1","https://m.media-amazon.com/images/I/51zHYHVwpZL._SY355_.jpg","Philips","2,960","N/A",0,20,"N/A",117,"73,287","N/A","N/A",2,4.8,19,"N/A","N/A","M/S SHAURYA TRADING CO.","Home & Kitchen","N/A","FBA","N/A","N/A","N/A","N/A",,"No","N/A","M/S SHAURYA TRADING CO."
41.,"Honeywell Air Touch V3 Compound Anti-Bacterial with HEPA H13 Filter | Removes 99.99% Allergens, Pollutants, PM2.5, Dust, Fibres and Pollens","B0DNTGVVYJ","https://www.amazon.in/dp/B0DNTGVVYJ?psc=1","https://m.media-amazon.com/images/I/41KKu5ZYW4L._SY450_.jpg","Honeywell",929,"N/A",0,10,"N/A",139,"77,993","N/A","N/A",1,3.8,10,"N/A","N/A","BUXSA","Home & Kitchen","N/A","FBA","N/A","N/A","N/A","N/A",,"No","N/A","BUXSA"
42.,"KARCHER AF20 Air Purifier for Home, Dual H13 HEPA & Activated Carbon Filters, Removes 99.99% Pathogens & Fine Dust, 430 sq. ft Coverage, Air Quality Display, Automatic & Night Modes, German Technology","B0BJ663D77","https://www.amazon.in/dp/B0BJ663D77?psc=1","https://m.media-amazon.com/images/I/51qSKzUm4QL._SY450_.jpg","Karcher","9,004","N/A",0,10,"N/A",200,"80,081","N/A","N/A",6,4.2,191,"N/A","N/A","RetailEZ Pvt Ltd","Home & Kitchen","N/A","FBA","N/A","N/A","N/A","N/A",,"No","N/A","RetailEZ Pvt Ltd"
43.,"Xiaomi 4 Lite Smart Air Purifier for Home, AQI Display, HEPA & Carbon Filter, trap 99.99% Virus Dust & Odor, Large coverage area up to 462 Sq ft, App Control, RoHS & Allergy Care Certified, Alexa & GA","B0C1P65Y4H","https://www.amazon.in/dp/B0C1P65Y4H?psc=1","https://m.media-amazon.com/images/I/81juk45eY2L._SY450_.jpg","MI","N/A","N/A",0,"N/A","N/A",200,"83,533","N/A","N/A",1,4.2,946,"N/A","N/A",,"Home & Kitchen","N/A","N/A","N/A","N/A","N/A","N/A",,"No","N/A",
44.,"Airpurifier Replacement Filter Compatible with Dyson TP 04/05/06/07/09 HP 04/05/06/07/09, PH 01/02, DP 04","B0FMYNYBTG","https://www.amazon.in/dp/B0FMYNYBTG?psc=1","https://m.media-amazon.com/images/I/61Myj8aURdL._SX569_.jpg","finehepa","2,499","N/A",0,"N/A","N/A",105,"40,873","N/A","N/A",2,5,2,"N/A","N/A","aerofresh","Home & Kitchen","N/A","FBA","N/A","N/A","N/A","N/A",,"No","N/A","aerofresh"
45.,"Eureka Forbes Integrated Filter for Air Purifier 355 & Air Purifier 355 Smart | True HEPA H13 filter | Activated Carbon| Removes 99.97% PM2.5, Dust, Allergens & Pollen","B0FY6T6B5W","https://www.amazon.in/dp/B0FY6T6B5W?psc=1","https://m.media-amazon.com/images/I/51rK87RnN3L._SX569_.jpg","Eureka Forbes","2,550","N/A",0,20,"N/A",167,"85,707","N/A","N/A",1,4.3,22,"N/A","N/A","Eureka Forbes LTD","Home & Kitchen","N/A","FBA","N/A","N/A","N/A","N/A",,"No","N/A","Eureka Forbes LTD"
46.,"AGARO Royal Air Purifier For Home, Bedroom, True HEPA Filter H13, Removes 99.99% Pollutants, Bacteria, Virus & PM 0.1 Particles, 4 Stage Purification, CADR 300 m³/hr","B0DBHB12SK","https://www.amazon.in/dp/B0DBHB12SK?psc=1","https://m.media-amazon.com/images/I/71wh40jI9EL._SY355_.jpg","AGARO","N/A","N/A",0,"N/A","N/A",165,"87,235","N/A","N/A",1,3.2,563,"N/A","N/A",,"Home & Kitchen","N/A","N/A","N/A","N/A","N/A","N/A",,"No","N/A",
47.,"Mi Air Purifier HEPA Filter- Compatible with Mi Air purifier 3, Mi Air purifier 2","B0811V9S2Z","https://www.amazon.in/dp/B0811V9S2Z?psc=1","https://m.media-amazon.com/images/I/71uP8E--+PL._SX450_.jpg","MI","N/A","N/A",0,"N/A","N/A",81,"92,974","N/A","N/A",1,4.2,"1,339","N/A","N/A",,"Home & Kitchen","N/A","N/A","N/A","N/A","N/A","N/A",,"No","N/A",
48.,"Air Purifier with Humidifier I Covers upto 1000 sq.ft I True HEPA Filter I 7 Stage Filtration with Nano-PECO Technology I Removes 99.97% of Dust, Allergen & Viruses","B0CDBP2VGX","https://www.amazon.in/dp/B0CDBP2VGX?psc=1","https://m.media-amazon.com/images/I/71dTv6dmiTL._SY355_.jpg","AIRVUE","18,499","N/A",0,"N/A","N/A",164,"103,413","N/A","N/A",1,4.2,15,"N/A","N/A","RetailEZ Pvt Ltd","Home & Kitchen","N/A","FBA","N/A","N/A","N/A","N/A",,"No","N/A","RetailEZ Pvt Ltd"
49.,"Dust Proof Water Proof Washable Air Purifier Cover for ‎‎FJY4033IN Size (L X W X H - 24 X 24 X 52 CM) (MDAPC‎-105-BLACK)","B0BDW1P57Z","https://www.amazon.in/dp/B0BDW1P57Z?psc=1","https://m.media-amazon.com/images/I/717DvuAYS-L._SY450_.jpg","MAINDAIS",349,"N/A",0,"N/A","N/A",120,"105,482","N/A","N/A",1,4.6,10,"N/A","N/A","MAINDAIS","Home & Kitchen","N/A","FBA","N/A","N/A","N/A","N/A",,"No","N/A","MAINDAIS"
50.,"AIRTH Air Purifier for AC Summer Edition [AQI <300] - Old | IIT Bombay Technology | Upgrades AC into Air Purifier | PM2.5, Germ & Allergy Protection | HEPA Filter for Home & Office","B0BGLXHD8V","https://www.amazon.in/dp/B0BGLXHD8V?psc=1","https://m.media-amazon.com/images/I/51p1Z7CUxQL._SX679_.jpg","AiRTH","N/A","N/A",0,"N/A","N/A",180,"105,497","N/A","N/A",1,3.5,321,"N/A","N/A",,"Home & Kitchen","N/A","N/A","N/A","N/A","N/A","N/A",,"No","N/A",
51.,"O2Cure Elixir Air Purifier for Home With HEPA Filter & Humidifier | 6 Stages of Air Purification Eliminates 99.99% of Pollutants |1 Year Warranty | 1 Unit | Metallic Grey","B08LZGQFVN","https://www.amazon.in/dp/B08LZGQFVN?psc=1","https://m.media-amazon.com/images/I/61ud7P9pYRL._SY741_.jpg","O2Cure","8,208","N/A",0,10,"N/A",170,"105,833","N/A","N/A",3,3.7,31,"N/A","N/A","O2Cure","Home & Kitchen","N/A","FBA","N/A","N/A","N/A","N/A",,"No","N/A","O2Cure"
52.,"Genuine Winix 116130 Replacement Filter H for 5500-2 Air Purifier, 16.25""L x 12.5""W x 1.5""Th, White","B01JLT1OR8","https://www.amazon.in/dp/B01JLT1OR8?psc=1","https://m.media-amazon.com/images/I/81tD0oLp-TS._SX466_.jpg","Winix","3,999","N/A",0,"N/A","N/A",99,"107,405","N/A","N/A",1,4.7,"5,524","N/A","N/A","Justshop India","Home & Kitchen","N/A","FBA","N/A","N/A","N/A","N/A",,"No","N/A","Justshop India"
53.,"Smart Air Sqair Air Purifier with 360° air circulation for Home (Long Filter Life with Extra Thick HEPA & Carbon Filter) | Coverage area 430 sq. ft | Removes 99.5% PM 0.1, VOC, dust, viruses | White","B07Y9WJ54C","https://www.amazon.in/dp/B07Y9WJ54C?psc=1","https://m.media-amazon.com/images/I/61XtKsH1+DL._SY355_.jpg","Smart Air","10,999","N/A",0,"N/A","N/A",198,"107,671","N/A","N/A",1,4.1,38,"N/A","N/A","Smart Air Filters","Home & Kitchen","N/A","FBA","N/A","N/A","N/A","N/A",,"No","N/A","Smart Air Filters"
54.,"DREO Air Purifier for Home, CADR 173m³/h, 3-in-1 True HEPA Filter, Covers up to 70.42m² (750ft²), LED Air Quality (AQI) Display, RGB Ambient Light, Memory Function, Ultra-Quiet 25dB, 2 Year Warranty","B0G1SK3H1F","https://www.amazon.in/dp/B0G1SK3H1F?psc=1","https://m.media-amazon.com/images/I/81Kfk27WMGL._SX466_.jpg","Dreo","10,499","N/A",0,50,"N/A",198,"108,561","N/A","N/A",1,4.3,385,"N/A","N/A","Opptra","Home & Kitchen","N/A","FBA","N/A","N/A","N/A","N/A",,"No","N/A","Opptra"
