"Display Order","Product Details","ASIN","URL","Image URL","Brand","Price  ₹","Sales","Variation Sales Strength (1 - 10)","Recent Purchases","Revenue","Title Char. Count","BSR","Seller Country/Region","Fees  ₹","Active Sellers","Ratings","Review Count","Images","Review velocity","Buy Box","Category","Size Tier","Fulfillment","Dimensions","Weight","ABA Most Clicked","Creation Date","Sponsored","Best Seller","Seller Age (mo)","Seller"
1.,"AGARO Signify Handheld Garment Steamer, Wrinkle Remover, Iron, Fast Heat, Ceramic Steam Nozzle, 1500W, 260 ML Water Tank, Detachable Fabric Brush","B0B97VX3TB","https://www.amazon.in/dp/B0B97VX3TB?psc=1","https://m.media-amazon.com/images/I/71RMc2gIneL._SY355_.jpg","AGARO","2,253","N/A",0,500,"N/A",145,"1,228","N/A","N/A",3,3.7,"2,207","N/A","N/A","RetailEZ Pvt Ltd","Home & Kitchen","N/A","FBA","N/A","N/A","N/A","N/A",,"No","N/A","RetailEZ Pvt Ltd"
2.,"Portable Micro Steam iron, green iron Handheld Garment Steamer, Dry And Wet Wrinkles Removing Lightweight Steamer for Home Office, Fast Heat Mini Ironing Machine","B0GCDF18CP","https://www.amazon.in/dp/B0GCDF18CP?psc=1","https://m.media-amazon.com/images/I/51l0FG6rSLL._SY355_.jpg","SHRI BAJRANG",399,"N/A",0,100,"N/A",161,"9,299","N/A","N/A",1,3,2,"N/A","N/A","SHRI BAJRANG AGENCY","Home & Kitchen","N/A","FBA","N/A","N/A","N/A","N/A",,"No","N/A","SHRI BAJRANG AGENCY"
3.,"AGARO Regal Mini Garment Steamer, 1200 Watts, Wrinkle Remover, Fast Heating, Scratch Resistant Titanium Coated Plate, 2In1 Horizontal Vertical Use","B0DP51299C","https://www.amazon.in/dp/B0DP51299C?psc=1","https://m.media-amazon.com/images/I/51PR3uXMn5L._SY450_.jpg","AGARO","1,899","N/A",0,300,"N/A",146,"10,851","N/A","N/A",3,3.9,174,"N/A","N/A","RetailEZ Pvt Ltd","Home & Kitchen","N/A","FBA","N/A","N/A","N/A","N/A",,"No","N/A","RetailEZ Pvt Ltd"
4.,"Black+Decker Steam Iron | 2 Years Warranty | Garment Steamer for Clothes, 1500-Watt, 260ml Water Tank, Steamer for Ironing Clothes, Steam Press for Clothes, Handheld Portable Garment Steamer (Violet)","B07WVQG8WZ","https://www.amazon.in/dp/B07WVQG8WZ?psc=1","https://m.media-amazon.com/images/I/61VaVR7zvcL._SY879_.jpg","BLACK+DECKER","2,440","N/A",0,200,"N/A",199,"13,257","N/A","N/A",3,3.8,"2,254","N/A","N/A","@ BuyBox","Home & Kitchen","N/A","FBA","N/A","N/A","N/A","N/A",,"No","N/A","@ BuyBox"
5.,"AGARO Regency Handheld Garment Steamer, Wrinkle Remover, Iron, Fast Heat, 1200W, 250 ml Water Tank, Detachable Fabric Brush","B0DJMDJBMG","https://www.amazon.in/dp/B0DJMDJBMG?psc=1","https://m.media-amazon.com/images/I/61nPKJ5sfDL._SY450_.jpg","AGARO","1,899","N/A",0,400,"N/A",123,"14,277","N/A","N/A",2,4,139,"N/A","N/A","RetailEZ Pvt Ltd","Home & Kitchen","N/A","FBA","N/A","N/A","N/A","N/A",,"No","N/A","RetailEZ Pvt Ltd"
6.,"XECH Steamgun Garment Steamer for Clothes | Steam Iron for Travel & Home | Standing Hand Steamer with Vertical & Horizontal Ironing | 1200W Fabric Steaming Machine | Stainless Steel Plate, 170ml Tank","B0D6YSC98P","https://www.amazon.in/dp/B0D6YSC98P?psc=1","https://m.media-amazon.com/images/I/51l5ZT+TEGL._SY450_.jpg","Xech","1,549","N/A",0,50,"N/A",199,"16,467","N/A","N/A",1,4.1,233,"N/A","N/A","XECH TECHNOLOGIES PVT LTD","Home & Kitchen","N/A","FBA","N/A","N/A","N/A","N/A",,"No","N/A","XECH TECHNOLOGIES PVT LTD"
7.,"Bear® Professional Garment Steamer, Steam Iron for Clothes 1300 Watts Fast Heat-up Portable Steam Iron Cloth Wrinkles Remover Built-in Aromatherapy Box with Brush","B0C6ZFNVRZ","https://www.amazon.in/dp/B0C6ZFNVRZ?psc=1","https://m.media-amazon.com/images/I/51Kjrb0jqKL._SX466_.jpg","Bear","2,499","N/A",0,50,"N/A",162,"22,642","N/A","N/A",1,3.9,"6,674","N/A","N/A","Bear indian Store","Home & Kitchen","N/A","FBA","N/A","N/A","N/A","N/A",,"No","N/A","Bear indian Store"
8.,"2 in 1 Handheld Steamer Iron for Clothes for Home and Facial Steamer Portable (multi color)","B07VT17CB1","https://www.amazon.in/dp/B07VT17CB1?psc=1","https://m.media-amazon.com/images/I/41h+3sBu78L._SX466_.jpg","Hetarmi",599,"N/A",0,50,"N/A",91,"23,089","N/A","N/A",1,3.1,11,"N/A","N/A","Hetarmi Enterprise","Home & Kitchen","N/A","FBA","N/A","N/A","N/A","N/A",,"No","N/A","Hetarmi Enterprise"
9.,"NexLev Handheld Garment Steamer | 1500 Watts | 300 ML| Standing & Horizontal Iron Press | Damage Free Steaming for all Cloth Types | 25s Quick Heat |Upto 5 Clothes in One Fill | Travel Friendly |GS-02","B0CDPMX152","https://www.amazon.in/dp/B0CDPMX152?psc=1","https://m.media-amazon.com/images/I/71+RZvglJ7L._SY450_.jpg","nexlev","2,199","N/A",0,100,"N/A",200,"17,347","N/A","N/A",2,4,453,"N/A","N/A","Cambium Retail Pvt. Ltd.","Home & Kitchen","N/A","FBA","N/A","N/A","N/A","N/A",,"No","N/A","Cambium Retail Pvt. Ltd."
10.,"Xiaomi Handheld Garment Steamer, Foldable travel steam iron for clothes, Vertical and Horizontal, Powerful 1300 Watt fast heat up, Kills 99.9%* bacteria, White","B0D1CM3SMP","https://www.amazon.in/dp/B0D1CM3SMP?psc=1","https://m.media-amazon.com/images/I/51s7jGvWfoL._SX425_.jpg","XIAOMI","N/A","N/A",0,"N/A","N/A",159,"33,853","N/A","N/A",1,4.1,"1,230","N/A","N/A",,"Home & Kitchen","N/A","N/A","N/A","N/A","N/A","N/A",,"No","N/A",
11.,"Portable Travel Garment Steamer, Steam Iron, Wrinkle Remover Machine For Cloths, 700 Watts, 700 Watts","B0F32G2BQW","https://www.amazon.in/dp/B0F32G2BQW?psc=1","https://m.media-amazon.com/images/I/41kMJ00uQWL._SX466_.jpg","AxrParv",797,"N/A",0,20,"N/A",101,"43,167","N/A","N/A",1,3.8,25,"N/A","N/A","homeki store","Home & Kitchen","N/A","FBA","N/A","N/A","N/A","N/A",,"No","N/A","homeki store"
12.,"2.6 L Sauna Steamer, Portable Sauna Generator for Sauna, Home SPA Fumigation Steam Machine with Touch Button, Timer Display and Remote Control","B0B6V975K8","https://www.amazon.in/dp/B0B6V975K8?psc=1","https://m.media-amazon.com/images/I/61b4q1vHZ4L._SX466_.jpg","HIGOSPRO","2,599","N/A",0,20,"N/A",142,"53,382","N/A","N/A",1,4.4,11,"N/A","N/A","veer teja enterprise ⭐⭐⭐⭐⭐","Home & Kitchen","N/A","FBA","N/A","N/A","N/A","N/A",,"No","N/A","veer teja enterprise ⭐⭐⭐⭐⭐"
13.,"Portable Handheld Steam Iron Machine, Ironing Mini Handheld Press Support Dry And Wet Cloths, Micro Steam Iron For Fabric Clothes, Garments For Home & Travel, Wrinkles Removing Steamer","B0DL5H1GJC","https://www.amazon.in/dp/B0DL5H1GJC?psc=1","https://m.media-amazon.com/images/I/61H1ean5WFL._SX569_.jpg","SHREE HANS CREATION",499,"N/A",0,"N/A","N/A",184,"77,098","N/A","N/A",3,2.1,11,"N/A","N/A","DS*ENTERPRISE","Home & Kitchen","N/A","FBA","N/A","N/A","N/A","N/A",,"No","N/A","DS*ENTERPRISE"
14.,"ROSSMANN Steam Iron, Powerful 1800 Watts Garment Steamer, Auto-Shutoff, Horizontal & Vertical Use, Heated Ceramic Sole Plate, 300 ML Removeable Water Tank, 2 Level Digital Touch Control (BG545)","B0DYPD9R6D","https://www.amazon.in/dp/B0DYPD9R6D?psc=1","https://m.media-amazon.com/images/I/51tCKK99W4L._SY606_.jpg","ROSSMANN","2,699","N/A",0,"N/A","N/A",193,"79,408","N/A","N/A",1,4,644,"N/A","N/A","Rossmann® India","Home & Kitchen","N/A","FBA","N/A","N/A","N/A","N/A",,"No","N/A","Rossmann® India"
15.,"AHP Steam Generator for Steam Therapy & Sauna – 2.6L Home Spa Portable Steam Pot with Timer & Digital Display, Body Detox Fumigation Machine for Steam Bath Box, Wooden Barrel & Bathtub","B0GGTNPX3L","https://www.amazon.in/dp/B0GGTNPX3L?psc=1","https://m.media-amazon.com/images/I/61TKtDGsCqL._SX679_.jpg","AHP-Acupressure Health Point","N/A","N/A",0,"N/A","N/A",184,"88,608","N/A","N/A",1,2.5,2,"N/A","N/A",,"Home & Kitchen","N/A","N/A","N/A","N/A","N/A","N/A",,"No","N/A",
16.,"2-in-1 Portable Handheld Garment and Facial Steamer, Electric Fabric Steamer for Clothes and Skincare, Cold & cough steamer, Lightweight, Travel-Friendly, Safety Auto Shut-Off, ABS Material","B0GFNX4X3X","https://www.amazon.in/dp/B0GFNX4X3X?psc=1","https://m.media-amazon.com/images/I/51wAYIbqrPL._SX425_.jpg","BEATIX",649,"N/A",0,"N/A","N/A",189,"95,388","N/A","N/A",1,"N/A",0,"N/A","N/A","Gs electronic hub","Home & Kitchen","N/A","FBA","N/A","N/A","N/A","N/A",,"No","N/A","Gs electronic hub"
17.,"NIVKART STEAM GENERATOR FOR STEAM THERAPY/SAUNA STEAMER POT/Home Spa Sauna Steam Generator with Timer Display Portable Body Detox Fumigation Machine for Steam Bath Box/Wooden Barrel/Bath TuB","B0CSJWLDWT","https://www.amazon.in/dp/B0CSJWLDWT?psc=1","https://m.media-amazon.com/images/I/31jFCZzyEQL._SX466_.jpg","NIVKART","3,291","N/A",0,"N/A","N/A",190,"112,389","N/A","N/A",1,3.8,19,"N/A","N/A","NIVKART®","Home & Kitchen","N/A","FBA","N/A","N/A","N/A","N/A",,"No","N/A","NIVKART®"
18.,"Hand-held Clothing Steamer Wireless Portable Iron Household Small Steam Generator Rechargeable Ironing Machine Travel Carry","B0DJGNQPXW","https://www.amazon.in/dp/B0DJGNQPXW?psc=1","https://m.media-amazon.com/images/I/31p07BcC2YL._SX466_.jpg","Generic","1,199","N/A",0,"N/A","N/A",123,"117,066","N/A","N/A",1,"N/A",0,"N/A","N/A","Chintan entarprice","Home & Kitchen","N/A","FBA","N/A","N/A","N/A","N/A",,"No","N/A","Chintan entarprice"
19.,"Multipurpose Steamer Cleaning Machine Home Cleaner With Steam and Dry Car Carpet Floor High Pressure Portable Steam Cleaners Temperature Pressurized Steam Cleaning Tool","B0F28TYBVV","https://www.amazon.in/dp/B0F28TYBVV?psc=1","https://m.media-amazon.com/images/I/61g-p6VeFxL._SX355_.jpg","BLURISM","1,999","N/A",0,"N/A","N/A",168,"123,112","N/A","N/A",1,5,1,"N/A","N/A","BLURISM","Home & Kitchen","N/A","FBA","N/A","N/A","N/A","N/A",,"No","N/A","BLURISM"
20.,"Portable Handheld Steam Iron for Clothes | Mini Travel Garment Steamer with Titanium Soleplate | Dry & Steam Ironing | Lightweight Fabric Wrinkle Remover for Home, Office & Travel","B0GD7SLHGK","https://www.amazon.in/dp/B0GD7SLHGK?psc=1","https://m.media-amazon.com/images/I/51bNPkFNuEL._SY450_.jpg","Generic",449,"N/A",0,"N/A","N/A",179,"125,204","N/A","N/A",1,"N/A",0,"N/A","N/A","SHARMA ENTERPRISES..../","Home & Kitchen","N/A","FBA","N/A","N/A","N/A","N/A",,"No","N/A","SHARMA ENTERPRISES..../"
21.,"Garment Steamer for clothes, Steam Iron, Horizontal & Vertical Steamer, 2 steam modes, 1600-1400 Watt, Steam iron press for Home & Travel (1 Year Warranty)","B0DGLZ4NBG","https://www.amazon.in/dp/B0DGLZ4NBG?psc=1","https://m.media-amazon.com/images/I/61ruMFZB-eL._SY355_.jpg","WisTec","2,448","N/A",0,"N/A","N/A",155,"136,168","N/A","N/A",2,3.9,940,"N/A","N/A","BABJI RETAILS","Home & Kitchen","N/A","FBA","N/A","N/A","N/A","N/A",,"No","N/A","BABJI RETAILS"
22.,"Borosil 1000W Handheld Garment Steamer GS03 | Ceramic Coated Soleplate | Dual Steam Modes (Horizontal & Vertical Ironing) | 120ml Detachable Water Tank | Overheat Protection | 2 Year Warranty","B0FTZ99T9V","https://www.amazon.in/dp/B0FTZ99T9V?psc=1","https://m.media-amazon.com/images/I/51aQiW6EJ4L._SY450_.jpg","Borosil","2,449","N/A",0,20,"N/A",191,"85,884","N/A","N/A",2,3.9,75,"N/A","N/A","UDDHAV GOLD","Home & Kitchen","N/A","FBA","N/A","N/A","N/A","N/A",,"No","N/A","UDDHAV GOLD"
23.,"BRD & SONS Mini Steamer & Iron: 2-in-1 Portable Travel Friendly","B0GJZC63M5","https://www.amazon.in/dp/B0GJZC63M5?psc=1","https://m.media-amazon.com/images/I/6155GSrnKIL._SY355_.jpg","BRD & SONS","N/A","N/A",0,"N/A","N/A",63,"141,383","N/A","N/A",1,"N/A",0,"N/A","N/A",,"Home & Kitchen","N/A","N/A","N/A","N/A","N/A","N/A",,"No","N/A",
24.,"LRK Therapy STEAM GENERATOR FOR STEAM THERAPY/SAUNA STEAMER POT/Home Spa Sauna Steam Generator with Timer Display Portable Body Detox Fumigation Machine for Steam Bath Box/Wooden Barrel/Bath TuB","B0FF4B6QRN","https://www.amazon.in/dp/B0FF4B6QRN?psc=1","https://m.media-amazon.com/images/I/31ejTEubHTL._SX466_.jpg","LRK","2,464","N/A",0,"N/A","N/A",194,"141,686","N/A","N/A",1,"N/A",0,"N/A","N/A","ACP ACUPRESSURE®","Home & Kitchen","N/A","FBA","N/A","N/A","N/A","N/A",,"No","N/A","ACP ACUPRESSURE®"
25.,"Mini Steamer & Iron: 2-in-1 Portable Travel Friendly","B0GK9TNXRB","https://www.amazon.in/dp/B0GK9TNXRB?psc=1","https://m.media-amazon.com/images/I/6155GSrnKIL._SY355_.jpg","Gizme","N/A","N/A",0,"N/A","N/A",52,"151,837","N/A","N/A",1,"N/A",0,"N/A","N/A",,"Home & Kitchen","N/A","N/A","N/A","N/A","N/A","N/A",,"No","N/A",
26.,"Steamer for Facial Garment and Clothes Handheld Facial Steamer and Garment Steamer Iron Fast Heat-up Portable Family Fabric Steam Brush Handy Vapour Steamer for Home and Travel","B0GDMJR9VD","https://www.amazon.in/dp/B0GDMJR9VD?psc=1","https://m.media-amazon.com/images/I/31USbizZtlL.jpg","Jebxel",599,"N/A",0,"N/A","N/A",176,"153,312","N/A","N/A",1,"N/A",0,"N/A","N/A","KESHAV  GEMS","Home & Kitchen","N/A","FBA","N/A","N/A","N/A","N/A",,"No","N/A","KESHAV  GEMS"
27.,"Morphy Richards Steam Elite | 1200-Watt Handheld Garment Steamer | White","B0CJXTG7RD","https://www.amazon.in/dp/B0CJXTG7RD?psc=1","https://m.media-amazon.com/images/I/51w1KEI12FL._SY355_.jpg","Morphy Richards","N/A","N/A",0,"N/A","N/A",72,"154,002","N/A","N/A",1,3.8,18,"N/A","N/A",,"Home & Kitchen","N/A","N/A","N/A","N/A","N/A","N/A",,"No","N/A",
28.,"4square Dreamworld electric Garment Facial Steamer Brush for Ironing Clothes Portable Multifunction Pots Steam Face (Color As per Availability)","B07B4D2T8D","https://www.amazon.in/dp/B07B4D2T8D?psc=1","https://m.media-amazon.com/images/I/41zA48I9eHL._SX425_.jpg","4square",699,"N/A",0,"N/A","N/A",143,"156,840","N/A","N/A",1,3.9,9,"N/A","N/A","SVK Dream®","Home & Kitchen","N/A","FBA","N/A","N/A","N/A","N/A",,"No","N/A","SVK Dream®"
29.,"Russell Hobbs 1500W Handheld Garment Steamer | 25g/min Steam Output | 350ml Tank, Heats Up in 40s, Kills 99.9% Bacteria | Overheat Protection, Brush Attachment, Compact & Travel RGS1500HANDYE","B0FK2KKH8R","https://www.amazon.in/dp/B0FK2KKH8R?psc=1","https://m.media-amazon.com/images/I/61fh6OazTxL._SY450_.jpg","Russell Hobbs","2,999","N/A",0,"N/A","N/A",191,"167,985","N/A","N/A",1,2.5,4,"N/A","N/A","ram Enterprises","Home & Kitchen","N/A","FBA","N/A","N/A","N/A","N/A",,"No","N/A","ram Enterprises"
30.,"ELIVON Portable Steam Generator for Sauna Therapy Home Spa Steamer with Timer Display for Detox Fumigation Treatment","B0GLYYQ6HR","https://www.amazon.in/dp/B0GLYYQ6HR?psc=1","https://m.media-amazon.com/images/I/31FqHpcco-L._SX450_.jpg","Generic","2,599","N/A",0,"N/A","N/A",116,"174,681","N/A","N/A",1,"N/A",0,"N/A","N/A","RATHORE IMPEX","Home & Kitchen","N/A","FBA","N/A","N/A","N/A","N/A",,"No","N/A","RATHORE IMPEX"
31.,"STEAM GENERATOR FOR STEAM THERAPY/SAUNA STEAMER POT/Home Spa Sauna Steam Generator with Timer Display Portable Body Detox Fumigation Machine for Steam Bath Box/Wooden Barrel/Bath TuB(2.6ltr)","B0G3LFY4FX","https://www.amazon.in/dp/B0G3LFY4FX?psc=1","https://m.media-amazon.com/images/I/51bhcT1OZzL._SX466_.jpg","PHYSIO WORLD","3,399","N/A",0,"N/A","N/A",190,"175,518","N/A","N/A",1,"N/A",0,"N/A","N/A","PHYSIO WORLD ⭐⭐⭐⭐⭐","Home & Kitchen","N/A","FBA","N/A","N/A","N/A","N/A",,"No","N/A","PHYSIO WORLD ⭐⭐⭐⭐⭐"
32.,"Micro Portable Steam Iron | Mini Ironing Machine for Clothes | Supports Dry and Wet Ironing | Garment Steamer for Home & Travel - Perfect for Gifting.Green.","B0FCDHRRGV","https://www.amazon.in/dp/B0FCDHRRGV?psc=1","https://m.media-amazon.com/images/I/41tX52EZgZL._SX569_.jpg","SHRISELL","N/A","N/A",0,"N/A","N/A",156,"179,270","N/A","N/A",1,2.6,93,"N/A","N/A",,"Home & Kitchen","N/A","N/A","N/A","N/A","N/A","N/A",,"No","N/A",
33.,"Kawachi Steam Generator for Portable Steam Sauna Bath Steam Machine","B07TGJHZ43","https://www.amazon.in/dp/B07TGJHZ43?psc=1","https://m.media-amazon.com/images/I/61fdM2tlz+L._SY450_.jpg","Kawachi","2,832.2","N/A",0,"N/A","N/A",67,"184,560","N/A","N/A",1,3.7,63,"N/A","N/A","Kawachi Group","Home & Kitchen","N/A","FBA","N/A","N/A","N/A","N/A",,"No","N/A","Kawachi Group"
34.,"Garment Steamer for Clothes, Steam Iron Press, 250 ml Water tank, 25g/min Strong Penetrating Steam, 1600W, 25-Sec Fast Heat-up, for Home, Office (aqua blue)","B0BFQHTXYZ","https://www.amazon.in/dp/B0BFQHTXYZ?psc=1","https://m.media-amazon.com/images/I/71YO6vaeoUL._SX569_.jpg","Reemix","1,799","N/A",0,10,"N/A",156,"187,820","N/A","N/A",1,4.3,"1,880","N/A","N/A","ECOMZIO","Home & Kitchen","N/A","FBA","N/A","N/A","N/A","N/A",,"No","N/A","ECOMZIO"
35.,"Portable Steam Iron Mini Handheld Garment Steamer | Quick Heat Travel Iron for Clothes | Compact & Lightweight | Suitable for Home & Travel | Pack of 1 | RiyanShi Enterprise","B0GKT37RPF","https://www.amazon.in/dp/B0GKT37RPF?psc=1","https://m.media-amazon.com/images/I/51Eq254x74L._SY450_.jpg","Riyanshi enterprise",464.07,"N/A",0,"N/A","N/A",173,"189,259","N/A","N/A",1,"N/A",0,"N/A","N/A","AUM FOOD EXPORTS","Home & Kitchen","N/A","FBA","N/A","N/A","N/A","N/A",,"No","N/A","AUM FOOD EXPORTS"
36.,"Garment Fabric Steamer and Facial Steamer for Clothes | Portable Handheld Steamer Iron with Fast Heat-Up Technology | Perfect for Home, Travel & Multipurpose Use (Multi-Color)","B0CD1RGNDH","https://www.amazon.in/dp/B0CD1RGNDH?psc=1","https://m.media-amazon.com/images/I/51grOD0+w8L._SY450_.jpg","JIAVAXA","N/A","N/A",0,"N/A","N/A",175,"191,295","N/A","N/A",1,3.2,226,"N/A","N/A",,"Home & Kitchen","N/A","N/A","N/A","N/A","N/A","N/A",,"No","N/A",
37.,"AGARO Elegant Handheld Garment Steamer, Horizontal & Vertical Use, Foldable, Fast Heat, 1200W, 170 ML Water Tank, Blue.","B0C6TXD3S9","https://www.amazon.in/dp/B0C6TXD3S9?psc=1","https://m.media-amazon.com/images/I/61i+-IW7L3L._SX466_.jpg","AGARO","N/A","N/A",0,"N/A","N/A",119,"193,646","N/A","N/A",1,3.8,191,"N/A","N/A",,"Home & Kitchen","N/A","N/A","N/A","N/A","N/A","N/A",,"No","N/A",
38.,"Best Handheld Garment Steamer for Travel, Home, and Professional Use—Powerful, Portable Clothes Steamer with Attachments for Wrinkles, Fabric Refreshing, and Compact Design","B0DF25H134","https://www.amazon.in/dp/B0DF25H134?psc=1","https://m.media-amazon.com/images/I/51dKWxjeNLL._SX450_.jpg","Ecanvas","N/A","N/A",0,"N/A","N/A",172,"197,748","N/A","N/A",1,"N/A",0,"N/A","N/A",,"Home & Kitchen","N/A","N/A","N/A","N/A","N/A","N/A",,"No","N/A",
39.,"Litmus Ultra-Portable Garment Steamer (Luxury Edition) | Compact & Travel Friendly Clothes Sterilizes & Kills 99.9% Germs and Bacteria (Champagne Gold & White)","B08HX7VJ45","https://www.amazon.in/dp/B08HX7VJ45?psc=1","https://m.media-amazon.com/images/I/51mjjuhnTnL._SX466_.jpg","LITMUS","2,295","N/A",0,"N/A","N/A",159,"199,839","N/A","N/A",2,3.4,83,"N/A","N/A","Brand Deals.","Home & Kitchen","N/A","FBA","N/A","N/A","N/A","N/A",,"No","N/A","Brand Deals."
40.,"Beautural Clothes Steamer, Foldable Handheld Clothing Wrinkles Remover For Garments, Portable Mini Fabric Steam Iron Home And Travel, 1000 Watts, Watts","B0C1NRX18H","https://www.amazon.in/dp/B0C1NRX18H?psc=1","https://m.media-amazon.com/images/I/51bnrIZhY+L._SY450_.jpg","Beautural","N/A","N/A",0,"N/A","N/A",151,"180,449","N/A","N/A",1,3.6,"14,652","N/A","N/A",,"Home & Kitchen","N/A","N/A","N/A","N/A","N/A","N/A",,"No","N/A",
41.,"AARKRI SALES Garment Fabric Steamer Iron For Clothes, Handheld Facial Steamer For Face, 2 In 1 Portable Steamer With Fast Heat-Up Perfect For Home Travel- Rz-608 Steam Vaporizer(Multi Color)1000 Watts","B0CH5CPMT8","https://www.amazon.in/dp/B0CH5CPMT8?psc=1","https://m.media-amazon.com/images/I/51grOD0+w8L._SY450_.jpg","AARKRI SALES",731,"N/A",0,"N/A","N/A",200,"203,470","N/A","N/A",1,3.1,21,"N/A","N/A","AARKRI SALES","Home & Kitchen","N/A","FBA","N/A","N/A","N/A","N/A",,"No","N/A","AARKRI SALES"
42.,"Mini Portable Handheld Steam Iron with Spray, Mini Garment Steamer for Clothes, Dry & Wet Ironing, Fast Heating Travel Iron for Home, Office & Travel (Green Colour)","B0GDDS96DG","https://www.amazon.in/dp/B0GDDS96DG?psc=1","https://m.media-amazon.com/images/I/51Y48IPJn3L._SX569_.jpg","OG Product",489,"N/A",0,"N/A","N/A",164,"205,219","N/A","N/A",1,"N/A",0,"N/A","N/A","OG Product..!!","Home & Kitchen","N/A","FBA","N/A","N/A","N/A","N/A",,"No","N/A","OG Product..!!"
43.,"Multi-Purpose Handheld Pressurized Steam Cleaner with 9-Piece Accessories, Handheld Steamer Perfect for Stain Removal, Curtains, Car Seats, Floor, Bathroom, Window Cleaning (Yellow)","B0F26RJ44T","https://www.amazon.in/dp/B0F26RJ44T?psc=1","https://m.media-amazon.com/images/I/51u6EPa1jIL._SX450_.jpg","BLURISM","1,999","N/A",0,"N/A","N/A",181,"208,991","N/A","N/A",1,5,1,"N/A","N/A","BLURISM","Home & Kitchen","N/A","FBA","N/A","N/A","N/A","N/A",,"No","N/A","BLURISM"
44.,"Garment Steamer for Clothes, Steam Iron Press, 250 ml Water tank, 25g/min Strong Penetrating Steam, 1600W, 25-Sec Fast Heat-up, for Home, Office (green)","B0BX44LTSJ","https://www.amazon.in/dp/B0BX44LTSJ?psc=1","https://m.media-amazon.com/images/I/714fbfNSS4L._SX466_.jpg","Reemix","1,799","N/A",0,"N/A","N/A",152,"211,850","N/A","N/A",1,4.3,620,"N/A","N/A","ECOMZIO","Home & Kitchen","N/A","FBA","N/A","N/A","N/A","N/A",,"No","N/A","ECOMZIO"
45.,"Steamer for Facial Handheld Garment Steamer Portable Family Fabric Steam Brush, Facial Steamer, Nose Steamer for Cold and Cough (PACK OF 1)","B0DK3MNHFH","https://www.amazon.in/dp/B0DK3MNHFH?psc=1","https://m.media-amazon.com/images/I/21nJ4s+LLCL.jpg","ATETO",889,"N/A",0,"N/A","N/A",139,"212,753","N/A","N/A",1,"N/A",0,"N/A","N/A","ATETO","Home & Kitchen","N/A","FBA","N/A","N/A","N/A","N/A",,"No","N/A","ATETO"
46.,"Theorie-Professional-Portable-Mini-Travel-Garment-Steamer-for-Clothes-Steam-Iron-Press-Lightweight-Foldable-Handheld-Travel-Iron-Support-Dry-And-Wet-Wrinkle-Removal-in-Clothes","B0D1W146T8","https://www.amazon.in/dp/B0D1W146T8?psc=1","https://m.media-amazon.com/images/I/51mDLc1ijpL._SX679_.jpg","Theorie",599,"N/A",0,"N/A","N/A",175,"228,318","N/A","N/A",1,2.3,82,"N/A","N/A","GABANI GEMS","Home & Kitchen","N/A","FBA","N/A","N/A","N/A","N/A",,"No","N/A","GABANI GEMS"
47.,"NUOBEIER Steamer for Clothes Steamer, Powerful Handheld Portable Travel Garment Steamer Fabric Wrinkle Remover, 20s Fast Heat-upï¼Å’280ml Large Detachable Water Tank LS","B08DKRXKV2","https://www.amazon.in/dp/B08DKRXKV2?psc=1","https://m.media-amazon.com/images/I/71FXmCxXgJL._SX466_.jpg","NBE","1,999","N/A",0,"N/A","N/A",168,"240,413","N/A","N/A",1,4.4,284,"N/A","N/A","Store2508 Official","Home & Kitchen","N/A","FBA","N/A","N/A","N/A","N/A",,"No","N/A","Store2508 Official"
48.,"New MG MART Garment Steamer for Clothes, Steam Iron Press - Vertical & Horizontal Steaming 30 sec Fast Heating (Pink)","B0CWY6JBPV","https://www.amazon.in/dp/B0CWY6JBPV?psc=1","https://m.media-amazon.com/images/I/31X3IXY+CdL.jpg","MG MART",699,"N/A",0,"N/A","N/A",117,"241,173","N/A","N/A",1,1,1,"N/A","N/A","MG MART®","Home & Kitchen","N/A","FBA","N/A","N/A","N/A","N/A",,"No","N/A","MG MART®"
49.,"Handheld Garment & Fabric Steamer Facial Steamer for Clothes and Face 4 in 1","B0GBWNTN93","https://www.amazon.in/dp/B0GBWNTN93?psc=1","https://m.media-amazon.com/images/I/41gqG52kBiL._SY450_.jpg","JAMMUEL",665,"N/A",0,"N/A","N/A",76,"242,332","N/A","N/A",1,"N/A",0,"N/A","N/A","ZANKHI CREATION","Home & Kitchen","N/A","FBA","N/A","N/A","N/A","N/A",,"No","N/A","ZANKHI CREATION"
50.,"Fast Heat-up Portable Handheld Garment/Facial Vapor Steamer Iron Brush for Home and Travel Handy (Color may Vary)","B07Y3BTF7B","https://www.amazon.in/dp/B07Y3BTF7B?psc=1","https://m.media-amazon.com/images/I/61dKGKXId+L._SX569_.jpg","HEMIZA",729,"N/A",0,"N/A","N/A",113,"242,778","N/A","N/A",1,3.9,317,"N/A","N/A","HEMIZA ENTERPRISE","Home & Kitchen","N/A","FBA","N/A","N/A","N/A","N/A",,"No","N/A","HEMIZA ENTERPRISE"
51.,"Hiware-Professional-Portable-Mini-Travel-Garment-Steamer-for-Clothes-Steam-Iron-Press-Lightweight-Foldable-Handheld-Travel-Iron-Support-Dry-And-Wet-Wrinkle-Removal-in-Clothes","B0CSX8225B","https://www.amazon.in/dp/B0CSX8225B?psc=1","https://m.media-amazon.com/images/I/51WZCAu6CYL._SX522_.jpg","HIWARE","N/A","N/A",0,"N/A","N/A",174,"243,003","N/A","N/A",1,1.6,71,"N/A","N/A",,"Home & Kitchen","N/A","N/A","N/A","N/A","N/A","N/A",,"No","N/A",
52.,"2 IN 1 Nano-Cure Handheld Facial and Garment Steamer with UV Sterilization, Nano-Ionic Technology, 200ml Capacity, White, Portable Steam Vaporizer for Face Care, Cold Relief and Clothes","B0G21LT9NM","https://www.amazon.in/dp/B0G21LT9NM?psc=1","https://m.media-amazon.com/images/I/51grOD0+w8L._SY450_PIbundle-4,TopRight,0,0_AA450SH20_.jpg","DEALBAZAARS CORPORATION",749,"N/A",0,"N/A","N/A",185,"249,004","N/A","N/A",1,"N/A",0,"N/A","N/A","RAMDEV ENTERPRISE..!!","Home & Kitchen","N/A","FBA","N/A","N/A","N/A","N/A",,"No","N/A","RAMDEV ENTERPRISE..!!"
53.,"TheUrbanShop Portable RZ-608 Handheld Facial Steamer and Garment Steam Iron, 350W(Facial)/ 750W(Steamer), Multicolour","B0DY58HYG8","https://www.amazon.in/dp/B0DY58HYG8?psc=1","https://m.media-amazon.com/images/I/519bJg7DxfL._SX425_.jpg","Generic","N/A","N/A",0,"N/A","N/A",117,"250,664","N/A","N/A",1,"N/A",0,"N/A","N/A",,"Home & Kitchen","N/A","N/A","N/A","N/A","N/A","N/A",,"No","N/A",
54.,"2 in 1 Handheld Garment Steamer For Clothes Portable Fabric Steam Brush, Facial Steamer For Face And Nose Cold And Cough - RZ-608 Steam Vaporizer(multicolour)","B0BR26MJYX","https://www.amazon.in/dp/B0BR26MJYX?psc=1","https://m.media-amazon.com/images/I/41VK06+5YtL._SY450_.jpg","Vinsh Enterprise",769,"N/A",0,"N/A","N/A",158,"256,466","N/A","N/A",1,3.6,203,"N/A","N/A","VINSH ENTERPRISE","Home & Kitchen","N/A","FBA","N/A","N/A","N/A","N/A",,"No","N/A","VINSH ENTERPRISE"
55.,"Agaro Signify Handheld Garment Steamer, Horizontal & Vertical Use, Wrinkle Remover, Iron, Fast Heat, Ceramic Steam Nozzle, 1500W, 260 Ml Water Tank, Detachable Fabric Brush, Lint Brush, Black & Blue-1500 Watts","B09PQCSHFC","https://www.amazon.in/dp/B09PQCSHFC?psc=1","https://m.media-amazon.com/images/I/71kHkLLA-PL._SY450_.jpg","AGARO","N/A","N/A",0,"N/A","N/A",209,"256,686","N/A","N/A",1,3.5,146,"N/A","N/A",,"Home & Kitchen","N/A","N/A","N/A","N/A","N/A","N/A",,"No","N/A",
