"Display Order","Product Details","ASIN","URL","Image URL","Brand","Price  ₹","Sales","Variation Sales Strength (1 - 10)","Recent Purchases","Revenue","Title Char. Count","BSR","Seller Country/Region","Fees  ₹","Active Sellers","Ratings","Review Count","Images","Review velocity","Buy Box","Category","Size Tier","Fulfillment","Dimensions","Weight","ABA Most Clicked","Creation Date","Sponsored","Best Seller","Seller Age (mo)","Seller"
1.,"Boat 2025 Launch Rockerz 411, 40Ms Low Latency, 40Hrs Battery, 40Mm Drivers, ENx Tech, Stream Ad Free Music via App Support, Bluetooth Headphones, Wireless Over Ear Headphone with Mic (Active Black)","B0FC2Y8XYF","https://www.amazon.in/dp/B0FC2Y8XYF?psc=1","https://m.media-amazon.com/images/I/71QdB7hDCAL._SX679_.jpg","boAt","1,199","6,767",0,"2,000","8,306,219.27",198,136,"N/A","N/A",1,4.1,"27,741",8,174,"Clicktech Retail Private Ltd","Electronics","Standard Size","FBA","27.60 x 11.20 x 22.70 cm",0.28,"N/A","Jun 5, 2025",,"No",8,"Clicktech Retail Private Ltd"
2.,"pTron Studio Evo 70hrs Playtime Wireless Over Ear Headphones with HD Mic, Low-Latency Game/Movie/Music Modes, Punchy Bass, BT5.3, Dual Device Pairing, Voice Assistant & Type-C Fast Charging (Black)","B0DQ212KP4","https://www.amazon.in/dp/B0DQ212KP4?psc=1","https://m.media-amazon.com/images/I/51ZX74-s9DL._SX425_.jpg","pTron",799,"6,075",0,"2,000","4,852,786.62",197,137,"N/A",265.3,1,4,"1,175",9,148,"Cocoblu Retail","Electronics","Standard Size","FBA","14.80 x 9.40 x 13.70 cm",0.24,"N/A","Dec 10, 2024",,"No",14,"Cocoblu Retail"
3.,"Boat New Launch Rockerz 650 Pro, Touch/Swipe Controls, Dolby Audio, 80Hrs Battery, 2Mics ENx, Fast Charge, App Support, Dual Pair, Bluetooth Over Ear Headphones with Mic (Iris Black)","B0DV5J28LW","https://www.amazon.in/dp/B0DV5J28LW?psc=1","https://m.media-amazon.com/images/I/61-XNG5lPBL._SY450_.jpg","boAt","2,899","6,498",0,"N/A","16,931,094.21",182,170,"N/A",796.29,2,4.1,"3,023",14,208,"Clicktech Retail Private Ltd","Electronics","Standard Size","FBA","23.30 x 5.70 x 22.00 cm",0.42,"N/A","Jan 26, 2026",,"No",1,"Clicktech Retail Private Ltd"
4.,"Boat Bassheads 900 Pro Wired Headphones with 40Mm Drivers, Lightweight Foldable Design, Over Ear, Remote Control, Unidirectional Retractable Mic, Adjustable Headband & USB Type-A Compatibility(Black)","B0DHDDF5J2","https://www.amazon.in/dp/B0DHDDF5J2?psc=1","https://m.media-amazon.com/images/I/71Yid63OspL._SX466_.jpg","boAt",849,"5,475",0,"3,000","4,746,155.17",199,152,"N/A",302.76,2,4.1,"99,831",6,146,"Clicktech Retail Private Ltd","Electronics","Standard Size","FBA","16.40 x 4.70 x 13.50 cm",0.21,"N/A","Jan 31, 2026",,"No",1,"Clicktech Retail Private Ltd"
5.,"pTron Studio Xtreme, 70hrs Playtime, 40ms Low-Latency, Wireless Over Ear Headphones w/Detachable Mic & TruTalk ENC Calls, 40mm Drivers, RGB Lights, BT5.4, Dual Device Pairing & Type-C Charging (Beige)","B0G35411J6","https://www.amazon.in/dp/B0G35411J6?psc=1","https://m.media-amazon.com/images/I/51zRmESiXxL._SY355_.jpg","pTron","1,199",160,0,"N/A","192,293.71",200,409,"N/A",432.85,1,4.2,33,10,15,"Clicktech Retail Private Ltd","Electronics","Standard Size","FBA","5.30 x 18.80 x 21.90 cm",0.3,"N/A","Nov 20, 2025",,"No",3,"Clicktech Retail Private Ltd"
6.,"GOBOULT Fluid X Headphones Bluetooth Wireless with 60H Playtime, 40mm Drivers, Zen ENC Mic, Type-C Charging, Combat™ Gaming, BTv 5.4, Headphones Wireless with mic (Jet Black)","B0FNNB4C7B","https://www.amazon.in/dp/B0FNNB4C7B?psc=1","https://m.media-amazon.com/images/I/61OGCbKb5VL._SX569_.jpg","GOBOULT","1,799","2,006",0,500,"3,878,300.09",174,434,"N/A",606.3,1,3.9,"6,159",14,223,"Clicktech Retail Private Ltd","Electronics","Standard Size","FBA","23.62 x 9.40 x 21.84 cm",0.48,"N/A","Aug 25, 2025",,"No",6,"Clicktech Retail Private Ltd"
7.,"Sony WH-CH720N Active Noise Cancellation Wireless Bluetooth Over Ear Headphones with Mic, Adaptive Sound Control, Quick Charge, Up to 35Hrs Battery, Customized EQ- Black Model : YY2966","B0BS1QCFHX","https://www.amazon.in/dp/B0BS1QCFHX?psc=1","https://m.media-amazon.com/images/I/51rpbVmi9XL._SX466_.jpg","Sony","8,259","1,218",0,"N/A","10,153,881.61",184,440,"N/A","1,934.75",3,4.2,"14,718",13,265,"Clicktech Retail Private Ltd","Electronics","Standard Size","FBA","22.50 x 5.59 x 20.70 cm",0.42,"N/A","Jan 31, 2026",,"No",1,"Clicktech Retail Private Ltd"
8.,"Boat Rockerz 551ANC Bluetooth Hybrid Active Noise Cancellation Over Ear Headphones with Up to 100H Playtime, ASAP Charge, Ambient Sound Mode &Dual EQ Modes, Enx Technology(Stellar Black)","B0BZHRB9J1","https://www.amazon.in/dp/B0BZHRB9J1?psc=1","https://m.media-amazon.com/images/I/61BrerJ+yML._SX679_.jpg","boAt","2,099","12,920",0,"1,000","25,002,350.87",186,427,"N/A",675.93,1,4,"350,073",10,266,"Clicktech Retail Private Ltd","Electronics","Standard Size","FBA","27.80 x 7.50 x 26.50 cm",0.39,"N/A","Dec 22, 2023",,"No",26,"Clicktech Retail Private Ltd"
9.,"GOBOULT Newly Launched Soniq Over Ear Bluetooth Headphones with 70H Playtime, 40mm Bass Drivers, Zen™ ENC Mic, Type-C Fast Charging, Dual Pairing, AUX, Wireless Headphones (White)","B0F9YWD4Z3","https://www.amazon.in/dp/B0F9YWD4Z3?psc=1","https://m.media-amazon.com/images/I/71CzM6hiu6L._SY450_.jpg","GOBOULT","1,799","2,643",0,"N/A","5,143,102.61",179,497,"N/A",533.15,1,3.8,"1,049",15,80,"Clicktech Retail Private Ltd","Electronics","Standard Size","FBA","19.00 x 6.20 x 19.00 cm",0.37,"N/A","May 28, 2025",,"No",9,"Clicktech Retail Private Ltd"
10.,"Boat 2025 Launch Rockerz 421, 60H Battery, Low Latency(40Ms), 40Mm Drivers, Enx Tech, Stream Ad Free Music via App Support, Bluetooth Headphones, Wireless Over Ear Headphone with Mic (Black Sabre)","B0F7M3Q8DV","https://www.amazon.in/dp/B0F7M3Q8DV?psc=1","https://m.media-amazon.com/images/I/71bUXVCt5EL._SY450_.jpg","boAt","1,399","3,033",0,"1,000","3,776,935.34",196,504,"N/A",435.21,1,3.9,"1,660",8,129,"Clicktech Retail Private Ltd","Electronics","Standard Size","FBA","22.70 x 8.20 x 20.00 cm",0.43,"N/A","May 6, 2025",,"No",9,"Clicktech Retail Private Ltd"
11.,"Noise Airwave Max 4 Wireless Over Ear Headphones with 70H Playtime, ENC, 40mm Driver, Low Latency(up to 40ms), Dual Pairing, BT v5.4 (Calm Beige)","B0CY1PL36Q","https://www.amazon.in/dp/B0CY1PL36Q?psc=1","https://m.media-amazon.com/images/I/614Hd3JaGOL._SX466_.jpg","Noise","2,499",266,0,500,"515,723.95",145,439,"N/A",720.77,1,3.7,"4,043",7,51,"Clicktech Retail Private Ltd","Electronics","Standard Size","FBA","29.50 x 6.40 x 24.80 cm",0.42,"N/A","Mar 14, 2024",,"No",23,"Clicktech Retail Private Ltd"
12.,"JBL Tune 770NC Wireless Over Ear ANC Headphones with Mic, Upto 70 Hrs Battery, Speed Charge : 5 min Charge Gives up to 3H of Playback, Customized EQ, Google Fast Pair, Dual Pairing, BT 5.3 (Black)","B09CYX92NB","https://www.amazon.in/dp/B09CYX92NB?psc=1","https://m.media-amazon.com/images/I/61JU2HicMQL._SX466_.jpg","JBL","5,499","2,968",0,"1,000","16,205,402.02",196,553,"N/A","1,319.03",2,4,"10,295",13,360,"Clicktech Retail Private Ltd","Electronics","Standard Size","FBA","22.90 x 6.50 x 22.00 cm",0.45,"N/A","Jun 12, 2023",,"No",32,"Clicktech Retail Private Ltd"
13.,"ZEBRONICS Duke Plus, Wireless Over Ear Headphone with ANC, ENC, Gaming Mode, Dual Pairing, Rapid Charge, Upto 70* Hours Backup, Bluetooth v5.4, AUX, Comfortable Earcushion, Deep Bass (Black)","B0D573NP19","https://www.amazon.in/dp/B0D573NP19?psc=1","https://m.media-amazon.com/images/I/619w5E8UpbL._SX425_.jpg","ZEBRONICS","1,881","1,667",0,"N/A","2,229,685.51",190,750,"N/A",629.62,1,3.8,"16,300",7,94,"Clicktech Retail Private Ltd","Electronics","Standard Size","FBA","26.70 x 9.20 x 23.30 cm",0.45,"N/A","May 25, 2024",,"No",21,"Clicktech Retail Private Ltd"
14.,"Boat 2025 Launch Rockerz 371, 40mm Drivers, 50hrs Battery, 60ms Low Latency, ENx Tech, BT v5.4, Foldable Cups, Voice Assistant, Bluetooth Headphones, Wireless Headphone with Mic (Black Sabre)","B0FM38MRWL","https://www.amazon.in/dp/B0FM38MRWL?psc=1","https://m.media-amazon.com/images/I/61j9YVOfAzL._SY355_.jpg","boAt",999,"2,567",0,"1,000","2,724,210.49",191,831,"N/A",357.34,1,4,57,7,49,"Clicktech Retail Private Ltd","Electronics","Standard Size","FBA","22.90 x 9.00 x 19.90 cm",0.33,"N/A","Aug 12, 2025",,"No",6,"Clicktech Retail Private Ltd"
15.,"Boat 2025 Launch Rockerz Plus 550, Customizable Earcups, 100H Battery, 50mm Drivers, Dual Pair, Stream Ad Free Music via App Support, Bluetooth Headphones, Wireless Headphone with Mic (Blue Psyche)","B0FHHMMJFD","https://www.amazon.in/dp/B0FHHMMJFD?psc=1","https://m.media-amazon.com/images/I/81lYNV0dX3L._SX425_.jpg","boAt","1,999","1,831",0,100,"4,390,694.33",197,"1,213","N/A","N/A",1,4,"65,967",8,106,"Clicktech Retail Private Ltd","Electronics","Standard Size","FBA","25.70 x 9.60 x 20.50 cm",0.41,"N/A","Jul 14, 2025",,"No",7,"Clicktech Retail Private Ltd"
16.,"GOBOULT Mustang Thunder Bluetooth Headphones with Upto 70H Playtime, BoomX Technology, Brightness LEDs, 40mm Driver, Zen ENC Mic, BTv 5.4, Type-C Fast Charging, Over Ear Wireless Headphone with Mic","B0FWJSVD1F","https://www.amazon.in/dp/B0FWJSVD1F?psc=1","https://m.media-amazon.com/images/I/71A0roq73EL._SX466_.jpg","GOBOULT","2,999","1,976",0,500,"5,547,761.44",197,"1,319","N/A","N/A",1,4,"1,084",10,76,"Clicktech Retail Private Ltd","Electronics","Standard Size","FBA","19.10 x 6.70 x 18.60 cm",0.37,"N/A","Oct 16, 2025",,"No",4,"Clicktech Retail Private Ltd"
17.,"GOBOULT Q Over Ear Bluetooth Headphones with 70H Playtime, 40mm Bass Drivers, Zen™ ENC Mic, Type-C Fast Charging, 4 EQ Modes, Made in India, IPX5 Headphones Wireless with mic (Jet Black)","B0G4VYPZ69","https://www.amazon.in/dp/B0G4VYPZ69?psc=1","https://m.media-amazon.com/images/I/6163uYK3eeL._SY450_.jpg","GOBOULT","1,758","1,570",0,400,"2,715,966.58",186,"1,467","N/A","N/A",1,3.9,132,8,63,"Clicktech Retail Private Ltd","Electronics","Standard Size","FBA","19.20 x 6.20 x 19.00 cm",0.36,"N/A","Dec 3, 2025",,"No",2,"Clicktech Retail Private Ltd"
18.,"Sony ULT Wear WH-ULT900N Noise Cancellation Wireless Bluetooth Over Ear Headphones with Massive Bass, Up to 50Hrs Battery-Black","B0CWVX1GNX","https://www.amazon.in/dp/B0CWVX1GNX?psc=1","https://m.media-amazon.com/images/I/610DB8Cwm7L._SX466_.jpg","Sony","14,827","1,216",0,500,"17,905,570.65",127,"1,712","N/A","3,329.79",2,4.3,"3,011",13,145,"Clicktech Retail Private Ltd","Electronics","Standard Size","FBA","23.19 x 7.19 x 20.60 cm",0.65,"N/A","Dec 21, 2025",,"No",2,"Clicktech Retail Private Ltd"
19.,"Portronics Muffs M6 Over Ear Wireless Bluetooth Headphone with Upto 40 Hours Playtime, Dual Pairing, 40mm Driver, HD Mic, Bluetooth 5.4V, Foldable Design, Type C Fast Charging (Biege)","B0G599TLD9","https://www.amazon.in/dp/B0G599TLD9?psc=1","https://m.media-amazon.com/images/I/61ZMTLmF4ZL._SX679_.jpg","Portronics","1,149",848,0,200,"974,601.94",183,"1,736","N/A",474.15,1,4.3,80,8,20,"Clicktech Retail Private Ltd","Electronics","Standard Size","FBA","33.90 x 8.60 x 25.80 cm",0.31,"N/A","Dec 5, 2025",,"No",2,"Clicktech Retail Private Ltd"
20.,"Amazon Basics Wireless Over Ear Headphones, Bluetooth 5.4, 40mm Drivers, 18H Playtime, Foldable Lightweight Design with Aux Support, Deep Bass & Mic, Black","B0FGPQ68XD","https://www.amazon.in/dp/B0FGPQ68XD?psc=1","https://m.media-amazon.com/images/I/51uOUDDAnzL._SX569_.jpg","amazon basics","1,179",968,0,"N/A","1,564,832.9",155,"2,197","N/A","N/A",1,4.1,654,6,66,"Clicktech Retail Private Ltd","Electronics","Standard Size","FBA","17.20 x 8.40 x 15.50 cm",0.36,"N/A","Jul 4, 2025",,"No",7,"Clicktech Retail Private Ltd"
21.,"Boat 2025 Launch Rockerz 412, 60H Battery, 40Mm Drivers, 40Ms Low Latency, ENx Tech, Stream Ad Free Music via App Support, Bluetooth Headphones, Wireless Over Ear Headphone with Mic (Active Black)","B0FC327SXQ","https://www.amazon.in/dp/B0FC327SXQ?psc=1","https://m.media-amazon.com/images/I/71YVHVhNNkL._SX425_.jpg","boAt","1,499","1,046",0,400,"1,394,263.24",196,"2,199","N/A","N/A",1,3.8,404,8,27,"Clicktech Retail Private Ltd","Electronics","Standard Size","FBA","23.10 x 8.20 x 18.10 cm",0.32,"N/A","Jun 5, 2025",,"No",8,"Clicktech Retail Private Ltd"
22.,"AKG K72 Closed Back Studio Over Ear Wired Headphones, Black, Pack of 1","B01AYSNHVQ","https://www.amazon.in/dp/B01AYSNHVQ?psc=1","https://m.media-amazon.com/images/I/71FLGNpk4pL._SY355_.jpg","AKG","2,514",855,0,200,"2,295,406.33",70,"2,233","N/A",571.25,8,4.3,"15,318",10,97,"Cocoblu Retail","Electronics","Standard Size","FBA","23.50 x 11.20 x 22.40 cm",0.54,"N/A","Feb 2, 2016",,"No",120,"Cocoblu Retail"
23.,"Boat 2025 Launch Rockerz 413, 60H Battery, 40Mm Drivers, Dual Pair, ENx Tech, Low Latency, Stream Ad Free Music via App Support, Bluetooth Headphones, Wireless Over Ear Headphone with Mic (Ash Grey)","B0FC2YG6SK","https://www.amazon.in/dp/B0FC2YG6SK?psc=1","https://m.media-amazon.com/images/I/71mcQcNYL0L._SX466_.jpg","boAt","1,499","1,043",0,400,"1,424,093.72",198,"2,340","N/A",503.65,1,3.8,324,7,26,"Clicktech Retail Private Ltd","Electronics","Standard Size","FBA","24.50 x 8.20 x 18.30 cm",0.35,"N/A","Jun 5, 2025",,"No",8,"Clicktech Retail Private Ltd"
24.,"Noise Newly Launched Airwave Max XR Wireless Over-Ear Headphones with 120H Playtime, ANC, HFA Tech, Spatial Audio, Dual Pairing, BT V6.0(Pearl Beige)","B0F9PJJLCT","https://www.amazon.in/dp/B0F9PJJLCT?psc=1","https://m.media-amazon.com/images/I/51lPcFkwYmL._SX569_.jpg","Noise","3,499","1,536",0,200,"5,270,540.65",149,"2,521","N/A",894.23,1,4.2,198,11,20,"Clicktech Retail Private Ltd","Electronics","Standard Size","FBA","23.80 x 6.10 x 22.50 cm",0.59,"N/A","May 23, 2025",,"No",9,"Clicktech Retail Private Ltd"
25.,"truke New Launch Aura Bass V2 Over The Ear Headphone with 50H of Playtime, 40mm Titanium Drivers, Dual Pairing Headset, 40ms Ultra Low Latency, ENC, Premium Design & Comfort - Carbon Black","B0G7FNQWN5","https://www.amazon.in/dp/B0G7FNQWN5?psc=1","https://m.media-amazon.com/images/I/71aVs4AOPML._SX425_.jpg","truke","1,299","2,143",0,600,"2,783,457.83",188,"2,686","N/A",506.01,1,4.1,167,9,68,"Cocoblu Retail","Electronics","Standard Size","FBA","37.90 x 6.70 x 23.10 cm",0.36,"N/A","Dec 16, 2025",,"No",2,"Cocoblu Retail"
26.,"truke Newly Launched BTG 500 Over The Ear Gaming Headphone with 40mm Drivers, 10H of Playtime, Dual Pairing, Gaming Mode (50ms Latency) with RGB LEDs, TF Card with Volume Control, BT 5.4(Metal Black)","B0D9YPR464","https://www.amazon.in/dp/B0D9YPR464?psc=1","https://m.media-amazon.com/images/I/61vXlf46riL._SY355_.jpg","truke",899,716,0,100,"694,683.83",199,"2,741","N/A",313.08,1,4,549,9,33,"Cocoblu Retail","Electronics","Standard Size","FBA","18.60 x 8.60 x 12.30 cm",0.26,"N/A","Jul 23, 2024",,"No",19,"Cocoblu Retail"
27.,"pTron Studio Classic w/ 75Hrs Playtime, Wireless Over Ear Headphones w/HD Mic & TruTalk AI-ENC Calls, Low-Latency Game & Music, Deep Bass, BT5.4, Dual Device Pairing, & Type-C Charging (Black)","B0FPRCRTRN","https://www.amazon.in/dp/B0FPRCRTRN?psc=1","https://m.media-amazon.com/images/I/51B4bKd3VbL._SX466_.jpg","pTron",898,"1,479",0,400,"1,328,443.54",192,"2,973","N/A",336.48,1,3.7,235,9,37,"Cocoblu Retail","Electronics","Standard Size","FBA","18.20 x 9.00 x 15.10 cm",0.3,"N/A","Sep 5, 2025",,"No",5,"Cocoblu Retail"
28.,"ZEBRONICS Thunder NEO, Wireless Over Ear Headphone, Upto 60 Hours Backup, Gaming Mode, Dual Pairing, Rapid Charge, BT v5.4, AUX, 3 EQ Modes, ENC for Callling, Voice Assistant, Deep Bass (Black)","B0FDPZ868C","https://www.amazon.in/dp/B0FDPZ868C?psc=1","https://m.media-amazon.com/images/I/61mMKGa2hHL._SX522_.jpg","ZEBRONICS",949,796,0,200,"696,169.69",193,"3,020","N/A",347.01,2,4.2,237,7,40,"WIZARD TECH","Electronics","Standard Size","FBA","24.10 x 9.20 x 19.10 cm",0.36,"N/A","Jun 19, 2025",,"No",8,"WIZARD TECH"
29.,"ZEBRONICS Thunder Pro Wireless Over Ear Headphone with Dual Pairing, Gaming Mode, Enc, Bluetooth, Call Function, Aux, Micro Sd, Voice Assistant, Deep Bass, Up to 60H Backup (Olive Green)","B0CTXGDCSB","https://www.amazon.in/dp/B0CTXGDCSB?psc=1","https://m.media-amazon.com/images/I/71ZbTELN7RL._SX425_.jpg","ZEBRONICS",999,"4,983",0,200,"3,923,368.99",186,291,"N/A",357.34,2,3.8,"82,183",7,"N/A","Clicktech Retail Private Ltd","Electronics","Standard Size","FBA","21.20 x 8.40 x 18.70 cm",0.38,"N/A","Oct 28, 2025",,"No",4,"Clicktech Retail Private Ltd"
30.,"Noise Airwave Max 5 Wireless Over-Ear Headphones with Adaptive Hybrid ANC (up to 50dB), HFA Tech, 80H Playtime, Dual Pairing(Mauve Haze)","B0FS1SD28Q","https://www.amazon.in/dp/B0FS1SD28Q?psc=1","https://m.media-amazon.com/images/I/5108ZIJda0L._SY450_.jpg","Noise","4,499","1,162",0,200,"5,624,509.28",136,"3,435","N/A","1,136.13",1,4.1,530,12,17,"Clicktech Retail Private Ltd","Electronics","Standard Size","FBA","25.30 x 5.70 x 22.60 cm",0.7,"N/A","Sep 22, 2025",,"No",5,"Clicktech Retail Private Ltd"
31.,"JBL Live 770NC True Adaptive Noise Cancellation Headphones Wireless Over Ear, Spatial Sound, 65Hrs Playtime, Speed Charge, Multipoint Connect & Personi-Fi 2.0, Customized EQ, Google Fast Pair, Black","B0CHMN4KVN","https://www.amazon.in/dp/B0CHMN4KVN?psc=1","https://m.media-amazon.com/images/I/71dnHOwbEqL._SX522_.jpg","JBL","8,999",482,0,200,"4,894,248.49",198,"3,567","N/A","2,089.57",2,4.2,"5,327",16,259,"Clicktech Retail Private Ltd","Electronics","Standard Size","FBA","24.00 x 7.50 x 20.60 cm",0.47,"N/A","Jan 31, 2026",,"No",1,"Clicktech Retail Private Ltd"
32.,"Cosmic Byte GS430 Gaming wired over ear Headphone, 7 Color RGB LED and Microphone","B0859KTNZ8","https://www.amazon.in/dp/B0859KTNZ8?psc=1","https://m.media-amazon.com/images/I/7154EWu-5LL._SY450_.jpg","Cosmic Byte",999,435,0,300,"434,609.45",81,"3,754","N/A","N/A",2,4,"10,028",8,25,"Clicktech Retail Private Ltd","Electronics","Standard Size","FBA","23.50 x 10.20 x 18.90 cm",0.41,"N/A","Feb 28, 2020",,"No",72,"Clicktech Retail Private Ltd"
33.,"Noise Master Buds Max, Sound by Bose Wireless Over-Ear Headphones, Adaptive ANC, LHDC 5.0, Immersive Spatial Audio, Upto 60H Playtime, Fast Pairing, Wear Detection(Onyx)","B0F8HP1HBR","https://www.amazon.in/dp/B0F8HP1HBR?psc=1","https://m.media-amazon.com/images/I/61eSXFi9nQL._SX466_.jpg","Noise","9,999",249,0,50,"2,594,703.93",169,"3,762","N/A","2,309.05",1,4.3,128,7,11,"Clicktech Retail Private Ltd","Electronics","Standard Size","FBA","24.60 x 6.40 x 21.90 cm",0.74,"N/A","Oct 14, 2025",,"No",4,"Clicktech Retail Private Ltd"
34.,"Portronics Muffs M2 Bluetooth Headphones Over Ear with Upto 40 Hrs Playtime, 40mm Dynamic Drivers, AUX 3.5mm, Powerful Bass, Laptop & PC Support, Type C Charging Port, Foldable Design(White)","B0C4HDNDGN","https://www.amazon.in/dp/B0C4HDNDGN?psc=1","https://m.media-amazon.com/images/I/51OpXOQc0PL._SX425_.jpg","Portronics",999,"1,267",0,500,"1,223,386.79",190,"2,185","N/A","N/A",3,3.9,"1,229",8,49,"Clicktech Retail Private Ltd","Electronics","Standard Size","FBA","21.40 x 6.20 x 17.80 cm",0.23,"N/A","May 6, 2023",,"No",33,"Clicktech Retail Private Ltd"
35.,"realme TechLife Studio H1 Over The Ear Over Ear Wireless Headphone with 70Hours Playtime 360° Spatial Audio, 40mm Drivers, 80ms Superlow Latency, 43 dB Adaptive ANC-Black","B0DJFHBQH2","https://www.amazon.in/dp/B0DJFHBQH2?psc=1","https://m.media-amazon.com/images/I/715wH-KhfYL._SX425_.jpg","realme","3,999",728,0,200,"2,840,549.9",170,"3,793","N/A","1,029.93",1,4,410,13,26,"Cocoblu Retail","Electronics","Standard Size","FBA","23.20 x 5.60 x 21.50 cm",0.42,"N/A","Oct 20, 2024",,"No",16,"Cocoblu Retail"
36.,"boAt 2025 Launch Rockerz 512 Anc, 40Db Hybrid Anc, 80Hrs Playback, 40Mm Drivers, 40Ms Latency Beast Mode, Enx Tech, App Support, Over Ear Bluetooth Headphones, Wireless Headphone With Mic (Bold White)","B0FG2PWNRC","https://www.amazon.in/dp/B0FG2PWNRC?psc=1","https://m.media-amazon.com/images/I/51GsMneNVBL._SX522_.jpg","boAt","2,999","2,518",0,200,"7,210,143.04",200,489,"N/A",817.53,1,4.2,"30,554",10,127,"Clicktech Retail Private Ltd","Electronics","Standard Size","FBA","24.50 x 6.60 x 22.60 cm",0.56,"N/A","Jun 30, 2025",,"No",8,"Clicktech Retail Private Ltd"
37.,"Sony WH-1000XM6 The Best Wireless Noise Canceling Headphones, HD NC Processor QN3, 12 Microphones, Adaptive NC Optimizer, Mastered by Engineers, Studio-Quality- Black","B0F3PQHWTZ","https://www.amazon.in/dp/B0F3PQHWTZ?psc=1","https://m.media-amazon.com/images/I/61ddahpESML._SY679_.jpg","Sony","39,990",754,0,200,"29,161,112.36",166,"4,183","N/A","8,462.02",1,4.5,"2,213",14,185,"Clicktech Retail Private Ltd","Electronics","Standard Size","FBA","25.50 x 7.60 x 19.90 cm",0.68,"N/A","Sep 25, 2025",,"No",5,"Clicktech Retail Private Ltd"
38.,"HP H200 Wireless Headset","B0DHKJ5HWL","https://www.amazon.in/dp/B0DHKJ5HWL?psc=1","https://m.media-amazon.com/images/I/71Yl4L6JVML._SX466_.jpg","HP","1,299",707,0,100,"1,151,943.8",24,"4,241","N/A","N/A",3,4.1,"1,261",6,65,"Clicktech Retail Private Ltd","Electronics","Standard Size","FBA","23.00 x 8.10 x 17.40 cm",0.28,"N/A","Sep 20, 2024",,"No",17,"Clicktech Retail Private Ltd"
39.,"Blaupunkt Newly Launched BH41 Bluetooth Wireless Over Ear Headphones I Long Playtime I 40MM Drivers I Foldable I Flexible & Light Weight I Built in Mic I TurboVolt Fast Charging","B0CGRCT77W","https://www.amazon.in/dp/B0CGRCT77W?psc=1","https://m.media-amazon.com/images/I/713tn9TU1IL._SX466_.jpg","Blaupunkt","1,497",309,0,100,"485,167.04",177,"4,470","N/A","N/A",2,4.1,"1,182",7,39,"Clicktech Retail Private Ltd","Electronics","Standard Size","FBA","22.30 x 9.70 x 19.00 cm",0.29,"N/A","Aug 28, 2023",,"No",30,"Clicktech Retail Private Ltd"
40.,"JBL Quantum 100M2 Wired Gaming Headphones, Supports Windows sonic spatial audio, 40mm Realistic Dynamic Drivers, Omnidirectional Detachable Mic, Breathable Memory Foam cushions, PC/Xbox/PS/3.5mm-Black","B0D6NLHV8N","https://www.amazon.in/dp/B0D6NLHV8N?psc=1","https://m.media-amazon.com/images/I/61KmVBD4ZfL._SX569_.jpg","JBL","2,999",451,0,100,"1,312,328.65",200,"3,978","N/A",867.09,1,4.4,"4,506",7,330,"Clicktech Retail Private Ltd","Electronics","Standard Size","FBA","29.00 x 7.60 x 23.20 cm",0.42,"N/A","Sep 14, 2024",,"No",17,"Clicktech Retail Private Ltd"
41.,"GM G+ Headphones, Over The Ear Headphones with Mic, BT 5.3, Pure Bass, 45ms Low Latency, Dual Pairing, 4 Play Modes (FM, Radio, SD Aux) 55H Playtime - White","B0CT2P4TXP","https://www.amazon.in/dp/B0CT2P4TXP?psc=1","https://m.media-amazon.com/images/I/616txbDQCnL._SX466_.jpg","GM","1,849",292,0,100,"493,671.28",156,"4,880","N/A","N/A",1,4.3,293,8,14,"Clicktech Retail Private Ltd","Electronics","Standard Size","FBA","25.20 x 8.90 x 20.50 cm",0.54,"N/A","Jan 23, 2024",,"No",25,"Clicktech Retail Private Ltd"
42.,"Boat Rockerz Trendz, 40mm Drivers, 50hrs Battery, 60ms Low Latency, ENx Tech, BT v5.4, Foldable Cups, Voice Assistant, Bluetooth Headphones, Wireless Headphone with Mic (Black Sabre)","B0FRSPKL34","https://www.amazon.in/dp/B0FRSPKL34?psc=1","https://m.media-amazon.com/images/I/61ppR1KR+iL._SX569_.jpg","boAt",998,986,0,500,"1,068,917.68",182,"5,082","N/A",406.69,2,3.9,36,7,23,"CoreMart Shopping","Electronics","Standard Size","FBA","33.79 x 8.40 x 23.00 cm",0.32,"N/A","Sep 19, 2025",,"No",5,"CoreMart Shopping"
43.,"HAMMER Bash Max Over The Ear Wireless Bluetooth Headphones with Mic, Touch Control, Deep Bass, Upto 40 Hours Playtime, Bluetooth 5.3, Workout/Travel (Black)","B0CBFZYZM6","https://www.amazon.in/dp/B0CBFZYZM6?psc=1","https://m.media-amazon.com/images/I/61Qwi91REJL._SX569_.jpg","HAMMER","1,999",336,0,50,"659,850.21",156,"5,129","N/A","N/A",1,3.8,"3,828",8,19,"Cocoblu Retail","Electronics","Standard Size","FBA","25.40 x 6.20 x 22.70 cm",0.53,"N/A","Jul 8, 2023",,"No",31,"Cocoblu Retail"
44.,"soundcore by Anker Q20i Wireless Bluetooth Over-Ear Headphones with Hybrid Active Noise Cancelling, 40h Playtime in ANC Mode, Hi-Res Audio, Deep Bass, Personalization via App (Black)","B0CQXMXJC5","https://www.amazon.in/dp/B0CQXMXJC5?psc=1","https://m.media-amazon.com/images/I/51CnDMbXZzL._SY741_.jpg","soundcore","N/A",875,0,"N/A","3,763,481.73",182,"5,188","N/A","N/A",1,4.3,"54,800",10,"2,539",,"Electronics","Standard Size","FBA","23.30 x 6.20 x 18.40 cm",0.41,"N/A","Feb 8, 2024",,"No",24,
45.,"Portronics Muffs M5 Over Ear Hybrid ANC Bluetooth Headphone with Upto 50 Hours Playtime, Quad Mic, Transparency Mode, Gaming/Music Mode, BT V5.3, Adjustable Fit, Type C Fast Charging(Black)","B0FMFMXYYM","https://www.amazon.in/dp/B0FMFMXYYM?psc=1","https://m.media-amazon.com/images/I/61hkq9fekmL._SY450_.jpg","Portronics","1,999",160,0,100,"320,434.78",189,"5,422","N/A",605.13,1,4.2,78,9,14,"Clicktech Retail Private Ltd","Electronics","Standard Size","FBA","17.30 x 9.10 x 16.50 cm",0.38,"N/A","Aug 14, 2025",,"No",6,"Clicktech Retail Private Ltd"
46.,"Sennheiser ACCENTUM Plus Wireless Over Ear Headphones, German Design, Adaptive ANC, 50H Battery, Sound Personalization, Touch Control, Multipoint Connectivity, Clear Calls, 10Min Charge = 5H, 2Y Warranty, Black","B0CQKDKPS6","https://www.amazon.in/dp/B0CQKDKPS6?psc=1","https://m.media-amazon.com/images/I/71Q-uiqUGSL._SY355_.jpg","Sennheiser","14,990",246,0,100,"3,707,456.82",210,"5,445","N/A","3,334.92",1,4.1,"1,246",11,61,"Clicktech Retail Private Ltd","Electronics","Standard Size","FBA","23.70 x 6.10 x 19.41 cm",0.54,"N/A","Jan 24, 2024",,"No",25,"Clicktech Retail Private Ltd"
47.,"PerfX P47 Wireless Bluetooth Over-Ear Headphones with Deep Bass, Foldable Design, HD Mic Soft Cushioned Earpads for Music, Calls (White)","B0GF72M835","https://www.amazon.in/dp/B0GF72M835?psc=1","https://m.media-amazon.com/images/I/51DK5eEfn3L._SY355_.jpg","PerfX",299,116,0,50,"36,459.68",136,"5,493","N/A",195.88,3,5,1,5,0,"ANANYAENTERPRISES00","Electronics","Standard Size","FBA","5.00 x 15.00 x 8.00 cm",0.15,"N/A","Jan 6, 2026",,"No",1,"ANANYAENTERPRISES00"
